69	0,10655	soldado enemigo jefe fuego ejército fuerza tropa plaza arma coronel combate columna orden campo general cañón ciudad capitán pueblo cuerpo batalla guerra fusil ataque cuartel teniente caballo francés camino sangre artillería sargento bandera caballería batallón movimiento bala marcha cadáver campamento victoria línea cerro grupo tiro prisionero posición defensa compañero héroe 
70	0,02452	condesa barón alcalde rey dama marqués palacio conde corte alguacil reina castillo cámara príncipe instante maese escudero puerta nobleza personaje año do modo prima baronesa habitación primo tío poder monarca infante presencia granuja doncella jardín pie señoría duque criado rajador gloria condestable mesa lugar gente taberna capitán plaza velada favor 
71	0,11118	gobierno ministro gobernador pueblo guerra revolución presidente jefe país secretario orden partido poder tropa autoridad gente política fuerza plan noticia ejército plaza arma independencia libertad mando general ley papel nación enemigo capital palabra despacho elemento coronel mes año campaña diputado comisión patria junta acto derecho dinero voz salón confianza situación 
72	0,03886	negro esclavo amo mulato ingenio finca mayoral campo blanco calesero caña azúcar ama castigo color menudo machete raza esclavitud cafetal perro trabajo tabaco negros merced criollo odio bohío lector año isla oficio época ocasión café látigo falta carácter embargo vivienda cuero país batey servicio compañero esclavos sangre mulata quitrín ciudad 
73	0,05504	abogado bien pleito heredero título herencia dinero riqueza voluntad nobleza señorito fortuna acto caballero criado documento testamento cantidad esposo muerte viudo escribano efecto hacienda dote palacio posesión cuerpo estado castillo matrimonio amor virtud favor honra caudal objeto alma justicia trabajo administración orgullo derecho manera negocio propiedad escritura caridad secreto raza 
74	0,00879	deán prepósito jesuíta conde caballero provincia gobernador socio comisario judío embargo maestre obispo dominico cabildo orden colegial capitán palacio asunto puerta presencia suceso especie negocio ánimo esposo objeto silencio efecto sitio bien regidor rey colegio año usarced visita aire prelado historia pie mesa dama escena pieza confesor comisionado villa tribunal 
75	0,17012	cielo agua luz voz nube montaña viento sol silencio fuego fondo sombra piedra tierra horizonte roca alma aire valle rayo mirada mar árbol pie lluvia rumor tempestad grito eco luna ruido corazón río torrente llama camino muerte bosque relámpago suelo abismo espacio ciudad sitio seno desierto tumba oro soledad trueno 
76	0,00229	ojos amor corazón niña música voz cabeza fisonomía mirada frente flores años vd ángel piano labios jóvenes ventana manos lágrimas lado balcón palabras luna habitación manera poeta mesa acento lecho días juventud hija oro cuerpo horas hermana patio hermosura multitud perfume veces libro efecto rostro expresión dulzura hacienda aire noches 
77	0,00105	estudiante esqueleto cráneo examen bolsa años año estudio puerta viento hospital huesos cara memoria mesa costilla figura ciencia doctor mirada curiosidad rincón novela modo sociedad médico tarjeta rumor salón color gabinete claustro patio hueso país compañero techo café pie armario programa perfume pizarra bigote filosofía aspecto número escalera preguntas paredes 
78	0,02602	caballo paisano gaucho sargento partida gente pulpería indio soldado alcalde daga capitán guitarra rancho manera teniente cabeza trabuco campo puñalada camino voz prenda pico mirada sable muerte justicia lado corazón partido espíritu plaza compadre toldo mate quinta baile vuelta puerta copa campaña alegría plata pago expresión arma cintura miedo rebenque 
79	0,24953	boca cabeza muchacho pie cara gente perro pierna agua carne aire cuerpo sombrero nariz diablo vuelta suelo dedo mozo lengua grito chico gesto oreja puerta diente gato barba calle pelo risa punta sol piedra hombro camisa espalda animal pata palo fondo ropa pared voz rato hueso golpe fuego vergüenza pantalón 
