0	0,07143	vd fraile muchacho voz ojos tía copa rostro guitarra habitación playa secreto flores tarde moneda extremo vela mañana palabra ciudad oro naturaleza café mar fistol caballero muerte corazón piedra manos diablo miedo enferma frente oficio aire sombra sueño mesa sillón partida lado fisonomía covacha portero bolsillo idea expresión cabeza pana 
1	0,07143	misia tienda calle madama doctor chico marido mostrador cabeza despacho plaza ordenistas cara patio patrón iglesia lía club muchacho acera juez voz paz coche esquina pan aldea papá puerta gusto alcoba gracia costumbre negro pueblo trabajo frase mistress oro tendero traje ordenista ñ_a señorito pelo cesta partido chimenea comedor lengua 
2	0,07143	v_d doctor instante palabra vista corazón sitio esposo objeto puerta manera idea asunto amante felicidad embargo sentimiento h_u fortuna gracia pieza lado juego duda do temor esperanza cuaderno alma mendigo cuarto virtud pecho sociedad mesa placer flor amistad coche inocencia protector razón calle criado desgracia atención pena semblante educación tierra 
3	0,07143	tienda luz socio clase par aire copa aspecto mozo sociedad establecimiento título placer mostrador ciudad barbas existencia fortuna menudo suerte entrada servicios amigos edad fiesta tarde personaje carácter matrimonio gesto género ramo humor puesto compañero lugar tez gas iglesia pregunta hacendado trabajo fondo recursos capital carrera época uso sitio periódicos 
4	0,07143	capitán coronel jefe teniente gobernador comandante orden soldado ejército general fuerza servicio caballo cuerpo cuartel tropa papel guardia plaza mando ciudad regimiento voz compañero arma carta enemigo campaña espada marcha ayudante gobierno despacho fortuna confianza revolución deber caballería pliego patriota gente gracia valiente compañía correo cabeza autoridad carácter sargento causa 
5	0,07143	posadero pleito muerte posada educación abogado fortuna vuelta esposa viuda embargo dinero año años hermana honradez hacienda cariño justicia niña huésped marido finca pena edad tenia lado cuidado amistad viaje criados amigos habitación corazón capital administración litigio orden bobo carácter presencia país talego manera ingenio sentimientos nobleza raza lugar miseria 
6	0,07143	rostro sol oro sangre mancebo boca ciudad instante fondo orgullo pie morisco aire espada guerra sable pecho hidalgo soldado gesto silencio tarde cuadra muerte estancia dedo rumor rey partida merced gloria mulo piedra montonera pupila blancura frente pierna azar sierra olor plata presa grupo voz joya piel godo sombra bestia 
7	0,07143	palabra asunto razón modo manera efecto motivo duda idea amor situación ocasión puerta embargo deseo circunstancia camino caballero noticia fuerza confianza causa atención conversación relación falta muchacho objeto interés voz cabeza ánimo silencio tono visita orden intención conducta lugar desgracia principio propósito corazón plan resolución lado criado temor golpe suerte 
8	0,07143	tío sobrino muchacho primo virrey oro lado cabeza habitación fortuna tía vino chico destino marqués camino gente modo cuarto libro recomendación baúl ropa muelle compadre movimiento plata sombrero espalda embargo piloto negocio abrazo carácter género humor favor cura cuello camisa gusto año partido palabra fuerza par compañía luz cama terror 
9	0,07143	dinero negocio fortuna trabajo capital manera oro cuenta mes suma calle escritorio papel cantidad gasto asunto miseria precio año dueño relación interés peso situación comercio crédito modo gente confianza idea carta bolsillo viaje sociedad patrón clase servicio embargo lado sueldo deuda socio posición documento comerciante género recurso caja mueble dependiente 
10	0,07143	calle ciudad calles gente luz casas puertas ojos lluvia plaza cielo fondo viento oro hombres suelo atmósfera sombrero coche agua calor sol lado puerta cosas polvo noches partes cochero paredes país años balcones aire hombros paraguas cabeza gritos días color voces cara manos ventanas veces interior vidrios edificios camino escuela 
11	0,07143	gobierno pueblo rastro policía hombres cuartel amigos jefe autoridad paisanos asesino alcalde guerra línea ciudad provincia camisa provincias soldados gente extremo ejército caballos cuerpos manera cama clase plaza vecindario jefes fuerzas libertad tropas paisano país partido montoneros años rosas loco falta servicio cosas causa remedio vereda diario suelo cuerpo rastreador 
12	0,07143	cuerpo alma cabeza corazón sangre silencio lado rato luz tierra médico calle sol sombra cielo dolor cama hogar voz brazo pecho cuarto espíritu palabra carne frente miedo muerte cara esplendor alegría amor año pasión aire trabajo rostro grito marcha comedor ciudad trabajador enfermo frío hambre ímpetu seda patio gloria pared 
13	0,07143	instante puerta palabra duda cabeza voz mirada sonrisa calle año labio choza semblante brazo mañana lugar alegría corazón objeto caballero anciano aposento presencia pirata grito vista papel provincia pensamiento acento ademán atención asombro fray villa casita capitán silla memoria silencio embargo sangre hoja árbol acero pie barrio carta espanto dedo 
14	0,07143	mar buque agua costa capitán tierra puerto bote playa marinero ola viento viaje barco muelle embarcación cubierta vela inglés orilla pirata isla marino río gente compañero vapor popa lancha canal pasajero vista proa oro bahía nave goleta marzo rumbo ciudad remo barca palo lado canoa grupo bergantín tripulación suerte pescador 
15	0,07143	mesa copa vino botella vaso plato café comida voz comedor pie rostro trago cabeza agua cocina palabra silencio convidado carne mozo licor lado coñac carcajada honor brindis fonda estómago apetito risa banquete salud mantel cocinero compañero boca cerveza dinero labio sombrero servicio silla taza fiesta olor cena conversación pan humo 
16	0,07143	ojos años hija veces palabras manos hombres días mujeres amigos niña labios corazón puerta cosas hijos brazos padres personas amor cabeza aire jóvenes lágrimas luz horas alma esposa momentos boca voz vista razón rostro calles ideas meses ciudad edad pies silencio cuerpo tierra señorita pasos gracias manera carácter embargo flores 
17	0,07143	esclavo ciudad dios instante pieza do sitio templo sacerdote calle lado edificio vista palabra oro puerta tenia gladiador columna estatua mármol pintura multitud pueblo pared ceniza agua piedra pórtico tierra virtud anfiteatro amo forma entrada año manera cabeza altar objeto bronce placer riqueza carro traje vino belleza rostro número esposo 
18	0,07143	corazón mirada amor alma voz rostro palabra acento cabeza frente pensamiento año expresión sonrisa embargo instante fisonomía placer vista sentimiento ángel anciano cielo objeto aire poeta ventana emoción felicidad silencio pasión flor lado alegría pecho doncella esperanza conversación duda efecto semblante imagen labio amante ternura imaginación belleza lecho edad recuerdo 
19	0,07143	hermana luz sol rostro cielo hermanas mañana alma ciudad corral seda niña ojos sueño aire edad ánimo flores alegría tierra espíritu flor patio cuerpo suelo hijas ventana salida iglesia huerta ama belleza mulata bahía expresión cinta hermosura gracia calle libros júbilo modo muerte gente mariposa merced do amor muchacho pueblo 
20	0,07143	convento iglesia sacerdote sor fraile monje altar misa templo voz fray religioso religión oración celda claustro capilla santo ciudad año sacristán procesión campana coro superiora hábito lugar puerta hereje obispo pecado alma abadesa cielo gente capellán cruz comunidad rosario orden gracia confesor voto maestro imagen merced sacristía criatura confesión fe 
21	0,07143	carta corazón amor año palabra papel criado mamá papá mesa cuarto cariño mes calle lágrima retrato señorito viaje letra recuerdo prima mañana idea libro visita deseo felicidad noticia tarde ciudad esposo alma lectura tío duda beso carruaje pie amante ángel esperanza coche objeto balcón rato ama gracia modo colegio puerta 
22	0,07143	muchacho puerta dinero criado calle coche año gente vecino cuarto trabajo lugar amo agua ropa ladrón llave recámara oro tienda mes cochero ama pobre voz vela alhaja manera pieza tarde pasajero hambre portero sombrero mesa pueblo camisa cara cocina cama palabra cabeza peso criatura plata hacienda patio suelo diligencia miedo 
23	0,07143	estudiante tren viaje cráneo esqueleto sabio ciudad voz modo mesa sesión salón agua lucha palabra chimenea caja mañana bolsa relación cuestión viento armario lector objeto razón aposento lobo embargo ciencia huesos sueño nota colección frío idioma estación aire placer compañero berlinés darwinista hueso alemán entrada instante individuo médico música tarjeta 
24	0,07143	caballo hacienda camino rancho amo pueblo muchacho brazo instante cuidado mozo palabra cabeza bandido silla dinero gente sombrero administrador pie ranchero gusto razón cara fuerza cerro toro año maestro arriero mulo animal muías prefecto corral cura compadre lado sangre plateado voz merced valle favor campo compañero lágrima rumbo plaza orden 
25	0,07143	caballo paisano gaucho cabeza unitario partida gente puerta soldado pulpería calle manera daga bandido golpe muerte mazorca orden asesino salvaje alcalde lado cuchillo mirada sable puñal guitarra espíritu trabuco rancho sargento palabra miedo voz cuerpo justicia cintura arma puñalada policía sereno valor vuelta diablo cara camino sangre mate partido expresión 
26	0,07143	cuerpo brazo calle ocasión sueño muerte luz vera sol amor año vivienda carne caricia beso memoria pensamiento instante fuerza rincón cerebro chico santo cambio tranvía jardín principio sitio cariño llanto rumor risa juventud recuerdo cara tarde grupo existencia sombra chiquillo gendarme respuesta muchacho fondo hombro par rumbo muro individuo labio 
27	0,07143	mar vista ciudad navío castillo costa fondo baluarte agua puerta calle sol nave cara aire buque fortaleza puerto viento lado miliciano parapeto muro pie litoral puente arrabal caballero flota tahona rampa patrón voz muralla tarde fuego corazón calzada semblante nube granito curiosidad grupo criatura boca milicia campo año iglesia panadero 
28	0,07143	ejército jefe soldado manera enemigo tropa fuerza prisionero coronel orden arma marcha batalla combate provincia guerra campamento caballo caudillo ciudad lado campaña acto gente cuerpo elemento muerte caballería palabra golpe gobierno infantería fraile noticia situación peligro montonero triunfo herida grupo campo persecución camino fuego regimiento paz carga línea duda movimiento 
29	0,07143	mono capitán doctor gorila palabra razón eslabón naturaleza especie ciudad siglo río negro época efecto autor hembra tipo honor modo tribu duda cola chimpancé ángulo obra amor fruto orang animal tierra terreno brazo palo gibón menudo forma cuello rival prueba pilotín salvaje isla género origen viajero cráneo mar cara raza 
30	0,07143	esposo marido matrimonio novio año boda casamiento felicidad alma cariño viudo ceremonia abuelo hogar anciano amor fortuna criado enlace padrino edad lecho brazo suegro dama beso rostro bendición iglesia fiesta presencia pecho lujo pariente vecino unión seno trabajo flor traje luz escena regalo mes cabello dicha yerno deber consorte habitación 
31	0,07143	corazón amor alma lágrima dolor felicidad palabra pasión sentimiento amante desgracia cielo esperanza esposo cariño pensamiento muerte ser virtud brazo placer labio lado pecho pena existencia fuerza ángel razón tierra dicha deber ilusión bien idea mirada afecto recuerdo destino rostro mal voluntad criatura deseo porvenir instante pesar llanto ternura consuelo 
32	0,07143	juez policía duelo comisario agente sangre barón cadáver asesino pistola padrino crimen herida arma aldeano prueba rostro instrucción cabeza carruaje bosque testigo embargo médico compañero pie cuerpo manera puerta razón voz magistrado matador derecho orden tierra lado lance víctima adversario papel portero bolsillo emoción carta dirección honor asesinato preso coche 
33	0,07143	boca muchacho cabeza pie perro cara chico diablo año agua pierna nariz carne dedo lengua alma pelo vuelta color mozo palo gente oreja diente ropa aire vergüenza cuerpo gato pata punta gana papel santo cuento gusto cuenta piedra suelo dueño derecho barba sol demonio hueso falta grito vecino rato espalda 
34	0,07143	enfermo médico muerte enfermedad dolor cama lecho cuerpo hospital cadáver doctor estado fiebre mal salud desgracia corazón lágrima alma esfuerzo consuelo remedio voz medicina brazo herida cabeza cabecera esperanza paciente sangre suceso embargo cuidado infeliz habitación existencia cementerio instante situación presencia muerto silencio respiración fuerza ciencia tarde lado sufrimiento facultativo 
35	0,07143	hombres guerra soldados armas ojos tierra país pueblo españoles indios silencio sargento patria pueblos sol jefe mar aguas cabeza fuego manos hijos lado oro brazos excelencia fuerzas sangre batalla dioses enemigos paz ejército mirada agua poder terreno soldado plumas atención pies espada combate jefes rostro tropas años caudillo piedras ejércitos 
36	0,07143	ojos flores color niña cabeza terrado labios balcón hojas rostro felicidad manos do lado tarde mente mesa muchacha años cariño brazos planta cuello paredes mar plumas patio sol calle pecho amiga lágrimas caoba rayos virgen edad cuerpo papel tía ramas flor hermana habitaciones miradas días expresión pluma cielo hermanas mirada 
37	0,07143	soldado enemigo fuego fuerza jefe tropa plaza arma columna combate cañón campo orden fusil ataque ejército guerra francés pueblo bala grupo artillería bandera ciudad general tiro cuerpo cerro sangre batallón línea cuartel cadáver campamento batalla caballo tierra victoria camino sitio movimiento herido prisionero gente caballería número posición teniente pieza defensa 
38	0,07143	muchacho voz año carruaje palabra viaje cabeza ciudad tren calle misia aire brazo grupo fiesta tono cochero movimiento instante expresión lado coche vuelta plaza campo mes rato luz estación situación caballo impresión conversación diario mesa mamá cara gente puerta interés carácter alegría cuerpo chico sitio emoción mirada tarde actitud hotel 
39	0,07143	gallo machete finca guajiro amo bosque trabajo café caña sol juego pueblo pelea azúcar ingenio potrero sombrero palma especie negro yerba canto muchacho color hoja aire camino tierra pie maíz criollo cafetal mañana naturaleza perro bohío distancia valla frase hombro río fruto carreta campana plata cabeza monte flor plátano camisa 
40	0,07143	gobierno pueblo ministro país guerra revolución patria partido presidente poder política orden libertad jefe ley autoridad gobernador nación enemigo palabra fuerza provincia ejército ciudad derecho plan arma opinión causa capital plaza triunfo diputado año ciudadano independencia noticia elemento tropa mando paz gente campaña secretario general patriota república sangre calle estado 
41	0,07143	año idea sociedad libro país obra espíritu pueblo carácter tierra época arte estudio razón trabajo historia siglo maestro forma inteligencia ley naturaleza edad ciencia clase principio especie educación talento palabra fuerza hecho derecho ciudad escuela raza cuadro ser libertad costumbre título progreso virtud juventud porvenir humanidad necesidad objeto autor modo 
42	0,07143	dama alcalde puerta rey alguacil caballero barón palabra palacio lugar corte espada habitación calle amor orden do criado marqués muerte cámara razón modo reina golpe instante escudero justicia rostro fraile crimen maese taberna efecto año poder peligro fortuna pie ventana vano gente jardín entrada diablo lado ciudad enemigo linterna ronda 
43	0,07143	conde condesa palacio barón castillo rey título general duda dama mesa época instante voz país esposo objeto año oro nobleza respeto personaje heredero lado convento caballero calma poder felicidad asunto baronesa carretela plaza tanto dueño modo gloria acto aspecto posesión carácter fortuna pie conversación idea llegada corte condestable secreto atención 
44	0,07143	caballo camino árbol agua pie lado animal lugar tierra campo jinete viajero cabeza marcha distancia río perro vista bosque sargento pueblo compañero montaña sitio legua terreno ruido monte suelo brazo viaje dirección luz gente orilla voz piedra aire grupo efecto sol carrera rama arroyo tronco galope peligro muchacho sombra derecha 
45	0,07143	virrey puerta calle oidor señoría brujo inquisidor corregidor dama bachiller escribano negocio negro canónigo ciudad lacayo lado arzobispo cabeza aposento orden luz mesa lugar palacio alcalde secreto brazo rostro espada gente clérigo tarde conspiración ventana voz merced sombrero especie noticia licenciado convento grito marqués alguacil sitial estancia efecto anciano justicia 
46	0,07143	puerta calle cabeza sala luz ventana lado patio cuarto pie mesa brazo escalera pared voz cama balcón habitación ruido silla pieza color rostro aire cuerpo zaguán sombrero palabra corredor traje criado vista papel suelo mueble frente mirada comedor rato cara esquina sillón labio reloj piso hombro derecha mañana fondo golpe 
47	0,07143	indio cacique español tierra merced palacio conquistador capitán oro gobernador corte gente rey lugar arma ciudad tribu voz tesorero expedición raza conquista riqueza cortés brazo reino soldado lado tesoro noticia palabra religión color cristiano número marina bosque princesa año empresa orden lanza cabeza pluma mirada piedra plata castellano comitiva espada 
48	0,07143	cura compadre pueblo pollo manera caballo curato lector mirada idea revolución compañero hacienda vecino fiesta autoridad muchacho historia silencio palabra sazón coronel pie lugar cara alma misa sastre polla movimiento amor sombrero personaje año asunto herrero mosca motivo conciencia robo comadre payaso animal p_o párroco jinete pistola justicia terreno gente 
49	0,07143	estancia gaucho campo rancho caballo peón capataz patrón mate vaca sol monte voz guitarra cocina paja tierra fogón techo suelo lana pieza vista silencio pampa corral potro cuero payador chino viento asiento peones tranquera dueño muchacho ñ_o mozo cielo canto perro palenque perros animal llanura pajonal pago boca mocetón barro 
50	0,07143	árboles flores pueblo ojos veces sol hacienda agua horas ciudad hojas cielo valle lado tierra ruido campos campo miedo población aspecto manos perro montañas trabajo días luz arroyo río aldea árbol mañana silencio perros embargo ventanas sombra casas flor ramas sueño cosas canto nubes historia voz tarde pies vecinos luna 
51	0,07143	ejército corazón estudiante insurgente ciudad caballero sangre muerte palabra silencio pueblo existencia capitán campo revolución soldado historia porvenir francés frente destino independencia guerrillero emperador negocio batalla alma nación patria voz situación orden rayo luz diplomático imperio héroe multitud honor tumba sombra aposento capital rey cielo general bandera archiduque esposo aliento 
52	0,07143	pueblo escuela cura muchacho papel madrina duda misa mañana voz autoridad examen licenciado maestro mesa cara libro capital distrito chico cabeza forma calle sacerdote presencia memoria sombrero arroyo año tierra curato barrio importancia portal letra costumbre gente iglesia libros plaza entrada gusto fama cabecera rancho grado modo regocijo sol villa 
53	0,07143	inglés país carruaje teatro semana negocio tenia hotel aventura ciudad calle carta posición situación necesidad libertino criatura billete personaje matrimonio visita imaginación alemán gusto bailarín recurso lugar especie marido cuarto periódico número costumbre motivo par moda coche orden sílfide honor mañana relación policía minuto invierno viaje caballero sociedad falta héroe 
54	0,07143	marqués conde corazón general amor duque gabinete poeta marquesa lector alma pie salón jorobado virtud idea sonrisa marido año já coqueta conciencia felicidad honra pecho honor puerta fisonomía risa mirada guerra beso título imaginación dignidad impresión gloria cara libro carta triunfo baronesa mentira cabeza criado señorito sillón embargo sol emoción 
55	0,07143	príncipe dios español princesa emperador sacerdote extranjero palacio guerrero pueblo rey ciudad enemigo monarca imperio ejército palabra sangre voz templo instante cabeza guerra país patria trono embajador capitán semblante tierra soldado esposo valor plaza sacrificio arma soberano gloria esclavo brazo noble embargo piedra caudillo capital muerte víctima jefe nación poder 
56	0,07143	periódico secretario oficina artículo abogado calle escribiente diputado mesa papel licenciado pluma estudiante asunto palabra despacho periodista talento jefe muchacho compañero cara gobernador sueldo redacción director carta empleado idea párrafo escritor cuarto trabajo puesto expediente empleo frase ministro diario mañana capital número año rato gesto prensa lectura título cabeza letra 
57	0,07143	crimen cárcel prisión justicia preso juez muerte bandido causa reo calabozo orden víctima asesino delito libertad sentencia declaración ley pena palabra prueba asesinato carcelero cabeza alcaide defensa verdugo desgraciado castigo manera hecho conciencia cómplice criminal venganza tormento autoridad noticia ladrón ejecución acto papel soldado silencio sangre tribunal objeto testigo duda 
58	0,07143	flor cielo luz amor alma sol sombra árbol agua corazón nube tarde viento hoja aire color tierra jardín ala voz mañana rayo sueño rama rosa estrella horizonte luna mirada planta fondo oro labio pie ciudad bosque lluvia silencio campo perfume recuerdo canto alegría brisa ave naturaleza lágrima montaña espíritu beso 
59	0,07143	espíritu alma idea pasión fuerza forma ser cerebro luz pensamiento imagen amor belleza materia sentimiento deseo existencia cuerpo frase conciencia sueño estudio naturaleza voluntad movimiento palabra fenómeno inteligencia ciencia razón sensación planeta mirada atmósfera celo trabajo modo acción creación manera sentido lucha recuerdo gato imaginación causa fiebre mina brillo misterio 
60	0,07143	deán jesuíta prepósito conde caballero provincia comisario socio gobernador obispo embargo judío maestre orden dominico cabildo presencia colegial suceso asunto palacio objeto capitán especie efecto historia esposo carta bien motivo ánimo rey negocio escena sitio colegio lego conferencia puerta comisionado aire mesa confesor silencio conducta papel preso visita regidor billete 
61	0,07143	teatro público palco voz escena artista compañía telón actor música función aplauso pico perro director orquesta escenario comedia maestro ópera dama asiento obra papel arte cara empresario cómico silencio acto coro entrada mirada gente drama autor traje cuarto bastidor representación puerta espectáculo actriz concurrencia ventana platea foro pieza cabeza manera 
62	0,07143	examen estudio ciencia mirada médico estudiante memoria doctor campanas año sangre recuerdo época profesor catedrático sereno hospital manos filosofía cátedra locura latín ciudad vuelta acto reloj sillón claustro recuerdos banco actividad programa manuscrito expresión puerta estilo figura orden recinto libro cara carne campana espíritu clientela delirio odio techo humedad procurador 
63	0,07143	voz brazo cabeza puerta palabra grito mirada rostro silencio sangre muerte pie cuerpo instante luz fuerza corazón pecho dolor labio alma golpe frente cadáver movimiento ruido suelo terror acento lágrima sombra boca tierra lado esfuerzo escena rodilla fuego oído lecho anciano miedo sueño venganza desesperación aire vista idea espanto víctima 
64	0,07143	negro esclavo amo mulato ingenio finca mayoral campo merced ama blanco calesero raza año esclavitud castigo menudo época lector cabeza odio mulata perro negros caña trabajo color azúcar sangre ocasión esclavos calle oficio carácter modo falta ciudad cuero muerte país ley quitrín látigo carruaje criollo corredor alma causa gente siervo 
65	0,07143	baile salón brazo señorito sala caballero traje color gusto fiesta amor música mirada palabra compañero flor gracia pie conversación piano pareja oro atención sociedad lujo manera lado seda dama grupo voz concurrencia mamá efecto gente danza belleza rosa paseo asiento reunión marido sonrisa moda pieza aire carruaje vista elegancia adorno 
66	0,07143	muchacho señorito ciudad clérigo mozo chico fiesta canónigo mancebo tío mamá huérfano alma anciano misa escuela dama ebanista razón gusto maestro doncella asiento sol sitio corredor primo patio libro camino compañero flor casita carácter doctor dinero asunto abuelo blonda alegría lado cielo tienda gloria tren rostro hermosura poeta angelino tono 
67	0,07143	mamá amor calle marido baile cosas niñas chucho león papá curial manera año muchacho gente capital compadre negocio sombrero chocolate procurador días idea levita novio lisa lugar zócalo agua licenciado plaza historia hijas grado razón curva jardín dependiente misa diablo cuidado limosna cara tierra línea visita asistencia coche criada circo 
68	0,07143	mayordomo juego mesa jugador oro carta jefe calle sociedad voz baraja vista compañero sota sala silencio dinero suerte puerta modo caballo albur lugar anciano as caballero ciudad rey carruaje jugada duda vicio viudo tono onza puñal fortuna mozo partida naipe baile crimen garito café puente juramento reloj centro barrio lado 
