69	0,03559	periódico artículo calle periodista licenciado estudiante diputado secretario redacción párrafo pluma mesa gobernador escritor idea papel carta cara director prensa jefe muchacho palabra cuarto sueldo miedo diario ministro cólera redactor coñac elogio oposición puesto talento abogado personaje escribiente cabeza trabajo agua oficina línea lisa negocio mozo imprenta capital humor número 
70	0,01666	pueblo ciudad doctor misia menudo escuela sociedad calle autoridad duda policía tono jefe través cielo partida juego río letra monitor provincia chacra clase política jugada forma país plaza costumbre mañana hacendado sol sitio venganza frescura niñas orden golpe naturaleza falta templo interior rincón moral carácter pasajeros farmacia aguas bigote elemento 
71	0,09102	puerta mesa sala lado color pared cabeza patio luz habitación espejo silla mueble cristal ventana seda oro cuadro pieza sillón traje pie papel cuarto escalera madera suelo forma plata salón flor comedor alfombra sofá reloj centro ruido brazo cama alcoba corredor calle bronce cuello piano lámpara gabinete piso techo mármol 
72	0,01977	años ojos veces amigos palabras hija hombres días año manos niña carácter cosas esposa corazón personas padres edad meses hijos embargo trabajo vista manera lugar jóvenes modo ideas horas mujeres idea sentimientos momentos negocios boca país voluntad historia efecto costumbre espíritu época labios razón campo sangre lágrimas educación juventud voz 
73	0,01824	sor superiora voz ciudad agua religioso jardín cama criatura luz colegio techo rumor asilado nana papá chimenea hospital dormitorio carne galera lluvia sala hacienda rincón modo mesa piano sueño eco efecto tarde comida fuego falta marcha recinto vela tierra refectorio armario través paz portera claridad tumulto campana cosas establecimiento aposento 
74	0,0135	vd fortuna palabra naturaleza amor alfiler orden embargo caballero elegancia banquero mozo ciudad copa talismán mujeres traje amol sol hijos morada oro viaje dinero libertino naipes sociedad lujo ingenio país potro tipo comercio tenia doctor tierra bodega par clima propiedad modo posición nieta honor loco carcajada aristocracia lector acción color 
75	0,05573	mayordomo merced calle puerta sala cabeza caballero vista ama duda balcón pie edad rostro seña cuerpo abuelo traje color derecha modo luz cabello efecto cuarto azotea desgracia mulato nariz esquina tono manera atención expresión vuelta fisonomía oro seno seda señorito sazón cama ciudad mesa boca motivo palabra ventana silla mañana 
76	0,04121	caballo paisano gaucho partida gente pulpería alcalde soldado daga cabeza guitarra manera puerta mirada sargento rancho compadre lado trabuco corazón camino golpe sable puñalada justicia voz partido prenda teniente arma baile expresión campo plata diablo vuelta pico bandido plaza boca espíritu palabra copa campaña quinta ginebra semblante pueblo cara mazorca 
77	0,03274	calle choza casita instante mestizo mercado sangre alegría cabeza hamaca callejuela mañana solar tío barrio puerta árbol pueblo especie vista brazo provincia color mueble mar clase suelo flor oficina soldado sombrero palma precio verdura escritorio atención lugar embargo camisa hoja caballo orgullo país madera entrada conversación naturaleza piso duda presencia 
78	0,03502	hospital lazarino ciudad sepulturero amo muerte capellán mal fraile aposento tierra cielo embargo calle madrastra infeliz existencia enfermedad país sociedad carta copa escena enfermo angustia aire situación juventud improviso especie mulato efecto silencio lugar víctima fisonomía antilla salud consuelo individuo desgracia leproso sangre lecho laguna billete pirata suerte impresión término 
79	0,03622	perro dinero filósofo pico avaro compañía dama ventana historia embargo cabeza efecto chaleco fortuna cara animal caballero duro cajero levita cabra motivo ostra papel comerciante corazón criado palo galán caballo boda pintor do manera sastre razón agua diablo apellido artista amo cerrajero duda corte autor leche cuarto valor pueblo concepto 
80	0,04675	juez comisario policía agente asesino cadáver sangre crimen aldeano cabeza herida pie magistrado declaración juzgado bosque instrucción puerta médico compañero rostro prueba escribiente manera embargo matador bolsillo orden dirección preso cuerpo lado esposo calle secretario inocencia tierra oficina razón rodilla soldado pieza escribano mancha víctima testigo huella examen palabra billete 
81	0,02268	estudiante examen estudio calle año esqueleto compañero cráneo memoria puerta ciencia mesa pieza bolsa número clase curiosidad resto catedrático atrio estudiantes armario libro papel huesos suerte templo cabeza patio entrada profesor rincón anfiteatro grupo cara cuarto color costilla figura pie modo compañeros conjunto novela orden gabinete mármol ventana salón hueso 
82	0,04363	cabeza calle unitario puerta tirano orden sangre ciudad asesino rosa salvaje bandido espíritu caballo puñal mazorca patria embargo fisonomía federación víctima servicio revolución época mirada palabra río golpe pueblo coronel sereno negro crimen comandante policía cuchillo patio muerte corazón causa mulato expresión zaguán movimiento lado sótano año libertad acción personaje 
83	0,05027	cura pueblo hacienda bandido muchacho población dinero plateado autoridad herrero vecino fiesta alcalde compañero lugar gente curato ladrón iglesia tierra prefecto robo misa terror año indio párroco manera sacerdote tarde huerta rumbo caballo aspecto peligro carácter gobierno justicia payaso plata sacristán sombrero partida especie miedo pie honradez parroquia paternidad fuerza 
84	0,02643	mono capitán doctor especie gorila eslabón naturaleza siglo razón ciencia animal hembra efecto tierra viajero ser fiera edad época negro chimpancé ángulo salvaje fruto tipo guerra orang tribu forma cerebro cráneo terreno raza duda origen león gibón piel espíritu cola palabra pilotín región río evolución inteligencia isla modo idea triunfo 
85	0,01664	virrey muchacho rancho patrón tahona plata puerta parapeto oro ciudad compadre piloto vino arrabal chico cara horno despacho panadero cabeza chocolate calzada mar gente rúa negocio camino polizón verdá dinero principio marido heredero bendición granito años sol iglesia rajo uté almuerzo espalda palabra fortuna falucho billete compañía pensamiento raza convento 
86	0,02174	sabio lobo palabra especie cutter razón pueblo cuestión ciencia región teoría compañero viaje sur lucha gloria caleta colección idioma objeto individuo nota sesión idea botella partido agua pipa mar lector alemán cara modo ballena lobero museo caja manera berlinés animal darwinista espíritu tren relación guerra ciudad obra voz silencio embargo 
87	0,12277	corazón amor alma palabra felicidad pasión sentimiento amante lágrima dolor placer mirada esperanza pensamiento virtud cariño idea rostro ser desgracia labio instante pecho ángel cielo objeto muerte esposo existencia dicha brazo embargo voz deseo afecto lado ilusión cabeza vista fuerza recuerdo ternura sonrisa frente pena razón duda tierra acento naturaleza 
88	0,01456	mamá cura padres sacerdote sacristán procurador amor iglesia escuela puerta muchacho misa altar alma limosna año secretario agua libros niñas medalla chucho patria años cara hija días atención gente puente criada muchachos templo asunto forastero país niños mañana tarde hijas chico pueblo religión familias lenguaje fe plata gracia sombrero educación 
89	0,06041	cuerpo calle brazo muerte vera fuerza beso ocasión luz amor sueño carne año vivienda sitio caricia memoria cama fondo individuo gendarme instante llanto tranvía par pensamiento hombro cariño sombra santo labio minuto cara balcón grupo muro principio ventana dicha cuadro palabra existencia reja miedo risa rumor estancia espalda recuerdo sol 
