68	0,17054	cuerpo boca rostro sombra carne labio sangre agua cabeza luz cerebro frase brazo dedo beso sol fondo pecho pierna idea mirada sueño alma aire instante pie oído pensamiento nervio espíritu sonrisa silencio fiebre gesto bestia garganta piel risa golpe organismo espalda deseo ala pupila odio tiniebla lecho borde pasión caricia 
69	0,02054	alcalde dama rey barón marqués palacio puerta alguacil lugar amor fraile corte habitación calle do muerte cámara razón ciudad escudero maese reina instante criado orden virrey palabra cielo espada alma rostro mal modo caballero anciano efecto crimen poder caballo pie jardín obra vano enemigo granuja corazón ronda peligro lado rajador 
70	0,00086	esqueleto años estudiante patio cráneo bolsa do puerta ojos planta hija negocios calle cabeza chocolate año huesos felicidad curiosidad historia agua mesa cosas sangre tía visita obra viejita vecina piano hueso gracia cara ciudad manos color cariño viento pie levita tierra muchacha corte alegría hojas costilla virgen modo negocio cajón 
71	0,02156	v_d doctor país tenia manera sociedad criatura esposo amante teatro gusto vd h_u negocio calle asunto razón gracia fortuna posición cuarto bailarín semana carta cuaderno personaje libertino necesidad visita mesa educación aventura pieza sílfide imaginación do obra ciudad entrevista plan traje vds instante astrólogo alemán palabra embargo gente fuerza puesto 
72	0,00707	terrado navío batería capitán mar fortaleza miliciano caballo muro ciudad playa castillo jinete monte plaza buque baluarte nave muralla inglés gobernador caballero cañón vista flota milicia puerto defensa amor sol asiático marcha semblante fragata casaca fiesta dragón sorpresa rey vecindario tanto partidario canal altura viento pie cuartel agua combate campesino 
73	0,04058	convento sor monje fraile fray religioso claustro celda superiora abadesa novicio comunidad hábito orden voz coro capellán pecado ciudad voto colegio lugar monasterio maestro criatura regla voluntad puerta portería acto lego suelo fuerza espíritu arzobispo año profesión franciscano reverencia papel cholo patio velo estado capilla refectorio paz necesidad paternidad efecto 
74	0,02738	teatro público palco artista escena telón voz actor compañía aplauso función director orquesta escenario música papel comedia asiento empresario puerta entrada obra pico cómico concurrencia cara gente ópera representación arte platea coro bastidor actriz dama silencio drama espectáculo foro maestro pieza autor acto traje cuarto gloria número proscenio localidad talento 
75	0,03498	dinero negocio patrón trabajo manera calle escritorio fortuna capital hotel cliente gente comercio pieza mes vino dueño café dependiente palabra situación mozo idea cuenta suma género sueldo mañana comerciante ciudad relación confianza clientela carta modo almacén botella bolsillo fonda diablo interés lado crédito porvenir posición cuestión espíritu puesto ropa empleo 
76	0,09371	año voz muchacho palabra estancia aire misia instante tono cabeza rato carácter expresión campo vuelta fiesta grupo mes brazo situación idea impresión movimiento gesto diario silencio chico recuerdo trabajo mesa hogar espíritu mamá luz acto existencia ciudad carruaje embargo manifestación viaje lucha interés cambio pasión tarde criatura fuerza cara figura 
77	0,02513	conde condesa barón palacio castillo rey dama instante voz título mesa corte esposo general personaje dueño caballero nobleza baronesa heredero brazo época calma esperanza país orgullo duda oro primo objeto año felicidad plaza condestable posesión respeto conversación marqués príncipe convento carretela tanto acto cielo pie poder infante gloria honor aspecto 
78	0,16579	dinero negocio fortuna oro año bien capital cantidad asunto trabajo abogado gasto papel miseria mes precio cuenta título peso efecto riqueza suma caja documento deuda recurso pleito noticia necesidad desgracia fondo herencia posadero posición heredero firma valor relación clase servicio propiedad socio alhaja mueble crédito esperanza mina sociedad tesoro objeto 
79	0,00149	rastro ciudad asesino suelo caballos hombres campanas manos pie voz pueblo cuartel vereda plaza rastreador caballo bota alma tierra paisanos sombrero tapia muchacha canto amor peso fuerzas perros amigos reloj patria guitarrero asesinato rumbo herida cuadras horas mujeres cajón extremo techo gente asesinos cosas calles mozo vecindario luna pared presencia 
