68	0,00647	gallo guajiro machete pelea potrero juego valla bosque café perro sol río naturaleza pueblo amor color fruto finca criollo pie gallos tabaco dinero campo ciudad tierra isla yagua canto sombrero colgadizo camino sitio gallero yerba palma palabra rival loma maíz flores gallina hombro especie traje amol taburete azúcar potro peso 
69	0,22718	flor cielo sol árbol agua luz sombra nube bosque tierra viento ciudad hoja color aire montaña tarde campo alma rama jardín mañana horizonte ala luna ave fondo estrella canto brisa rayo río naturaleza piedra oro mar sueño lluvia paisaje sitio espacio soledad pie valle planta camino perfume roca pájaro música 
70	0,02129	capitán pirata voz anciano duda tutor ciudad agua queche filibustero té atención caballero río patria palabra buque clérigo ocasión figura teniente valiente modo negocio libertad historia criado objeto guerra sociedad billete dama conversación pie amo encuentro castillo soldado calor rescate mar merced silla talento criatura gracia dueño clase bandera tarde 
71	0,00402	sol sierra sable silencio carabina montonera subteniente valle jefe grupo sargento cerro tequila sotol tomo_ch godo guerra partida rostro tropa cielo voz instante roca caudillo fondo pie patria cumbre caballo polvo lado bestia carne cima capitán torre pensamiento humareda fonda derrota frente aire humo rey sangre trago ráfaga paz horizonte 
72	0,00924	condesa conde título barón rey país baronesa matrimonio dama marido caballero merced baile condestable nobleza palacio época iglesia siglo plaza placer corte nacimiento pie sociedad felicidad duda calle condes anciano clase vino marqués cuñado infante patria amo conversación puente tenia santo primo objeto ministro raza virtud gente damas almirante uso 
73	0,00487	ojos calle años calles luz veces ciudad puerta aire casas cabeza puertas cielo agua paredes hombres fondo mesa sombrero lluvia manos amigos color días estudio cosas balcón gritos partes tarde polvo labios escalera trabajo barrio estudiante cartas rostro libros voz gente voces colores cansancio ventanas horas mujeres suelo mármol esquina 
74	0,02158	doncella embargo tierra mirada excelencia rostro mulato duda esposo expresión afecto extranjero esperanza orgullo cielo objeto anciano frente país oro aspecto instante efecto madrastra silencio voz monsieur acento seno improviso aire dicha fisonomía existencia barquero rey mancebo modo perla fuego placer morada dueño caballero artista sol colina alma nacimiento espectáculo 
75	0,01222	juego jugador carta oro baraja sota mesa fortuna caballo albur as rey banquero amor mozo partida caballero suerte dinero jugada naipe tallador clase lado pasión onza abogado esposo viuda coche carruaje muerte garito anciano cantidad banca papá tapete mirada salón capital alfiler lecho indiferencia ganancia basto carpeta lugar criado año 
76	0,26768	puerta calle cabeza cuarto sala voz ventana luz brazo patio palabra escalera cama pie pieza ruido balcón llave lado vista mayordomo criado habitación pared cara esquina duda mañana zaguán cuerpo golpe mesa silencio silla caballero vuelta aire papel seña suelo muchacho sombrero corredor rostro miedo boca rato vela portero desgracia 
77	0,03497	tío sobrino muchacho primo carta dinero modo madrina calle voz cuarto edad ropa tarde camino baúl mesa oro aldea palabra puerta chico café viaje sol cabeza madama destino trabajo cuello papel habitación ciudad camisa recomendación espalda año examen abuela piedra relación escalera tierra patio lado muelle cura pueblo fortuna escribano 
78	0,00084	galera luz cama cura peso efecto marcha grupo resto rumor sol tierra par fondo calor pueblo hombres sombra chiquillos techo sueño noches recuerdos memoria claridad agua manos forma cosas antro veras palabra espalda arroyo orejas codo pudor camino penado palabras sonido rumbo capital comida cabecera esfuerzo galeote ocasiones taller muro 
79	0,12716	preso cárcel crimen prisión justicia juez causa muerte orden reo calabozo delito sentencia bandido declaración palabra libertad ley pena asesino víctima autoridad defensa alcaide conciencia sangre carcelero soldado prueba verdugo asesinato cabeza castigo hecho criminal cómplice manera silencio proceso testigo tribunal guardia defensor ejecución tormento noticia acto corazón abogado amante 
