0	0,0759	flor jardín árbol sol cielo luz tarde hoja planta corazón mañana amor color sombra rosa tierra rama campo pie agua aire brisa bosque ventana fruto estrella pájaro alegría perfume canto lágrima ala viento año naturaleza paseo rayo pecho luna nube ave labio tristeza brazo aroma voz encanto alma nido recuerdo 
1	0,01381	gaucho estancia campo cortito payador guitarra rancho palenque voz campos aparcero misia cocina caballos monte negro sentimiento mozo alma pago muchacho peón pueblo especie recuerdo peones cantor guitarrero rostro vista bastonero canto suelo establecimiento gato patrón fiesta mozas barraca caballo caña mostrador perros barba techo puesto pañuelo hierro río gauchos 
2	0,06099	cuerpo muerte ocasión fuerza brazo cuadro silencio respuesta amor par pecado tierra luz sueño vera juventud artista pensamiento dicha sitio sol dueño rostro cerebro sombra principio palabra estancia hombro peligro carne vivienda muro ciudad espíritu entraña tarde labio duda castigo fondo comienzo mañana espalda recuerdo lámpara voluntad regreso prodigio ventura 
3	0,0276	deán conde jesuíta prepósito caballero provincia gobernador socio comisario obispo judío maestre embargo orden dominico cabildo palacio colegial presencia asunto efecto villa capitán suceso especie negocio carta objeto sitio colegio ánimo historia mesa bien esposo silencio conducta confesor conferencia papel finca interlocutor escena prelado regidor usarced tribunal espíritu año visita 
4	0,03939	mayordomo calle puerta vista viudo sala gabinete poeta bandido pensamiento desgracia ama boca morena diablo mesa sacerdote luz hipócrita mal teatro crimen suelo papel campana esquina criatura zaguán placer pie imaginación derecha izquierda sociedad centro balcón plazuela vivienda llave circunstancia infierno frente estado falta comadre manera malhechor cajón malvado fisonomía 
5	0,02091	teatro cara alma sociedad público obra conciencia beso dinero corazón talento fuego belleza oro camisa tierra sueño amor sangre puerta abrazo carne vuelta cabeza mujeres hombres cuarto cielo ojos frío camarín hijos boca imaginación fuerza deseo vanidad escena pueblo tiple porvenir través atmósfera escenario silla vapor camino mar hogar café 
6	0,09389	sangre voz brazo cabeza muerte golpe palabra cuerpo grito arma fuerza pistola espada pie venganza rostro pecho silencio herida miedo suelo puñal crimen cadáver boca justicia puerta asesino duelo enemigo lucha escena mirada tiro víctima espalda terror dolor tierra esfuerzo valor fuego combate adversario caballero cara bala sitio acero labio 
7	0,03887	merced calle caballero cabeza abuelo mulato seña duda edad sala balcón puerta rostro cuarto tono ama ventana cuerpo color pie cabello muchacho señorito atención embargo palabra sazón culpa cama fuerza cuello motivo nieto aire vista ciudad ánimo silla efecto mañana seda modo pecho calesero cara azotea esquina derecha expresión convento 
8	0,07428	iglesia misa altar templo sacerdote voz capilla gente oración campana ciudad santo pueblo procesión calle convento alma luz fiesta religión ceremonia sacristán imagen cielo plaza gracia oro devoción camino puerta coro multitud lugar plata culto tierra anciano mañana atrio pie nave monje pecado balcón confesión fe cruz obra sacristía obispo 
9	0,02522	amo hacendado alicio vista luz palabra cadena trabajo distancia muchacho francés salón voz caña rueda lluvia cuadro muías vapor n_e p_as duda mirada embargo i_l color través est cerebro expresión sangre esfera sensación orden jurisconsulto trozo tono movimiento ruido instante chimenea banquero cambio aspecto longitud menudo botella acento efecto propósito 
10	0,07269	gobierno pueblo ministro país guerra revolución presidente partido poder política jefe patria libertad ley orden autoridad provincia nación fuerza ejército arma independencia gobernador capital noticia derecho palabra tropa elemento secretario triunfo paz diputado plan enemigo gente opinión causa ciudadano principio mes papel campaña estado año entusiasmo situación república mando plaza 
11	0,04117	doctor corazón mal ciencia compañero salud merced conversación juventud viaje placer agua muerte espíritu estudio acento médico tierra embargo amo vista patria velo cielo alma existencia belleza maestro sonrisa profesión esperanza país aire ausencia idea gesto vino historia color atención recuerdo edad enferma destino silencio causa camino música noticia asiento 
12	0,02974	bachiller oidor rostro espada ciudad estancia mancebo oro hidalgo puerta señoría morisco merced caballero muro año ventana candil plata escudero aágora cuadra soldado sombrero sitial honra negro calle sombra rumor galán daga dama dueño sol paje doncella terciopelo lacayo boca canónigo libro linaje tarde convento brasero capa historia balandrán resplandor 
13	0,05358	capitán mar buque puerto agua bote costa tierra pirata marinero viaje vela cubierta ola barco viento marino muelle playa embarcación inglés isla ciudad gente vista orilla popa lancha nave proa canal río grupo navío goleta año pasajero fuerza rumbo vapor bahía distancia remo aire palo pie tripulación lado duda oro 
14	0,01769	canónigo guitarra playa tía muchacho vela moneda muchachos cura caballero hotel plazuela aire oro mañana extranjero trabajo camisa pana covacha pieza compadre herrería zapatero españoles ademán tarde sombra canción polvo sueño chopo fuente boletero secretario bolsillo gorra mar misterio recuerdo capital tocayo endecha tranvía plata suerte portero agua monedas toro 
15	0,03697	juez policía comisario agente barón crimen asesino sangre cadáver herida aldeano cabeza instrucción magistrado bosque prueba puerta médico pie compañero bolsillo lado preso manera embargo rostro dirección declaración matador víctima pieza cuerpo juzgado esposo ley tierra orden calle testigo inocencia lugar sospecha camino asesinato examen rodilla justicia palabra expresión razón 
16	0,01152	abrigo pieza ciudad lado diva misia mesa puerta sociedad gusto compañera calor teatro piano orquesta nariz sitio espectáculo salón forma tono conversación cara cartas jefe puertas partes calma frío templo escena rato corrección señoras lengua pueblo letra gas cuerpo policía comedor atmósfera dientes menudo ausencia aire masa fuego número seda 
17	0,04977	tío sobrino primo lado despacho oficina muchacho carta fortuna destino cuarto rato par calle gesto escalera cabeza sombrero habitación expediente baúl rostro modo muelle informe trabajo recomendación dinero letra estado compañero empleo espalda viaje camisa sol brazo humor orden oído edad marqués gorra extremo oro traje cuello impaciencia gravedad generosidad 
18	0,03578	hospital embargo excelencia lazarino amo efecto carta sitio bandido esperanza duda sepulturero capellán instante desgracia policía tierra silencio suceso monsieur corazón vista infeliz italiano palabra agente artista especie historia mal caballero barquero pirata fisonomía suerte anciano mirada objeto colina crimen existencia cielo consuelo maestro doncella bandolero voto camarada voz criatura 
19	0,0114	gobierno ejército jefe policía autoridad guerra hombres soldados pueblo provincia camisa provincias clase jefes cuerpos tropas causa línea servicio fuerzas amigos montoneros ley paisanos filas caudillo interior gobernador loco diario voluntad ciudad armas manera caudillos libertad paz comisario semana caballos prestigio cuartel carácter poblaciones elementos artículos falta embargo muchachos justicia 
20	0,04223	periódico artículo calle diputado secretario periodista pluma mesa cuarto escribiente gobernador talento director cara jefe redacción escritor papel muchacho estudiante puesto párrafo asunto oficina diario carta número prensa compañero frase personaje sueldo trabajo lectura idea palabra abogado letra capital ministro cabeza pueblo imprenta portero empeño voz elogio despacho atención empleo 
21	0,07184	baile teatro salón voz palco público grupo fiesta sala música compañero pareja concurrencia gente caballero brazo danza mirada escena orquesta traje pie dama aplauso gracia asiento señorito aire calle palabra artista multitud efecto atención silencio puerta actor sociedad reunión función manera color flor compañía movimiento telón entrada figura concurrente lado 
22	0,08356	dinero negocio fortuna trabajo capital mes calle cuenta manera suma gente situación escritorio gasto oro miseria precio relación peso comercio cantidad crédito dueño asunto pieza patrón servicio confianza modo interés posición socio bolsillo necesidad cliente sueldo año papel idea viaje lado porvenir género policía valor deuda ladrón recurso hotel dependiente 
23	0,10642	cabeza muchacho boca pie cara año gente diablo aire perro agua pierna nariz vuelta chico puerta suelo mozo color carne sol vecino dedo papel calle diente oreja ropa piedra pared lengua pelo voz gato hombro cuento cuerpo sombrero punta suerte barba vergüenza alma santo lado sangre palo cielo animal grito 
24	0,0571	cadáver muerte muerto cementerio cuerpo tumba difunto entierro sepulcro dolor sepultura caja ataúd puerta fosa cajón resto tierra calle suelo llanto grito féretro instante embargo voz cera cortejo frente funeral peso lecho cara sepulturero pared luto desgracia alma panteón pie patio duelo atención presencia brazo sombrero carro agonía sollozo sueño 
25	0,03643	conde marqués general duque gabinete pie marquesa poeta salón jorobado lector idea coqueta mirada puerta brazo voz guerra dama corazón risa sonrisa condesa fisonomía señorito palabra gesto já honor gloria sillón razón triunfo pecho puesto embargo virtud honra marido cara baronesa impresión efecto chimenea castillo jardín escalera asiento secretario portero 
26	0,09325	puerta calle voz instante palabra luz ventana brazo cabeza ruido patio cuarto silencio duda habitación escalera grito vista llave lado mirada pared pie lugar sala pieza semblante labio aposento golpe cama corredor temor criado oído sombra objeto pensamiento movimiento mañana silla suelo embargo rostro entrada fuerza sitio amor caballero acento 
27	0,09661	agua luz cielo sol montaña viento nube tierra fuego árbol aire voz río pie silencio sombra piedra mar fondo roca camino bosque lluvia rayo ruido horizonte valle abismo tempestad grito luna lugar rumor mirada trueno torrente orilla campo lado llama relámpago ave rama alma suelo soledad vista cabeza forma tiniebla 
28	0,02365	mono capitán gorila especie doctor razón siglo eslabón animal naturaleza negro efecto viajero edad palabra ciencia hembra tierra chimpancé tribu ser ángulo orang fiera cerebro perro salvaje terreno guerra río gibón balsa cráneo raza pilotín fruto región forma modo león mar época inteligencia espíritu antropoide idea hotentote grado informe historia 
29	0,01342	pueblo flores mañana árboles sueño ciudad camino placer casita aldea arroyo semblante deseo montaña campo recuerdos época trabajo soledad memoria alegría valle guerra flor juventud idea ciudades sombra embargo algodón hojas libro libros veces distancia bosque presencia tía historia aspecto terreno sangre novela piedra espectáculo oro fusil viento interés agua 
30	0,03688	esclavo dios ciudad pieza sitio instante do templo sacerdote edificio calle lado vista gladiador estatua tenia columna pueblo oro mármol ceniza palabra pared multitud pórtico pintura amo anfiteatro virtud puerta cabeza forma rostro tierra piedra efecto carro entrada cristiano traje romano belleza agua altar riqueza primo bronce inscripción número placer 
31	0,11604	año sociedad libro obra país idea trabajo estudio ley carácter época espíritu pueblo derecho arte naturaleza historia escuela hecho razón edad clase tierra inteligencia ciencia forma sentimiento educación ciudad libertad virtud raza principio talento siglo necesidad luz porvenir título campo juventud fortuna deber autor vicio conciencia alma costumbre ejemplo especie 
32	0,05358	indio español dios sacerdote instante palabra cacique guerrero cabeza extranjero pueblo mirada soldado país tierra anciano templo voz lugar sangre piedra patria ciudad año número labio arma enemigo flecha pecho grito tribu sonrisa capitán semblante cristiano brazo duda idioma bosque sacrificio muchedumbre esclavo choza corazón altar religión campamento embajador guerra 
33	0,02467	sabio palabra pueblo viaje ciudad ciencia tren especie objeto razón idioma cuestión lucha fenómeno voz colección teoría modo sesión lobo partido individuo relación gloria animal manera carácter caja sur lector mono opinión guerra alemán berlinés armonía humanidad vuelta darwinista naturalista malicia frío agua atención museo norte principio mariposa región distancia 
34	0,01152	calle ciudad calles casas cielo gente país plaza viento lluvia paredes barro amigos estudio color oro cochero coche atmósfera sol partes acciones aire pared suelo balcones coches gobierno tarde ciencia luz barrio aspecto fondo agua tranvías edificios años vereda grupo paraguas bigote veces capital edificio sitio suerte balcón acera fastidio 
35	0,04233	virrey dama alcalde marqués puerta alguacil rey calle palacio barón lugar orden señoría corregidor oidor razón lado gente criado corte caballero cámara justicia negocio habitación arzobispo escribano espada negro lacayo efecto secreto amor cabeza do alma ciudad maese libertad reina canónigo carroza conspiración secretario noticia modo primo tierra ronda escudero 
36	0,02574	sargento soldado soldados silencio columna quebrada jefe cerro bosque lado cabo cordillera teniente hombres fusil campamento instante godo retaguardia tierra guerra partida grupo especie falda montonera valle machete sable patria marcha camino distancia pierna país patriota rastro meseta loma brazo asistente tiro sur vanguardia guardia terreno comandante cuero servicio forma 
37	0,06573	soldado enemigo fuego jefe fuerza plaza tropa combate arma ejército campo columna cañón general orden ciudad pueblo francés ataque guerra batalla caballo artillería sangre fusil cuerpo bala bandera camino cuartel caballería línea sitio batallón victoria marcha grupo coronel movimiento tiro cerro defensa pieza triunfo prisionero número cadáver herido posición campamento 
38	0,02956	estudiante examen año madrina ministro salón maestro catedrático profesor memoria agua portero mesa puerta número latín notario mirada atrio muchacho compañero programa libro techo voz sesión carrera pedazo clase cara ministros calavera época ciencia claustro gallego cabello recinto estudiantes orden escalera asiento anfiteatro cadáver papel corte pregunta aula años anatomía 
39	0,05448	ejército manera soldado jefe enemigo fuerza tropa prisionero coronel marcha orden arma batalla provincia acto guerra campamento lado combate elemento gobierno caudillo campaña cuerpo gente muerte ciudad infantería montonero noticia caballería grupo golpe fraile peligro situación palabra poder persecución caballo regimiento fuego línea seguridad herida libertad extremo carga paraje triunfo 
40	0,01762	pueblo plaza cura sacristán escuela muchacho lado gente voz iglesia vecindario sacerdote sombrero duda cuartel sala extremo papel mesa cara partido chico mañana forastero letra portal patria centro altar tienda distrito barrio asunto agua mozo gusto libros misa presencia grado maestro guardia alboroto alma virrey instrucción tierra comandantes acto grupo 
41	0,01117	luz sueño camino miedo amo vaquero hacienda papá lado muchacho chimenea perros nana lugar jardín pelo duda voz corral gato grupo talismán leña plática mañana raza brujo ruido año ai torre cara cuento amigos lectura caja descanso vela fuego muerte gemido peones vacas armario veras resto puerta arroyo cambio aire 
42	0,07341	mesa copa vino botella comida café plato vaso comedor compañero fiesta agua sala cocina pieza brazo conversación convidado muchacho palabra cena alegría dueño gusto cocinero voz mozo huésped banquete almuerzo año apetito criado lado estómago licor tarde silla servicio salud mantel costumbre manjar mañana mirada bebida carcajada pie trago brindis 
43	0,01506	país sociedad extranjero corazón mirada tierra años espíritu fisonomía sol viajero naturaleza hijos alma raza carácter existencia patria padres viaje ciudad caballero cielo palabras árboles tarde placer embargo jardín edad infancia juventud razón porvenir fuego puente lenguaje rostro siglo madera inteligencia conversación educación lado hombres camino carruaje castillo humanidad anciano 
44	0,05482	capitán coronel gobernador jefe teniente orden soldado comandante ejército voz fuerza servicio cuerpo general cuartel campaña mando tropa regimiento caballo gobierno papel confianza carta camino compañero sargento gente espada pliego despacho guardia arma ayudante caballería enemigo cabeza autoridad honor secretario uniforme revolución carácter deber capital patriota correo mesa marcha provincia 
45	0,05611	príncipe princesa palacio rey emperador ciudad monarca imperio dios voz enemigo tierra corte ejército trono español capitán pueblo conquistador soberano reino guerra palabra brazo orden gloria arma cortés oro embargo gente cabeza tesorero poder extranjero corona esposo conquista plaza marina república vasallo nación lago noble guerrero respeto honor nobleza súbdito 
46	0,01831	años ojos veces amigos año hombres palabras días cosas personas manos hija carácter manera edad modo esposa historia mujeres trabajo padres vista negocios embargo época palabra momentos hijos idea amor meses boca horas corazón cabeza tiempos lugar mañana país conciencia sentimientos compañeros ideas estado jóvenes calle brazos fortuna tierra motivo 
47	0,01352	ciudad fraile muerte amor lugar copa país agua abuela madama aldea tierra enferma tía patio rostro invierno río estancia pueblo calle edad flor fruto cielo barrio abuelo lluvia escudero veces corazón amores persiana calles manos taberna capital mal fuerza primavera árboles partida vanidad criados ahorcado salud voluntad miedo pueblos mecedora 
48	0,01796	espíritu imagen mina materia médico planeta alma fuerza gato trabajo genio cuerpo forma quebrador hemisferio espacio manera tierra embargo espíritus hambre luz memoria piedra mar sangre sentidos recuerdos átomo manuscrito fenómeno disco espíritu-imagen éter aureola peso habitante resplandor mitad barretero torbellino superficie idea centro palabra maestro bonanza almuerzo acción cuarzo 
49	0,04089	compadre hacienda licenciado rancho muchacho gente pueblo canoa administrador plata indio año palabra semana oro mulo camino mozo cabo p_a presidente cabeza ranchero caballo platero p_o monte tierra maíz amo agua peón finca corral marido negocio capital lugar dinero árbol chico almuerzo fuerza vino trabajo rumbo campo cerro piedra canal 
50	0,01347	niña años hija tía hermana educación año padres cariño hijas niñas veces lado hijos patio vuelta días puerta flores jóvenes corazón muerte papá amigos edad ojos carácter criatura mamá sala lecciones muchacha esposa colegio belleza cuarto meses manos viuda hermanas libros conversación felicidad gente mes calle niños llegada clase hogar 
51	0,06643	carruaje coche viaje cochero ciudad calle camino tren pasajero viajero caballo paseo diligencia hotel muchacho campo estación portezuela lado capital plaza gente luz asiento sol teatro vehículo marcha carta criado brazo pañuelo equipaje vista sombrero pueblo tierra cuarto pescante tarde atención francés lugar compañero mañana vuelta voz maleta curiosidad saludo 
52	0,03647	idea alma pasión espíritu ser forma cerebro pensamiento fuerza belleza amor sentimiento voluntad celo deseo mirada corazón estudio existencia conciencia inteligencia frase luz causa naturaleza inspiración creación sensación atmósfera lucha recuerdo modo brillo razón hermosura pupila sueño movimiento arte ciencia misterio palabra color imaginación vigor ley expresión ideas acción fiebre 
53	0,04831	tienda mostrador calle establecimiento dependiente tendero ciudad muchacho socio par puerta marchante género iglesia capital gente voz torre maestro aldea sastre comercio luz precio letrero vara lado hombro trastienda mercado gesto escalera clase negro traje amo papel mercader tela cabeza polvo pan comprador almacén acera dependientes villa esquina cedro plaza 
54	0,00839	hermanas comedor patio médico campanas mesa veces reloj hijos alma hijas flores recuerdo cabeza espíritu caoba cosas mente horas libros madera padres escritorio papel sala hierro páginas silencio estudio amigos cuadros pluma suelo lágrimas recuerdos pared ramas paredes vidrios alegrías túmulo estufa tomo años barrio lado muebles esperanzas techo época 
55	0,07624	prisión cárcel preso crimen justicia muerte juez reo causa calabozo orden delito sentencia declaración libertad asesino carcelero ley manera pena víctima palabra alcaide defensa cabeza conciencia verdugo asesinato soldado hecho prueba castigo criminal tribunal acto ejecución abogado voz objeto cómplice sangre amante proceso defensor guardia autoridad gente papel duda autor 
56	0,0377	inglés vd filósofo efecto avaro perro ciudad embargo moda pintor chaleco razón caballero país gusto calle especie héroe fortuna cajero número criado libertino artista ostra motivo mina cabra barón do copa situación aventura rostro personaje semblante traje empresa poeta modo población orden dolor cerrajero tierra teatro duro par lance descubrimiento 
57	0,01922	terrado caballo playa jinete matrimonio chocolate altar piano marido asiático muro agua señorita mar tanto espuma curiosidad sala catedral arena lado vecina lugar línea casullero alegría flor sol vecinas olas fórmula memoria dolor ventanilla caída vecindad piel mozo freno criado paz sangre ribeteadora coro modelo risa grado imagen lámpara estrella 
58	0,01485	corazón lisa comerciante calle mamá escritorio bobo cara dinero atención paseo papel provincia estudiante gaveta prima lujo embargo vista caballo precio taller padrinos mueble amor dedos jóvenes luz muebles emoción miedo oficina justicia hermanos despacho mesada hecho empleo carta soplo peligro ocasión catedral ama paloma almoneda secreto entrada oro aire 
59	0,01777	mamá baile compadre amor chucho coronel curial león niñas manera sastre papá marido procurador cosas negocio licenciado zócalo razón sombrero revolución novio pollo tierra línea grado idea curva destino dependiente circo hijas oro gente cuidado calle polvo personaje peso comadre mes sazón hijos jardín dinero entrada color general cara ojos 
60	0,01038	guerra armas hombres indios soldados españoles ojos mar pueblo país ejército oro jefe hijos aguas pueblos imperio sangre cortés dioses caudillo paz cabeza plumas combate patria silencio enemigos playa agua sol triunfo valle batalla rostro riquezas noticias ejércitos campaña veterano soldado jinetes pensamiento superficie plata cadáver tierra piedras brazos estatura 
61	0,10528	voz mirada cabeza palabra alma brazo instante labio cuerpo luz rostro idea silencio pie movimiento fuerza dolor corazón sueño lado espíritu sombra recuerdo frente expresión pecho puerta pensamiento pasión frase tono cerebro sonrisa esfuerzo emoción amor ser aire tarde oído beso grito existencia lágrima impresión deseo lucha golpe actitud cara 
62	0,04783	calle puerta gendarme cara agua cama amor ventana cuarto esquina balcón tranvía cariño jardín luz cambio santo cuerpo patio chico acera beso muchacho café cigarrillo piso individuo corredor llanto coche miedo año cigarro mesa vidriera existencia caricia ruido risa piano pena sueño dinero miseria fondo secretario carne rumor cantina criado 
63	0,03634	perro gallo guajiro pueblo caballo machete compañía cabeza río palma pico camino pelea animal potrero ventana patio árbol sombrero tierra valla bosque criollo dama muchacho cuarto amo partido buey madera sitio loma tabaco efecto ruido distancia plátano mañana fruto duda manera monte yagua tronco embargo pañuelo carrera oficio traje vista 
64	0,02328	boticario amo mamá negro cholo pueblo sociedad calle alma medalla historia libertad ciudad época té lado puerta limosna costumbre cara oficio modo efecto barrio botica criado ley médico gente hereje criatura policía espíritu negocio lector duda asunto puente fanatismo razón vino niña despotismo matón facultades juicio africano poder suelo hija 
65	0,08875	amor corazón alma palabra felicidad pasión mirada amante sentimiento placer pensamiento ángel esperanza ser flor pecho cielo labio idea objeto vista dicha ilusión instante cariño rostro belleza dolor embargo lágrima encanto existencia recuerdo naturaleza sonrisa duda virtud imaginación afecto imagen lado sueño luz ternura manera deseo hermosura fuego silencio tierra 
66	0,0813	esposo marido amor matrimonio novio felicidad casamiento boda año padrino cariño ceremonia dama amante viudo fiesta alma corazón belleza hogar gusto salón enlace celo pasión lujo suegro unión dicha beso flor mes criado traje razón costumbre dinero pariente edad sociedad manera fortuna viaje regalo hermosura bendición honor abuelo querido pareja 
67	0,03004	v_d manera esposo sociedad país tenia negocio amante criatura h_u gusto cuarto fortuna embargo cuaderno doctor carta asunto personaje semana baile bailarín do entrevista visita mendigo criado gracia instante obra calle objeto teatro ciudad alemán motivo talento gente educación aventura billete necesidad posición sílfide pieza plan fuerza licorero mesa vista 
