69	0,00689	esposo pueblo viuda hogar alma luz hermana esposa carácter sociedad embargo conciencia mañana marido deseo cabello campo hijos trabajo edad amor rostro suerte manera dicha molino cabeza sentimientos matrimonio deber bienes aldea fuerza flores secreto beso abogado sol pensamientos puesto cara cinta niña presencia dama corral trato estatura propiedad huerta 
70	0,05494	periódico estudiante artículo secretario diputado calle oficina mesa escribiente pluma palabra abogado papel periodista jefe despacho compañero cara gobernador asunto sueldo voz portero talento director muchacho redacción ministro licenciado cuarto escritor puesto párrafo carta empleo idea número agua prensa frase personaje lectura trabajo miedo diario letra negocio empleado expediente año 
71	0,02621	v_d doctor país manera tenia amante sociedad negocio criatura asunto personaje carruaje h_u fortuna calle gusto coche cuarto esposo semana traje cuaderno carta aventura fuerza do ciudad razón imaginación criado bailarín educación visita posición relación gracia obra vds necesidad sílfide motivo entrevista teatro libertino pieza embargo situación gente dinero número 
72	0,07493	juez preso cárcel prisión reo causa calabozo justicia orden crimen muerte declaración sentencia carcelero libertad alcaide delito pena soldado defensa palabra asesino defensor manera cabeza proceso voz ley prueba guardia secretario centinela criminal gente asesinato plaza patio ejecución verdugo conciencia pieza tribunal autoridad acto grillo noticia hecho alcalde autor amante 
73	0,0106	doctor calle aspecto coche plaza oro acciones sangre empresa viento cabeza cara gente embargo cielo movimiento instante luz tono corazón bolsa sociedad atmósfera vista hijas cajón punta cochero alma agente cartera mérito edad suelo manera niebla talento plata presencia tachero calles infierno miseria grito propósito ojos edificio fastidio escuela marido 
74	0,0263	sor convento monje fray religioso superiora claustro abadesa celda novicio colegio capellán voz comunidad hábito coro voto jardín criatura papá dormitorio regla monasterio reja portería franciscano orden ciudad año hacienda claridad arzobispo palabra lugar profesión muro voluntad recinto maestro enfermería locutorio tornero acto asilado relato asilo galera patio refectorio efecto 
75	0,07406	mesa copa botella vino vaso plato pollo café comida comedor gusto cocina sombrero gente licor servicio trago brindis convidado estómago capital banquete mamá mantel criado calle apetito coche sopa lugar agua pie jardín centro cena manera aire silencio salud tierra coñac plata cigarro cocinero cerveza lengua boca bebida carcajada razón 
76	0,03588	caballo paisano gaucho partida gente pulpería soldado daga alcalde sargento cabeza rancho manera puerta golpe guitarra voz trabuco lado puñalada muerte mirada corazón sable justicia expresión vuelta prenda partido lucha arma camino baile campo compadre cuerpo teniente plata copa cintura pico bandido valor indio cara suelo quinta diablo espíritu ira 
77	0,03344	cuerpo corazón cabeza silencio alma médico luz lado rato sangre cielo amor sombra voz cuarto tierra cama dolor muerte cara espíritu miedo frente alegría pecho pasión palabra hogar comedor frío fuego esplendor brazo sol seda enfermo plegaria rostro naturaleza mejilla chiquito patio flor ímpetu grito dormitorio año aire historia libro 
78	0,01561	espíritu sabio materia palabra imagen planeta ciencia esqueleto viaje razón manera cráneo fuerza médico fenómeno gato cuerpo tren modo ciudad alma cuestión estudiante carácter lucha mar forma relación especie gloria voz objeto tierra teoría pueblo centro habitante lector idioma opinión elemento individuo sesión bolsa región embargo lobo resplandor agua colección 
79	0,04605	juez policía asesino comisario duelo agente barón sangre cadáver padrino rastro pistola crimen herida pie médico aldeano embargo bosque instrucción asesinato cabeza arma prueba compañero cuerpo puerta matador carruaje suelo lance dirección testigo manera pisada bolsillo rostro lado duda fisonomía adversario magistrado razón calle bala víctima palabra tierra huella lugar 
