0	0,0925	caballo hacienda cura camino pueblo compadre bandido gente jinete amo rancho lugar mozo campo manera muchacho compañero viajero pistola autoridad animal vecino viaje ladrón sombrero población mulo árbol administrador jefe dinero cuidado silla plata arma terreno fuerza peligro legua orden rumbo distancia tierra pie ventana cabeza marcha año galope noticia 
1	0,1038	convento iglesia sacerdote sor fraile misa altar monje fray templo cura voz religión ciudad capilla celda oración claustro santo puerta religioso obispo año campana coro alma hábito procesión superiora sacristán hereje pecado anciano merced confesión fe lugar orden abadesa capellán cruz comunidad imagen gente clérigo confesor gracia franciscano devoción ceremonia 
2	0,03345	caballo gaucho paisano partida gente pulpería soldado indio sargento daga rancho guitarra alcalde cabeza puerta manera lado campo trabuco voz golpe mate camino arma teniente muerte cuerpo orden sable mirada jinete justicia partido baile rienda galope puñalada pico prenda campaña compadre quinta peón espíritu cintura miedo lucha boca pago estancia 
3	0,00238	hombres guerra soldados sargento armas tierra silencio fuerzas jefe agua paz tropas lado manos comandante teniente pueblos fusil ejércitos ojos marcha sol brazos jefes valle quebrada boca cordillera causa país especie jinetes caballos hijos rosas pueblo retaguardia prisioneros enemigos ejército filas miedo terreno veces honor campamento odio cólera fortuna hombros 
4	0,03964	negro esclavo amo mulato ingenio finca mayoral campo gallo guajiro perro machete blanco calesero caña azúcar ama cabeza caballo color menudo raza castigo esclavitud criollo odio cafetal trabajo pie tabaco merced dinero negros lector gente mulata oficio café ocasión palma falta época bohío látigo sol esclavos compañero cuero isla plátano 
5	0,02169	v_d doctor país esposo tenia manera vd sociedad fortuna amante h_u criatura calle personaje gusto teatro cuarto ciudad semana gracia cuaderno imaginación carruaje educación libertino bailarín necesidad aventura razón posición negocio visita sílfide vds vista palabra fuerza rostro motivo carta billete orden obra artista do objeto instante traje astrólogo lugar 
6	0,14004	agua árbol camino río pie tierra animal bosque caballo lado perro indio cabeza sol piedra montaña suelo monte ruido campo arroyo aire pueblo año tronco rama fuego distancia orilla lugar marcha cueva país especie yerba viajero hoja compañero vista cerro legua fondo carne valle entrada cuero vuelta terreno forma llanura 
7	0,00133	negocios pasajeros belleza viuda ciudad mañana licenciado modo pie cabeza gracia salón doctor ingenio trato cuerpo naturaleza ánimo hermosura muerte ojos estilo espacio gesto lado boca cerebro asunto secreto amor extremo vapor menudo años partida escalera alma falta origen distancia hacendado negocio acción espalda gente zaguán vajilla condiciones rasgo grupo 
8	0,07328	español indio príncipe dios princesa palacio rey emperador guerrero sacerdote extranjero ciudad enemigo pueblo tierra palabra capitán cacique ejército monarca soldado arma instante voz imperio templo cabeza corte guerra país oro conquistador esposo orden patria trono sangre plaza soberano embajador número brazo sacrificio embargo piedra reino valor jefe cortés poder 
9	0,00182	madama doctor misia espejo miedo manos hermana comedor patio oro abuela ojos ciudad mesa aldea seda alcoba cuello carne chico champaña dedos cielo pan tía cartas abuelo carta ruido pared brazos patrón sueño cabeza señores bata plaza muchacha veces traje alfombra par pam menudo cosas calor casita tienda obrador copas 
10	0,00249	ojos indios país oro cabeza ciudad españoles armas pueblo mirada dioses años época hombres indio plumas sol soldados aguas excelencia imperio agua rostro guerra palabras algodón patria plata jefe silencio ruinas duda espada palabra cortés idioma traje tierra intérprete atención objeto instante emperador castillo perla noticias caudillo orilla colores pies 
11	0,01033	años amigos veces hombres días cosas ojos personas ciudad carácter hija manos palabras pueblo año edad época calles calle historia padres embargo hijos tierra mujeres esposa manera cara negocios jóvenes tiempos país sociedad meses lugar trabajo casas momentos espíritu hermanos capital educación ideas justicia niña patria escuela recursos familias puertas 
12	0,10628	juez crimen preso cárcel prisión justicia asesino policía reo calabozo causa agente sangre declaración delito orden muerte ley comisario sentencia cadáver prueba víctima asesinato cabeza defensa manera carcelero alcaide carta criminal palabra testigo papel bandido compañero barón pena proceso libertad escribano herida puerta cómplice hecho defensor inocencia conciencia voz esposo 
13	0,00193	pueblo cura veces muchacho sol flores árboles trabajo libros escuela mañana lado libro perro juego aldea ojos ciudad memoria campos chico agua perros casas cosas lugar campo huerta fortuna corral anciano hojas iglesia molino puerta tierra montañas lectura casita embargo oro camino cara labios padres sitio gallos mesa días desayuno 
14	0,24899	flor cielo luz alma amor sol corazón sombra árbol aire voz tarde tierra jardín nube color agua mirada viento rayo sueño luna ciudad oro rosa mañana estrella campo brisa hoja ala naturaleza labio perfume recuerdo canto rama planta pie alegría horizonte bosque ave mar fondo imagen música espacio ventana espíritu 
15	0,16588	dinero negocio fortuna trabajo capital mes oro cuenta manera gasto cantidad suma miseria precio abogado escritorio peso gente calle situación año recurso comercio bien asunto carta sociedad interés posición dueño crédito juego relación idea servicio sueldo viaje esposo clase lado socio deuda papel modo valor género necesidad patrón cliente fondo 
16	0,01573	posadero posada barón embargo viaje filósofo doncella artista año perro habitación viajero tren avaro monsieur huésped razón pintor dinero país efecto boda mancebo caballero capital ocasión arte compañero vuelta esperanza ciudad historia semana idioma distancia fortuna motivo tierra barquero costumbre voz continuo modo duda palabra cabra baile interés cafetal cajero 
17	0,03643	conde marqués condesa general título duque rey palacio castillo marquesa nobleza dama gabinete pie caballero barón baronesa corte salón coqueta lector honor jorobado orgullo príncipe poeta heredero esposo señorito virtud honra duda año criado dote personaje marido felicidad convento risa guerra dignidad idea favor triunfo gloria raza calma jardín já 
18	0,22749	puerta calle cabeza luz ventana mesa sala lado patio cuarto brazo pie escalera habitación voz pared silla balcón color ruido papel pieza cama criado corredor sombrero rostro cuerpo sillón suelo mueble cara aire frente traje reloj libro fondo espejo cristal mañana comedor llave rato zaguán mirada labio madera cuadro tarde 
19	0,01194	ojos años corazón hija veces manos amor palabras niña alma cabeza flores voz labios rostro días brazos mirada lágrimas hombres frente luz mujeres horas aire puerta hermana jóvenes lado padres boca hijos pies cielo sonrisa juventud noches cabellos silencio fuego color pecho señorita miradas esposa cosas vista pasos momentos rayos 
20	0,00914	deán conde prepósito jesuíta caballero provincia socio gobernador comisario judío maestre obispo embargo cabildo orden dominico colegial villa capitán presencia palacio suceso asunto especie efecto puerta regidor silencio colegio esposo bien negocio pieza historia espíritu sitio confesor rey usarced mesa ánimo religioso escena año lego motivo visita carta objeto prelado 
21	0,00168	inglés trabajo mina ciudad ojos amor mañana calle aire caballo tía matrimonio guitarra lisa sueño tarde luz muchacho playa sangre quebrador voz juventud minas vela señorita patio hotel miseria alegría casualidad hambre cantidad época idea plata moneda pieza mes seda piedra placer cuarzo cuarto real piso pana oro gracia barretero 
22	0,40866	corazón amor alma esposo palabra felicidad lágrima pasión dolor sentimiento amante cariño carta pensamiento esperanza desgracia año cielo ángel placer idea ser mirada virtud muerte pecho labio rostro recuerdo dicha brazo pena deseo lado existencia afecto ternura embargo deber marido destino instante alegría fuerza llanto ilusión criatura gracia bien pesar 
23	0,05932	mar buque capitán costa agua puerto tierra bote playa pirata marinero viento ola muelle vela vista barco viaje cubierta inglés embarcación marino oro orilla lancha isla gente popa canal nave pasajero bahía proa fondo goleta ciudad año aire navío vapor rumbo remo bergantín arena marzo brazo tripulación sol grupo pescador 
24	0,13426	muchacho puerta calle dinero año vecino gente criado cuarto ropa agua trabajo cara amo vela cama cocina cabeza hambre pieza mes papel camisa boca marido pobre tarde pan sombrero palabra tienda merced suelo plata chico miedo piedra recámara lugar criatura cuidado ama luz llave ladrón pie edad barrio rincón alhaja 
25	0,0516	ejército manera soldado jefe enemigo coronel fuerza tropa prisionero orden marcha provincia arma gobierno batalla acto guerra gente caudillo campaña campamento lado muerte combate ciudad elemento caballo cuerpo montonero noticia golpe fraile herida persecución infantería pueblo paz peligro palabra seguridad gobernador caballería cura libertad grupo modo situación línea extremo género 
26	0,00143	ojos niña sol cabeza casas calle hojas amo balcón muchacha manos edad color vista rostro caballero terrado cuerpo flores sala brazos calles mañana tanto puerta merced planta duda espacio días años ciudad mujeres hermanas extremo suelo labios cielo puertas tarde hombros ramas tía rayos tono do sazón mar belleza cuello 
27	0,02846	caballo camino brazo instante toro muchacho amo cuidado rancho palabra cara muías gusto maestro lado cabeza hacienda sombrero pie silla fuerza cerro plaza animal pueblo sitio rato suerte merced pierna corazón valle empeño año punta charro arriero confianza cura dinero favor lágrima tiro peso perro villa negocio pecho carga presencia 
28	0,06553	mamá carta muchacho papá señorito año tío chico misa ciudad primo criado libro prima alma cariño mozo razón gusto corazón flor calle anciano tarde canónigo alegría mancebo retrato fiesta mes novio colegio hacienda rato amor clérigo estudiante maestro mañana abuelo periódico noticia criatura tono comedor belleza dama lado corredor asiento 
29	0,04932	capitán coronel virrey gobernador teniente orden gobierno gente secretario corregidor carta cabeza regimiento jefe confianza voz soldado pliego despacho cuartel guardia canónigo rey papel plaza fuerza revolución ejército comandante independencia mando servicio provincia correo autoridad pueblo patriota caballo efecto compañía espada empresa excelencia mesa alcalde conspiración tropa dinero diablo campaña 
30	0,00472	tienda mostrador ciudad socio puerta calle par establecimiento dependiente polvo cura gente marchante iglesia fondo tahona voz payador cabeza torre tendero sol plaza asiático parapeto colores arrabal género lado luz panadero aparcero precio negro gesto casas letrero esquina hierro calor lengua taller grupo puertas calzada tranvía cara plazuela zapatero horno 
31	0,11533	doctor médico enfermo enfermedad muerte hospital cama dolor lecho salud estado mal fiebre ciencia cuerpo medicina remedio paciente cuidado cabecera esfuerzo facultativo alma consuelo dolencia embargo desgracia curación cuarto lágrima esperanza suceso cadáver esposo amo delirio agonía espíritu año corazón pulso existencia sepulturero causa viaje criatura infeliz calentura moribundo lazarino 
32	0,19374	cara boca pie muchacho cabeza chico mozo diablo calle aire nariz tienda lengua gusto perro gente misia pelo gana marido pierna vergüenza cuenta gato dedo vuelta duda oreja risa color palo gracia abuelo falta sombrero diente pata santo punta plaza broma ocasión esquina cuento vecino suerte paz gesto demonio camisa 
33	0,00329	mono capitán doctor gorila palabra siglo eslabón especie historia razón naturaleza chimpancé forma ciencia negro edad orang época terreno tierra hembra gibón recuerdos ángulo obra autor pilotín memoria mar modo duda hipótesis tipo antropoide inteligencia salvaje fruto costumbre ser viajero voluntad estudio frase brazo et evolución región origen raza cráneo 
34	0,00154	estancia años caballo ciudad campo muerte ojos rostro sol campos fraile cielo extranjero silencio caballos país copa árboles hijos luz vista camino conversación mirada peones lluvia hogar alma palabra viaje lugar extremo efecto hombres espacio viento nariz pueblos carácter hacienda sala establecimiento espíritu capital fuego horas leña lenguaje orden naturaleza 
35	0,02162	cuerpo alma lado cabeza rato silencio corazón sangre luz médico tierra cielo calle sol sombra voz cama dolor hogar cuarto espíritu muerte esplendor palabra alegría miedo brazo comedor marcha cara pecho obrero ciudad aire trabajador trabajo amor frío ímpetu seda año enfermo suburbio pasión grito naturaleza plegaria virtud chiquito gloria 
36	0,07709	coche carruaje mayordomo calle cochero carta criado puerta duelo oro juego caballo mesa sala caballero dinero pistola vista portezuela jugador lugar palabra padrino placer diligencia voz efecto gabinete pasajero bandido lado bolsillo ciudad baraja camino duda número fortuna reloj negocio pañuelo sota escalera cuarto asiento viaje silencio balcón albur sociedad 
37	0,0013	examen año estudiante años estudio agua atrio madrina secretario templo mesa ciencia compañero puerta dinero memoria cara número calle salón entrada color estudiantes carrera ojos resto sitio compañeros libro misa época comerciante novia papel notario pieza doctor portero mirada clase multitud luz grupo manos criatura maestro aulas personas gravedad espacio 
38	0,00166	rancho rastro caballo campo suelo camisa tierra voz pie asesino muchacha capataz juego jefe perros hombres vereda ciudad principio dueño bota montoneros peón falta cuerpo rastreador mozo caballos provincias monte plateados gaucho cocina asesinato población cielo alma sol comisario paja lana rumbo ño guitarrero novia bandidos muchacho jefes policía caña 
39	0,09323	mesa copa vino botella vaso café plato compañero comida jefe voz silencio comedor trago palabra conversación licor alegría cocina convidado carcajada cerveza salud apetito brindis orden silla vista banquete cena estómago carta tono plata mantel sociedad agua fiesta cocinero habitación mozo luz bebida taza manjar movimiento fonda asiento aguardiente puerta 
40	0,04473	tío sobrino primo lado carta tía cuarto sala calle muchacho cielo destino cama fortuna habitación baúl oído cabeza abrazo santo visita muerte carácter par hermanas palabra letra mañana gesto trabajo edad gravedad cura bondad escuela patio humor memoria embargo ama rato sol movimiento ropa comedor consejo compañero gente cuello testamento 
41	0,13868	rostro boca cuerpo brazo sangre carne beso labio cerebro sombra cabeza alma luz frase dedo pecho muerte agua fondo odio silencio mirada pensamiento garganta golpe pierna fuego pasión pupila sol fiebre nervio idea instante espíritu pie ser sueño amor rincón seno caricia angustia organismo cráneo visión hombro deseo mal piel 
42	0,48169	palabra asunto razón duda carta manera motivo efecto modo idea noticia objeto ocasión situación circunstancia embargo deseo atención relación orden causa conversación papel secreto confianza caballero lugar puerta interés falta presencia visita plan fuerza camino ánimo intención marido vista temor amor propósito hecho conducta desgracia peligro estado tono principio resolución 
43	0,05044	dama puerta alcalde calle virrey merced alguacil caballero palacio rey espada marqués señoría oidor ciudad brujo barón orden lugar inquisidor razón negro bachiller lado amor gente rostro criado habitación justicia corte lacayo negocio luz cámara secreto oro fraile aposento ventana fe año escudero brazo escribano esposo capa ronda sombrero sitial 
44	0,0029	calle ciudad calles viento lluvia luz agua gente campanas atmósfera paredes estudiante cochero puertas cosas coche cielo esqueleto casas cama bolsa sombrero cráneo ojos años país manos amigos partes sitio huesos lado olor color duda balcones plaza suerte techo barro escritorio escuela vidrios puerta oro paraguas reloj aire abrigo sillas 
45	0,1262	gobierno pueblo ministro país partido guerra revolución poder presidente patria política libertad ley orden jefe autoridad palabra nación provincia fuerza gobernador enemigo triunfo capital arma gente plan diputado derecho ejército elemento paz plaza elección año opinión independencia noticia secretario acto ciudadano causa campaña tropa general mando manera ciudad principio palacio 
46	0,3496	voz puerta brazo palabra cabeza instante mirada muerte grito pie silencio sangre cuerpo rostro dolor fuerza labio corazón luz pecho cadáver lado duda movimiento vista lágrima frente acento golpe tierra suelo semblante anciano ruido camino lugar lecho esfuerzo terror miedo venganza escena oído espanto alma víctima sombra aire cielo sitio 
47	0,01235	espíritu alma idea fuerza forma ser pasión cerebro luz pensamiento imagen materia ciencia razón palabra lucha sentimiento belleza fenómeno existencia deseo inteligencia naturaleza estudio planeta manera sabio cuerpo voluntad mirada modo expresión médico gato frase sensación creación causa genio misterio recuerdo ideas atmósfera inspiración acción voz sueño movimiento celo sentido 
48	0,14884	muchacho voz año palabra viaje cabeza carruaje misia idea tren ciudad calle aire lado rato tarde mes recuerdo brazo estancia espíritu mamá sueño tono expresión cariño situación novio impresión movimiento campo lucha instante pasión vuelta cara deseo alegría mesa gente trabajo mañana camino mirada conversación grupo fiesta estación diario existencia 
49	0,02671	esclavo ciudad dios instante sitio sacerdote do templo pieza edificio calle vista lado puerta gladiador oro pueblo tenia estatua columna palabra mármol pórtico multitud ceniza amo pared pintura piedra virtud agua tierra forma anfiteatro placer altar entrada riqueza bronce número carro traje cabeza rostro primo esposo romano belleza cristiano vino 
50	0,03445	periódico artículo secretario oficina licenciado papel calle mesa diputado periodista despacho gobernador pluma escribiente jefe asunto palabra redacción pueblo muchacho párrafo escritor voz puesto cara cuarto carta talento expediente estudiante sueldo cabeza capital compañero empleo gesto letra idea personaje director sombrero prensa interés abogado mañana sala rato ocasión miedo número 
51	0,04425	estudiante ejército sangre insurgente corazón muerte caballero capitán pueblo revolución silencio existencia ciudad palabra destino frente porvenir francés historia emperador independencia guerrillero alma esposo campo soldado imperio negocio sombra diplomático situación aposento luz honor multitud nación patria archiduque batalla tumba espíritu aliento rey libertad miserable orden rayo año horizonte cura 
52	0,00477	pollo mamá baile amor marido compadre coronel manera chucho niñas león sastre papá chocolate cosas sombrero novio curial negocio revolución calle procurador tierra razón días grado licenciado capital levita muchacho línea año gente zócalo idea cara sazón polla agua criado dependiente criatura silencio peso destino cuidado hijas general circo lugar 
53	0,18237	baile salón mirada brazo traje palabra fiesta amor gusto señorito sala caballero música voz flor color conversación pie marido gracia compañero atención lado pareja lujo piano grupo dama manera aire sociedad belleza oro efecto sonrisa concurrencia paseo placer año esposo vista reunión rostro cuerpo gente asiento novio danza seda rosa 
54	0,005	mancebo sol morisco oro montonera vaquero sangre cuadra hidalgo aágora aire rumor cielo godo morenciano rostro ciudad mulo piso camino gesto torre grupo palabra espada sable plata estancia p_a amo muralla honra amol raza potro guerra voz ai canónigo modo silencio instante yegua miedo espuela caballo pie fondo escudero abuelo 
55	0,02641	teatro público palco escena artista compañía telón actor voz pico orquesta aplauso perro director música escenario comedia función dama empresario ópera obra cómico entrada arte espectáculo coro gente silencio representación asiento maestro bastidor platea papel cara acto drama traje pieza foro mirada actriz poeta concurrencia cuarto autor puerta cabeza ventana 
56	0,27678	año sociedad obra idea libro maestro país carácter estudio época espíritu trabajo edad tierra ley derecho historia razón educación inteligencia arte naturaleza siglo clase escuela pueblo virtud hecho raza talento ciencia forma especie juventud campo principio poeta ciudad libertad fuerza sentimiento humanidad porvenir título conciencia necesidad progreso condición autor luz 
57	0,06177	cuerpo ocasión calle vera sueño luz fuerza muerte brazo sol año memoria vivienda jardín instante tranvía gendarme cara sitio recuerdo llanto chico tarde existencia cariño principio beso rumor cuadro carne muro par santo grupo chiquillo artista respuesta cama caricia lágrima risa dicha ciudad fondo reja rumbo miedo cigarrillo dormitorio estancia 
58	0,02759	unitario cabeza calle sangre puerta tirano ciudad orden rosa asesino caballo espíritu bandido salvaje puñal mazorca patria sereno federación cuchillo comandante víctima pueblo río servicio revolución época corazón libertad coronel causa patio golpe peligro mirada crimen policía doctor pecho muerte plaza palabra mulato esposo capa sótano dictador acción valor cuartel 
59	0,11716	soldado enemigo jefe fuego ejército tropa fuerza arma combate plaza coronel orden campo general columna ciudad guerra cañón caballo batalla cuerpo capitán cuartel grupo francés ataque camino caballería artillería bala fusil marcha bandera batallón pueblo sangre prisionero cadáver victoria tiro teniente triunfo línea defensa espada sargento compañero campamento sitio movimiento 
