69	0,05556	caballo paisano gaucho partida gente pulpería daga soldado cabeza alcalde manera puerta guitarra rancho sargento trabuco sable puñalada golpe corazón lado mazorca bandido mirada partido justicia campo teniente muerte camino vuelta voz cintura prenda pico plaza baile expresión quinta copa plata arma ira valor cuerpo diablo compadre cara palabra espíritu 
70	0,05556	galera techo cajón sueño embargo luz fondo causa rumor tierra voz escuela lluvia pan sombrero hombres plaza esquina qu ojos cambio fondero banco crimen trabajo silencio tachero manos punta et frente golpe duda suelo manto sol sombra voces almacén reja cuadra tono viento izquierda fortuna calle il vestíbulo cama des 
71	0,05556	puerta mesa color luz lado cabeza sala traje pared pie habitación oro brazo patio espejo silla salón seda cristal cuadro ventana sillón mueble centro papel escalera pieza calle ruido reloj forma plata flor rostro cuerpo cuello madera comedor fondo cuarto bronce sombrero alfombra suelo mármol balcón derecha cabello hombro año 
72	0,05556	rastro asesino pie caballo rastreador suelo duda cortito cara rumbo vaquero muchacho hijos ojos vereda asesinato herida bota dirección voz camino tapia sol pelo orden negro mozo grupo cielo muchachos caballos ai autoridad amo tierra peones vacas hombres descanso pisada raza manos costumbre resto sentido luz entrada aire silencio acequia 
73	0,05556	voz sangre brazo cuerpo grito cabeza muerte pie cadáver golpe fuerza palabra suelo fuego rostro silencio tierra mirada pecho puerta herida agua boca movimiento luz arma terror lado ruido escena esfuerzo dolor aire espada grupo miedo venganza instante espalda víctima peligro cuello llama labio puñal hombro muerto lucha piedra oído 
74	0,05556	duelo padrino dinero pistola filósofo lance caballero efecto perro honor palabra embargo avaro do razón desafío adversario motivo fortuna coche historia muerte papel arma espada chaleco palo pintor barón duro año sitio tierra corazón comerciante testigo mal comida casualidad cabra gravedad cara derecho artista contrario proposición cajero relación animal puerta 
75	0,05556	corazón amor alma felicidad palabra sentimiento placer pasión instante esperanza amante ser idea mirada pensamiento ángel vista flor cariño pecho virtud objeto dicha cielo rostro afecto labio dolor ilusión lado duda belleza lágrima desgracia cuerpo manera existencia alegría tierra pena señorito ternura luz deseo encanto imaginación imagen semblante ventura naturaleza 
76	0,05556	sor tienda superiora ciudad luz establecimiento socio religioso par polvo sombra grupo voz género puerta lado agua taller criatura marchante dormitorio asilado colegio papá letrero acera nana través dependiente aire orden sastre calle rostro brazo papel calor vidriera casas aspecto trabajo interior pan mostrador instante lengua herrería precio claridad nube 
77	0,05556	gobierno pueblo ministro país revolución guerra partido presidente patria poder política orden libertad jefe gobernador palabra provincia ley autoridad arma gente ejército fuerza nación plan diputado plaza año enemigo elemento causa independencia capital tropa derecho triunfo mando patriota ciudadano opinión secretario campaña paz entusiasmo noticia elección acto decreto estado principio 
78	0,05556	negro esclavo amo ingenio finca mulato mayoral machete campo gallo caña azúcar guajiro perro blanco castigo café ama esclavitud cafetal criollo tabaco color negros odio calesero trabajo cuero látigo bohío vivienda raza menudo gente pie pañuelo pelea esclavos falta lector oficio corredor ocasión sol batey cura colgadizo alma cabeza isla 
79	0,05556	madrastra extranjero muchacho ingenio tierra espacio edad mozo escuela efecto rostro antilla sol duda lectura villa color mesa mañana nariz fisonomía modo luz capital libro llegada sombrero menudo título presencia compadre viuda voz embargo pelo grado origen copa propiedad afecto asiento país raza fortuna tierras tanto oro alcoba mulata banquero 
80	0,05556	esposo matrimonio novio marido boda ceremonia casamiento rey palacio dama caballero año abuelo anciano fiesta dicha hogar príncipe enlace corte padrino felicidad alegría castillo regalo fortuna dote lector instante personaje criado gusto unión dignidad artista hacienda bendición alma título consorte heredero cielo nobleza brazo amo dueño efecto reina riqueza noticia 
81	0,05556	mayordomo calle puerta vista sala viudo desgracia poeta pensamiento gabinete diablo ama boca mal oro bandido bien plazuela llave manera morena mesa campana placer dinero luz hipócrita pie recámara crimen esquina criado modo balcón lado vuelta infierno estado papel callejón número coche sociedad sofá deseo derecha miseria vivienda circunstancia comadre 
82	0,05556	capitán coronel teniente gobernador jefe comandante orden soldado ejército caballo general voz cuerpo servicio cuartel mando revolución fuerza confianza campaña espada papel gobierno regimiento ayudante guardia caballería ciudad pliego carta tropa arma despacho sargento cabeza marcha plaza pistola correo causa asistente carácter valiente cabo puesto muchacho comunicación camino plan oportunidad 
83	0,05556	caballo camino árbol pueblo agua campo animal lado río lugar pie bosque tierra perro distancia cabeza jinete año marcha vista hacienda monte viajero sol ruido gente mañana muchacho legua orilla tarde sitio montaña dirección terreno carrera compañero arroyo viaje piedra aire suelo rama efecto sombrero trabajo especie yerba movimiento sombra 
84	0,05556	tío sobrino primo calle lado tía muchacho habitación sombrero destino cuarto gesto carácter carta partido baúl rato libro fortuna embargo par cabeza cama recomendación rostro informe piedra letra luz espalda humor puerta memoria alegría cuñado terror escalera sol camisa muelle influencia movimiento oído ropa cuello oro gravedad acto gorra estado 
85	0,05556	secretario oficina abogado escribiente licenciado despacho portero expediente empleado estudiante año mesa jefe negocio juzgado papel empleo ministro juez pleito gobernador agente sesión diputado puerta magistrado ley presidente maestro asunto agua pluma título dinero ministerio orden legajo salón letra trabajo sueldo fondo turno letrado colegio compañero voz número examen ocasión 
86	0,05556	muchacho puerta calle dinero gente mesa criado año vecino ropa cuarto cocina trabajo comida vino cara agua cabeza pieza vela cama plato lugar tienda palabra pan hambre papel amo botella silla camisa vaso plata suelo cocinero pobre patio mes semana piedra alhaja sombrero oro ladrón rincón boca ruido voz barrio 
87	0,05556	marqués conde corazón duque general alma amor gabinete pie marquesa poeta lector salón conciencia jorobado carta virtud año sonrisa idea coqueta beso imaginación cara gloria impresión felicidad honra pecho guerra triunfo razón já labio mirada risa historia sociedad brazo camino cámara fisonomía puerta entusiasmo mentira dignidad baronesa sillón embargo libro 
88	0,05556	sargento cerro gruta partida cordillera jefe valle patria silencio cabo grupo quebrada fondo sable instante montonera cóndor godo cumbre mulo animal aire guerra sur norte lego patriota horizonte rey tropa caballo soledad falda rastro nariz pie jinete matorral peñasco punta oro insurgente territorio cuero caudillo montaña país serranía invasión ganado 
89	0,05556	bandido jefe ladrón policía robo compañero crimen bandolero voz silencio carta plateado sociedad excelencia dinero agente justicia ciudad tono oro camarada duda puñal puerta efecto aspecto vista café juramento cuadrilla salteador terror candidato historia ron asalto sitio caverna orden modo lugar venganza lance tierra gendarme autoridad paraje calle población alegría 
