0	0,05603	príncipe rey palacio princesa emperador español monarca capitán ciudad tierra imperio corte enemigo voz conquistador trono dios reino pueblo ejército soberano indio oro orden arma gloria cortés gente brazo embargo poder esposo guerra corona tesorero sangre habitación conquista guerrero vasallo palabra marina súbdito lago plaza extranjero mejicano respeto riqueza muerte 
1	0,03853	convento sor monje fray religioso claustro superiora celda abadesa maestro novicio hábito año comunidad colegio fraile capellán coro franciscano voto voz criatura ciudad orden monasterio voluntad lego papel lugar jardín regla portería muro villa paternidad guardián fuerza arzobispo hacienda patio mañana velo refectorio espíritu motivo huérfano anciano reja necesidad asilo 
2	0,03412	francés ejército emperador imperio ciudad diplomático guerrillero nación caballero general archiduque emperatriz trono frente porvenir negocio coronel soldado monarquía guerra esposo intervención corazón dama campo existencia situación caballo tumba orden bandera batalla jefe cuestión república palabra país honor comandante capital republicano corte mariscal derrota sangre muerte sombrero patria revolución política 
3	0,06067	cuerpo calle ocasión vera año brazo luz sueño cara sitio memoria amor instante principio jardín tranvía muerte vivienda fuerza gendarme par santo beso respuesta cariño individuo ventana tarde hombro cama existencia recuerdo estancia rumbo minuto dicha chico miedo chiquillo grupo dueño cigarrillo caricia reja cambio espalda sol artista rumor acera 
4	0,08077	iglesia sacerdote altar misa templo voz puerta santo sacristán pueblo alma oración capilla religión cura gente calle ciudad fraile procesión campana tierra imagen oro devoción fiesta cielo plaza ceremonia convento atrio obispo gracia sacristía fe nave luz cruz confesión maestro pie pecado agua culto camino sermón devoto hereje obra lado 
5	0,00531	galera escuela autoridad clase concurrencia pueblo tarde monitor chacra tierra silencio penado plaza sombra muchacho cuja alameda banco cama fuego fondo sol bigote masa fortuna provincia duda techo pasajeros galeote reja castigo costurera falta marcha país tortura aspillera bancos puños departamento porción claridad pan antegalera espectáculo muchachos vela orden combate 
6	0,0789	gobierno ministro pueblo presidente guerra revolución país poder partido orden jefe política autoridad patria gente arma ley diputado palabra plan independencia tropa fuerza derecho libertad capital plaza nación voz papel noticia secretario enemigo mando ejército general gobernador elemento mes junta salón sesión acto comisión movimiento triunfo patriota opinión año estado 
7	0,00315	cara mar lluvia agua puertas sol movimiento costa catedral obra sangre garganta mozo aguas tiple horas presencia portera frío especie vista rueda clase camarín carne plaza cristal calle escenario vestíbulo recinto dinero necesidad cielo casullero belleza entrada gesto embargo rocas olas libertad granito silueta lugar cuadro roca rumor gira chiquillo 
8	0,02099	misia tienda pueblo doctor plaza partido mostrador juez voz club ordenistas sala papá política gobierno iglesia elección calle distrito tendero candidatura cura esquina escuela ordenista mistress capital sobrino bandera lado fondo ñ_a cabeza pulpería barrio italiano candidato portal compadre temor color tío muchacho costumbre autoridad chico gracia pañuelo comisario tertulia 
9	0,04045	unitario ciudad calle cabeza orden patria sangre mirada rosa revolución puerta tirano caballo espíritu provincia año embargo servicio gobierno palabra pueblo salvaje libertad policía época doctor jefe gobernador alma puñal fisonomía causa río negro campaña comandante coronel movimiento acción mate sereno mulato patio tiranía partido individuo frente país ejército plaza 
10	0,0031	pueblo cura trabajo escuela mañana juego muchacho memoria tierra aldea veces pie sueño árboles arroyo lectura maíz flores libro deseo sol libros campo rancho perros orillas lago semblante villa carga grado chico montaña juventud iglesia papel montañas lugar cerro maestro curato hojas interés casas mercado viento cara corral molino idea 
11	0,03104	negro esclavo amo ingenio mulato finca mayoral blanco ama campo caña esclavitud menudo castigo perro azúcar calesero negros raza mulata odio color lector corredor esclavos alma látigo voz año trapiche trabajo matrimonio siervo oficio época sangre cuero falta ocasión causa cura carácter caballo muerte vivienda cepo compañero criollo máquina señorito 
12	0,04975	tío sobrino primo calle prima lado puerta casita tía silencio carácter criatura cuarto embargo libro cama fortuna especie callejuela voz año habitación movimiento sala duda alegría dolor impaciencia tesoro brazo informe muerte memoria estado escena modo hoja visita partido destino tono orgullo manga hogar generosidad carrera aspecto vuelta causa razón 
13	0,0306	alcalde dama alguacil barón rey amor fraile puerta marqués lugar palacio calle corte muerte habitación razón orden ciudad escudero espada maese do cámara reina litera rostro instante palabra cielo modo criado alma caballero crimen efecto mal virrey vano obra venganza secreto vara taberna jardín miedo peligro granuja rajador cuello ronda 
14	0,03138	marqués conde duelo general duque corazón gabinete pie marquesa lector honor amor padrino salón jorobado alma conciencia coqueta poeta já virtud año marido honra idea risa cara sociedad gloria sonrisa razón imaginación derecho guerra lance reina triunfo puerta carta mirada pistola cámara desafío amo satisfacción pecho levita beso baronesa adversario 
15	0,01919	compadre pollo mamá baile manera amor coronel papá marido sastre león chocolate polla criado curial niñas grado alma negocio muchacho visita sombrero sazón idea criatura mirada razón lector comadre levita agua licenciado novio cara revolución silencio vecino historia dependiente vecindad personaje general destino rato cosas curva chucho polvo cabeza peso 
16	0,00449	guitarra gaucho voz baile alma cortito rancho muchacho canto caballo campo corazón sentimiento amor muchacha cantor guitarrero tierra negro dueño chiripá línea sombrero tía gauchos pago suelo ciudad alegría fiesta gato bota puesto traje bastonero conversación año pañuelo sueño palenque amores cocina trabajo mostrador embargo mozas piernas barba orden cielo 
17	0,0287	esclavo dios ciudad instante sitio pieza do templo sacerdote calle edificio lado gladiador vista tenia estatua puerta palabra columna amo pueblo oro pórtico multitud pintura ceniza pared mármol piedra anfiteatro virtud agua rostro año forma riqueza bronce carro número romano esposo anciano tierra traje primo vino grada personaje cristiano placer 
18	0,05812	manera bandido cabeza muerte golpe orden soldado asesino espíritu gente cariño sangre acto cara palabra miedo cuerpo autoridad mazorca pueblo cuchillo desesperación calle fuerza grupo venganza lado situación grito trabajo víctima terror valor pie herida puñal aspecto brazo género peligro ropa ira dolor comandante suelo puesto escena cadáver compañero remedio 
19	0,15156	corazón alma lágrima dolor esposo muerte desgracia palabra brazo anciano cielo voz amor sentimiento rostro esperanza cariño criatura frente pecho consuelo año existencia felicidad tierra suerte llanto pena miseria lado virtud fuerza instante bien labio deber pensamiento pesar perdón mal recuerdo razón desgraciado ser cabeza destino amargura falta infeliz víctima 
20	0,02594	doctor año examen memoria ciencia conversación merced placer color mirada estudio compañero juventud menudo profesión ausencia orden programa grupo prueba pizarra río época maestro discípulo agua claustro desdén periódico cambio profesor libro cara expresión enemigo enferma techo amo catedrático latín costumbre clase piel gabinete palidez sala simpatía mal música habíase 
21	0,12216	pueblo año sociedad país idea tierra ley libertad trabajo obra derecho época raza escuela siglo patria ciudad historia espíritu educación clase progreso hecho nación virtud justicia razón religión humanidad libro naturaleza luz necesidad inteligencia principio estudio vicio civilización porvenir ejemplo gobierno forma guerra edad campo fuerza mal sentimiento carácter juventud 
22	0,03043	virrey calle puerta oidor señoría dama corregidor bachiller inquisidor negocio ciudad lado negro canónigo escribano arzobispo lacayo cabeza alcalde palacio espada gente aposento marqués lugar convento rostro año tarde brujo orden luz sombrero alguacil brazo sitial secreto noticia especie anciano primo conspiración licenciado mesa capa ventana estancia grito conversación embargo 
23	0,03475	caballo paisano gaucho partida gente pulpería soldado daga sargento alcalde indio rancho camino sable arma trabuco cabeza puerta jinete golpe compadre campo quinta partido guitarra justicia rienda vista pico teniente mirada puñalada animal carrera prenda lado vuelta cintura mate campaña galope plata acción muerte perro toldo tordillo policía cuerpo voz 
24	0,02016	filósofo embargo efecto avaro artista caballero razón perro monsieur pintor lector objeto barón palabra ostra duro dolor chaleco barquero historia cabra pueblo viajero relación cajero paseo fortuna sabio partido esperanza lucha cara doncella verja cuestión cerrajero motivo animal casualidad concepto boda sujeto sitio posada guerra corte novio gravedad suceso muelle 
25	0,11034	esposo marido amor matrimonio novio casamiento boda amante felicidad pasión dama cariño celo alma viudo criado enlace ceremonia silencio hogar corazón sociedad beso año razón unión suegro deber lágrima brazo padrino manera fortuna escena mes belleza escándalo fuerza situación lujo lector dicha querido lado yerno amo testigo bendición extremo época 
26	0,01505	piano ventana fisonomía música año corazón juventud efecto cabeza mirada aposento amor acento frente extranjero habitación jóvenes años color lado alma vista campo anciano manera embargo sentimiento país expresión libro aldea piso rostro hacienda cara mes brazo madera calle rincón lecho fondo muchacho voz mamá orden razón vd estatura poesía 
27	0,00704	madama aldea maestro calle agua muchacho puerta patio escuela abuela sol villa cara aserradero causa ciudad edad brazo pam catedrático persiana misia discípulo chico trabajo obrador mate palabra prueba pan tienda libro torre tarde hambre porvenir carta marcha zaguán tierra cabeza mister carne corralón muchachas polvo llanto mes respuesta marido 
28	0,01045	lía campanas puerta iglesia ciudad patrón tahona arrabal calle parapeto tienda campana panadero sereno calzada despacho cara rúa mostrador reloj billete sol rajo hermana taller beso silencio barrio señorito gente horno misia muro granito ventana dinero golpe convento señorita mar dam dársena pilón capellán ama ceño curiosidad piel espejo nido 
29	0,10329	carta corazón amor año papel palabra criado mamá señorito mesa lágrima mes cuarto cariño papá viaje noticia mañana letra libro tarde deseo retrato visita calle idea rato tío recuerdo amante felicidad pensamiento balcón puerta duda prima objeto modo lectura gusto beso pena esperanza memoria ausencia sala ama gracia partida pie 
30	0,00344	caballero carruaje tarde baile jóvenes muchacha sala sociedad vd lord bobo compañera siglo señorita niña alma fistol carcajada fisonomía interés puente atención centro puerta tono palabras compañero carruajes dinero hijas grupo juventud anciano altar paseo carrera orden efecto miradas lujo abanico posición tenia amor vista hija estudios fila patio vano 
31	0,06761	caballo hacienda camino pueblo amo compadre rancho cuidado muchacho fuerza jinete mozo brazo bandido gente sombrero silla dinero animal instante pie pistola cabeza gusto orden arma jefe cura compañero palabra lado administrador muías rato ranchero manera merced criado corral negocio cara toro razón mulo plaza interés rumbo suerte trabajo campo 
32	0,08179	cadáver muerte dolor cuerpo muerto cementerio tumba lágrima grito sepulcro alma lecho tierra corazón silencio agonía frente rostro llanto sepultura difunto lado desgracia entierro resto sangre brazo caja cabeza tarde pecho ataúd suelo moribundo cuadro médico instante habitación víctima sacerdote sollozo labio cruz enfermo existencia lugar boca mirada pie recuerdo 
33	0,00453	matrimonio título época ciudad raza niña viuda marido siglo yerno condesa baile iglesia damas colonia señorita dinero rival deuda ministro prima razón calle hija visita concurrencia pregunta gente mulata pobres beneficio santo objeto caballero uso plaza baya_mes cuñado llegada metrópoli finca salón entrada libro orgullo colonias patriotismo efectos marqués conquista 
34	0,12416	puerta calle cuarto luz patio ventana sala pieza escalera mayordomo criado llave ruido voz lado vista cama balcón pie pared zaguán mesa cabeza esquina golpe corredor habitación papel silencio vela vecino brazo suelo desgracia palabra silla entrada portero manera coche mañana vuelta sombrero barrio tarde reja oído ama rato agua 
35	0,11784	cabeza color puerta mesa luz oro lado sala pared pie brazo traje espejo silla seda salón cristal patio habitación cuadro sillón rostro mueble forma cuello plata sombrero cabello reloj fondo centro mirada mármol ruido sofá cuerpo alfombra papel escalera bronce ventana hombro flor suelo asiento frente madera pieza labio corredor 
36	0,10049	caballo camino árbol agua pie bosque lugar lado río animal tierra campo montaña piedra viajero sol distancia año compañero marcha perro vista monte pueblo suelo fuego indio orilla legua rama entrada cabeza terreno ruido arroyo sitio tronco muchacho embargo cueva viaje valle gente aire especie gruta vuelta trabajo partida yerba 
37	0,00748	inglés terrado agua herrero madrina población muchacho caballo pueblo jinete playa mar peligro carácter indio plateados tierra diligencia arroyo tarde examen lugar costa huerta dinero cura francés bosque montaña voz muro río lado edad año vecinos arena especie hacienda gobierno mamá cuello olas bandidos sargento permiso casita modo árbol ministros 
38	0,14483	amor corazón alma felicidad pasión palabra amante sentimiento mirada placer pensamiento esperanza ángel idea ser labio cielo dolor instante pecho dicha rostro lágrima vista objeto belleza ilusión flor embargo virtud duda cariño recuerdo cabeza imaginación existencia deseo ternura afecto luz emoción naturaleza desgracia encanto sonrisa acento lado semblante tierra sueño 
39	0,03276	merced calle caballero cabeza seña duda abuelo edad mulato puerta ama palabra embargo balcón tono sala cuerpo año cabello señorito rostro color atención muchacho cama ventana cuarto seda tienda silla mercader sazón calesero silencio convento ciudad pie traje nieto azotea expresión aposento motivo mañana efecto pañuelo tierra quitrín derecha brazo 
40	0,08004	poeta obra libro palabra arte maestro artista voz ciencia autor especie espíritu sabio modo razón talento estudio carácter forma música impresión objeto nota año verso individuo expresión idea opinión manera salón fenómeno país armonía inspiración alma instrumento retrato genio número discípulo profesor sesión poesía papel gloria belleza teoría idioma cuadro 
41	0,04924	indio español dios sacerdote instante palabra guerrero cacique extranjero pueblo cabeza país soldado ciudad choza anciano piedra lugar templo número año labio mirada enemigo tierra patria sangre corazón flecha arma objeto sacrificio semblante pecho guerra muchedumbre altar grito algodón embajador idioma cabaña campamento tribu brazo mañana multitud voz puerta azteca 
42	0,00498	mina trabajo amo amor palabra naturaleza sol quebrador mañana caña hambre cadena piedra muías muchacho orden patio amol distancia color niños dinero barretero almuerzo real cuarzo ciudad embargo botella cerebro potro minas bonanza tipo lector época flor tortilla manera lado nieta molienda longitud necesidad pared autor mes mula casucho morada 
43	0,00491	niña hija años hermana corazón ojos educación esposa padres alma cariño edad palabras anciano veces mirada carácter afecto rostro voz señorita embargo modo flores doncella hijas placer lado colegio amiga sentimientos alegría fortuna hijos dulzura presencia vuelta frente meses esposo aire lágrimas nacimiento acento muerte existencia manera poeta señoras gracia 
44	0,17286	voz palabra brazo puerta cabeza instante mirada silencio rostro pie fuerza grito labio pecho sangre luz corazón cuerpo duda acento golpe movimiento semblante vista muerte lado ruido sonrisa esfuerzo frente miedo venganza oído caballero embargo escena suelo terror dolor rodilla pensamiento sombra lágrima camino espanto aire expresión lecho lugar arma 
45	0,02097	hospital doctor enfermedad lazarino amo capellán sepulturero embargo mal sitio salud médico enfermo corazón muerte esperanza alma suceso remedio carta vista pirata dolencia historia espíritu especie impresión dolor situación viaje aire efecto existencia sociedad leproso cama consuelo infeliz duda silencio recuerdo desventurado fuga gente relato crimen suerte billete agonía cónsul 
46	0,03483	teatro palco público escena telón artista función gente aplauso actor orquesta comedia ópera escenario música voz calle asiento puerta empresario acto cómico representación drama entrada espectáculo platea bastidor lugar tierra traje coro actriz concurrencia sombrero circo compañía número tragedia foro obra silencio localidad jardín razón maestro brazo luneta luz papel 
47	0,10336	dinero negocio fortuna trabajo juego oro capital mes manera cantidad calle cuenta precio suma peso gasto escritorio carta mesa situación suerte miseria comercio sociedad jugador crédito bolsillo modo lado año relación socio gente recurso confianza embargo interés patrón clase sueldo caja viaje hotel dependiente ganancia esperanza idea asunto cliente banquero 
48	0,00295	indios armas soldados españoles ojos hombres cabeza imperio sol cortés hijos dioses silencio oro mirada aguas caudillo plumas guerra indio sangre pies rostro cacique traje veterano pueblo riquezas pensamiento agua conquista continente jefe piedras secreto emperador soldado voz enemigos fuego pecho conquistador astucia arena corte efecto combate costas conquistadores imaginación 
49	0,0055	jefe sociedad ciudad candidato compañero secretario café silencio juramento viuda ron inglés neófito modo luz dinero sangre lugar vd aspecto agua hermanos tono sala sillón cosas salud calle asociación manos voz mesa traje charco miedo vista hoja entrada corriente prendas penumbra morada escribiente veces juzgado gobierno hospital extremo cargo centro 
50	0,06199	ejército jefe enemigo tropa soldado fuerza prisionero coronel marcha batalla manera arma combate orden caballo guerra caudillo caballería ciudad campaña gobierno provincia campamento infantería elemento triunfo general lado noticia campo cuerpo fraile gente montonero fuego camino línea peligro muerte acto persecución escolta grupo regimiento libertad carga división derrota causa sorpresa 
51	0,11065	cuerpo brazo carne sangre amor boca alma cerebro rostro labio sombra sueño beso espíritu dolor cabeza pensamiento pecho luz idea frase sol pierna fuerza agua fondo deseo ser dedo bestia pasión cuello garganta pupila odio golpe organismo piel rincón perro mirada sensación visión nervio fiebre mal muerte seno frío caricia 
52	0,22498	asunto palabra razón efecto idea modo motivo manera duda noticia ocasión lugar situación camino circunstancia atención confianza embargo conversación interés falta objeto relación hecho causa presencia secreto deseo visita fuerza papel plan peligro intención propósito caballero orden conducta costumbre principio prueba voluntad desgracia temor resultado necesidad opinión condición acto negocio 
53	0,04314	bien abogado pleito título herencia heredero criado testamento nobleza riqueza fortuna acto voluntad señorito muerte dote efecto dinero esposo documento caballero escribano hacienda alma castillo cantidad virtud estado posesión justicia bondad cuerpo objeto manera raza trabajo orgullo palacio idea favor sangre cuenta ley honra sentimiento conferencia caridad escritura matrimonio marqués 
54	0,01928	estancia campo caballo rancho peón patrón capataz silencio gaucho sol vaca viento mate cocina chino corral oveja cuero tierra montonera monte pluma aire animal lana rodeo suelo majada paja potro horizonte perro pajonal pie cabeza tranquera correa establecimiento pampa voz lado peones ñ_o godo pago gente grito canoa ruido lazo 
55	0,00387	palabras rostro amigos imaginación habitación vista modo compañeros tarde alma esposa calle desprecio golpe plata crimen razón ser temor multitud estado muerte cabeza lágrimas caballero efecto palabra robo deseo color coqueta silla llave do cautiverio realidad salud templo ejecución hecho lugar fiesta deseos necesidad movimiento parecer caballeros mecedora magnolia cita 
56	0,01745	alicio teatro cuestión público mueble provincia escritorio fuerza embargo carrera vuelta pueblo est suma cabeza p_as i_l sangre calle canalla n_e precio sentimiento empleo vous oficina escena t_out policía arte aire bolsillo francés cuerpo gaveta examen bohardilla ce honradez marido fraile compañía príncipe presencia manera negro especie oficio derecho aspecto 
57	0,0164	espíritu idea alma pasión fuerza ser forma cerebro pensamiento belleza luz sentimiento imagen materia existencia mirada voluntad frase deseo estudio inteligencia conciencia recuerdo creación celo atmósfera acción brillo palabra naturaleza inspiración sueño lucha médico embargo razón ideas amor planeta gato imaginación pupila causa sensación cuerpo hermosura misterio sentido voluptuosidad fiebre 
58	0,00629	posadero posada dinero pueblo doctor licenciado gente rostro habitación honradez capital tenia silencio cabeza teatro diablo talego cafetal dama señores secretario hombres champaña sombrero vajilla pleito humanidad plaza efecto gesto coñac comerciante pistola abogado vecindario pagaré confianza paloma comandantes cuarteles continuo amigos cuartel espalda litigio mozo tomo bribón entusiasmo hacienda 
59	0,01513	ojos manos años voz luz cabeza labios veces brazos puerta flores aire rostro hombres palabras sol mujeres días niña hija boca corazón color frente lado cielo silencio alma horas pies cuerpo calles pasos lágrimas ruido pecho casas árboles mirada cosas vista miradas puertas sombra rayos nubes nariz noches calle amor 
60	0,04183	estudiante insurgente capitán cura pueblo sangre brujo corazón revolución palabra caballero fraile rey destino silencio independencia multitud alma héroe español soldado existencia muerte negocio historia aposento sombra voz diablo caudillo honor espíritu merced mulato ciudad secreto cabeza idea porvenir miserable virrey oro libertad clérigo aliento siglo inquisidor orden ejército torero 
61	0,13393	muchacho cara cabeza boca chico pie diablo aire nariz dedo perro puerta mozo pelo lengua agua santo vuelta pierna sol cuenta gato punta gana rato risa diente color papel gusto sombrero voz vergüenza ocasión alma oreja gesto cuento falta calle gente escuela palo pata barba ropa cuerpo duda par pan 
62	0,01738	gobernador gobierno jefe secretario policía provincia virrey teniente autoridad manera loco diario pueblo despacho mando confianza servicio puesto oportunidad paz medida tropa nombramiento dinero justicia época carácter interior insurgentes independencia ayudante correo empresa modo seguridad caudillo embargo locuras oposición platero sarmiento comandante excelencia actividad fuerza lado política gabinete miedo tropas 
63	0,03616	alma cuerpo corazón cabeza rato lado silencio sangre calle luz médico tierra cielo amor voz sol hogar palabra cama dolor sombra cuarto cara pecho alegría frente esplendor brazo miedo pasión muerte rostro marcha trabajador aire obrero espíritu seda ímpetu frío año enfermo grito mejilla libro trabajo paz plegaria violencia dormitorio 
64	0,10444	prisión crimen cárcel preso justicia juez reo calabozo muerte causa orden delito asesino libertad víctima sentencia declaración carcelero papel alcaide pena verdugo asesinato bandido ley prueba soldado sangre castigo tormento hecho criminal autoridad gente lugar amante testigo cómplice guardia conciencia noticia tribunal proceso ejecución ladrón puerta desgraciado año autor venganza 
65	0,01826	cura amor idea curato pueblo procurador compañero caballo lisa año chucho paternidad limosna párroco vecino fraile aire mamá fiesta convento función prima justicia estudiante robo muchacho tarde plata fe color alamedero criada bienestar habilidad entusiasmo movimiento rey vino mes curita cera misa trabajo taller educación ladrón secretario baraja monte juego 
66	0,07822	soldado enemigo fuego plaza tropa jefe fuerza arma columna campo cañón combate orden sangre fusil bala ataque bandera general cuartel pueblo ejército grupo guerra batallón ciudad cuerpo tiro teniente artillería cerro coronel camino francés sitio victoria defensa cadáver tierra grito herido línea espada campamento pieza descarga capitán movimiento voz posición 
67	0,01642	deán jesuíta prepósito conde caballero provincia socio comisario obispo gobernador judío maestre embargo orden dominico cabildo colegial puerta capitán suceso palacio especie presencia negocio silencio carta asunto ánimo efecto sitio escena esposo colegio mesa prelado aire objeto bien confesor visita regidor manera historia villa usarced finca convento interlocutor pie comisionado 
