68	0,0242	v_d doctor país tenia sociedad manera vd gusto criatura amante negocio h_u personaje carta fortuna cuarto esposo visita posición instante corazón cuaderno teatro palabra bailarín educación vista necesidad asunto semana gracia objeto libertino vds imaginación do sílfide orden embargo traje mendigo calle ciudad razón astrólogo entrevista pieza alemán billete criado 
69	0,12273	año muchacho calle ciudad carácter tarde libro frase estudio mirada edad idea gente estudiante compañero recuerdo sonrisa mes posición ocasión vista deseo gusto aire conversación cambio sociedad porvenir viudo pasión impresión cariño hogar ánimo detalle propósito movimiento fondo cara circunstancia cabeza espíritu realidad embargo tono clase juventud imaginación rato situación 
70	0,01162	p_a p_o amo vaquero voz piedra lado cabeza muchacho mozo miedo fraile sangre cara morenciano camino patio mañana raza sol plática luz tío ai atención puerta verdá secreto mirada tierra árbol cielo vide aljibe pelo orden cubiertos vido matrimonio muerte cesto e_r hacienda ley pie detalle corral pausa sombra aija 
71	0,02989	juez policía comisario agente barón asesino sangre crimen cadáver aldeano herida instrucción cabeza magistrado bosque pie embargo rostro médico compañero manera gendarme bolsillo prueba lado declaración matador tierra cuerpo pieza inocencia calle huella mancha rodilla puerta dirección asesinato camino víctima justicia juzgado convicción ley voz examen emoción pisada ropa testigo 
72	0,0709	muchacho dinero año gente criado calle amo ladrón puerta lugar vecino palabra oro ropa licenciado hacienda agua plata alhaja cuarto trabajo semana coche caballo pueblo mes cabeza recámara efecto canoa cara rancho peso tienda indio camisa diligencia pobre conversación pulque miedo rebozo cocina lector fistol sombrero multitud mulo piedra visita 
73	0,00375	as alfiler oro sota talismán misia fortuna comedor hermana plaza coche camino brujo calle caballero duda papá anciano veces esposa frac partida clase mozo amigos oficina ministro espejo hijos manos juego tía historia techo gente miedo bastos ruido vergüenza muerte noches palco albur lugar cielo jefe ciudad marido orden color 
74	0,01556	compañía perro pico manera ventana director pueblo dama historia criado payaso cuarto situación patio amo actor voz galán cabeza mosca público ruido palma teatro duda motivo té castaño comitiva sazón escena arte circo habitación mirada personaje papel circunstancia pieza sonrisa objetos señorito escribiente apuntador estado lugar carrera grupo traje figurante 
75	0,02437	conde condesa barón palacio castillo instante voz caballero dama rey duda año baronesa esposo orgullo esperanza mirada doncella corte personaje atención primo país condestable dueño sonrisa gesto objeto felicidad heredero discípulo brazo secretario título idea carretela ceremonia respeto aposento estancia cielo calma modo presencia posición sala velada poder infante nobleza 
76	0,09139	mesa copa vino botella vaso plato café comida compañero cocina comedor agua voz gusto lado trago mozo cena estómago pan apetito conversación huésped licor cocinero mantel pieza servicio brindis carcajada convidado mañana almuerzo banquete gente dueño orden palabra sombrero pie manjar sopa honor salud cigarro silla silencio fonda taza olor 
77	0,00285	hermanas calle patio veces comedor estudio barro ciudad hijos casas calles padres cosas años espíritu libros tía país cielo luz olor papel lluvia cuartos gente paredes lado páginas hojas viento vidrio partes barrio arte noches recuerdos color tierra niñas sol viejita vidrios mármol paraguas cuadros atmósfera ciencia hierro verano mesa 
78	0,04654	capitán coronel teniente orden jefe comandante excelencia soldado ejército carta servicio gracia espada compañero cuerpo camino voz bandido sargento duda diablo regimiento cuartel plaza muchacho país compañía efecto camarada bandolero marcha atención pliego licencia asistente valiente campaña oro deber fisonomía uniforme honor patriota caballero permiso caballería talento militar agente guardia 
79	0,00409	mirada flores corazón puerta lado embargo hermana árboles nido río guerra flor ojos imaginación alma castillo capa cielo jóvenes afecto expresión plumas luna desierto patio forma canto pluma ciudad amor sonrisa mente belleza bosque época juventud idea patriota colinas ruinas cabellos ventana rama objeto anciano oro dolor ocasión estatura bosques 
80	0,05821	mar buque capitán costa puerto agua bote tierra marinero pirata playa ola cubierta vela viaje muelle embarcación viento vista marino isla barco inglés orilla gente lancha lado popa nave canal vapor año ciudad pasajero río proa navío goleta remo rumbo grupo bahía fuerza brazo marzo tripulación orden sol caballero palo 
81	0,0411	voz palabra alma cabeza año aire mamá expresión figura fiesta máscara silencio espíritu grupo pie papá rato flor vuelta marco tono brazo trabajo viaje risa criatura cabello obrero gracia amor cuerpo luz chico impresión belleza estancia marido movimiento lado compañero idea salón traje temor ser gesto dolor embargo voluntad grito 
82	0,0392	periódico artículo oficina secretario licenciado pluma mesa papel calle despacho periodista escribiente diputado jefe cuarto asunto escritor palabra redacción carta cara director párrafo talento empleo ministro idea puesto sueldo expediente frase trabajo prensa camino portero mañana abogado estudiante compañero rato diario negocio letra número oposición interés cabeza muchacho cólera imaginación 
83	0,0362	gallo caballo machete guajiro negro finca camino tierra pueblo cabeza perro cafetal campo bosque palma café especie pelea árbol hoja río sombrero pie potrero monte criollo bohío tabaco canto color gente suelo hombro colgadizo azúcar valla naturaleza pañuelo plátano animal yerba mañana distancia país ingenio fruto partido carreta cuerpo aire 
84	0,00722	plaza modo sociedad tono luz cielo acciones movimiento oro negocios sazón viento juego jefe pasajeros empresa salón sangre ciudad banquero aspecto edad mozo capital acción negocio propiedad cuerpo bigote bolsa nariz gobierno fisonomía atmósfera pelo naturaleza calle hacendado moda gente policía esfera espacio manera calma sol niñas jugada falta ambiente 
85	0,07991	médico enfermo doctor enfermedad cama lecho fiebre estado cuerpo dolor salud cabeza ciencia herida medicina mal hospital cabecera paciente cuarto muerte facultativo agua cuidado delirio visita remedio curación alcoba año pie estudiante sala operación pulso servicio calentura esfuerzo cráneo pieza sillón gravedad dolencia compañero sentido lado respiración esqueleto espíritu sueño 
86	0,02136	doctor causa boticario defensa fraile alma mamá fiscal cholo hereje defensor corazón pasión ley espíritu razón medalla pueblo poder muerte palabra remedio cabeza médico gobierno hospital botica conciencia carácter manera acusación hermanos centinela derecho niña juez camino religión herejía situación respuesta declaración pena peligro cara sumario enfermedad pieza matón prueba 
87	0,05386	carruaje coche cochero ciudad tren viaje camino pasajero caballo calle viajero hotel portezuela estación diligencia asiento vehículo plaza paseo aire rostro voz pescante multitud instante lacayo cuarto placer pañuelo traje caballero capital mañana extranjero embargo número aventura situación dama puerta látigo compañero avenida sueño equipaje inglés muchacho lado cupé sangre 
88	0,0051	tío virrey muchacho oro muelle marqués guitarra playa piloto tía baúl compadre vela plata aire recomendación moneda camino chico cabeza puerto mar camisa barco habitación covacha bolsillo destino sombrero polizón canción capitán ciudad verdá pana espalda españoles hombres negocio fortuna cura gorra vino embargo bergantín caballero suelo piedra uté dinero 
89	0,00619	sargento guerra soldados ejército hombres paz jefes armas país fuerzas camisa tropas cordillera cama pueblo pueblos filas campamento línea cuerpo alcalde causa quebrada provincia cuartel ejércitos rosas libertad manera jefe campaña cuerpos soldado provincias general montoneros año situación comandante fuerza prisioneros guardia falda lista gobierno elementos autoridad caudillos paisanos acción 
90	0,00268	mesa piano chimenea cama caja agua payador sillas papá abrigo cuarto torre aparcero hijas leña gato mate comedor perro cartas frío inglés nana escritorio estancia sala biblioteca rato tomo amigos lana cara hierro luna madera compañera armario rodillas fósforo café gauchito alfombra compañía lámpara campo pino anciano sitio río recuerdo 
91	0,01278	años amigos veces ojos días año hombres cosas país carácter personas hija palabras padres tierra época ciudad manos hijos historia trabajo edad mujeres corazón meses lugar patria esposa negocios costumbre tiempos oro palabra momentos embargo ideas capital vista campo horas juventud viaje gusto camino mañana ocasión fortuna sentimientos jóvenes manera 
92	0,1101	luz cielo agua nube viento sol voz tierra mar alma aire ciudad horizonte rayo fuego silencio sombra lluvia fondo montaña tempestad espíritu relámpago eco rumor estrella oro trueno ruido ala espacio luna resplandor abismo atmósfera torrente grito oscuridad color seno árbol claridad grupo pueblo roca valle esperanza tormenta ola escena 
93	0,09284	baile salón señorito sala fiesta brazo música caballero voz palabra gusto traje compañero pareja conversación gracia mirada lado pie grupo sociedad atención flor color danza concurrencia piano asiento pieza reunión dama gente sonrisa manera placer aire lujo belleza orquesta clase paseo honor efecto año mamá tono vista teatro boca labio 
94	0,10022	flor jardín sol cielo amor mañana tarde árbol luz sombra hoja corazón planta alma rosa color alegría rama campo mirada ventana labio tierra perfume lágrima pájaro voz agua tristeza canto sueño bosque luna estrella paseo ala beso aire brisa do cariño recuerdo pecho brazo nido ave fruto pie cabello viento 
95	0,02102	rostro espada ciudad mancebo caballero hidalgo año merced morisco oro ventana soldado honra cuadra estancia instante sol paje muro plata escudero rumor aágora doncella capa modo libro sombra pie moro canónigo patio muralla anciano cofre historia perfume rey galán mulo resplandor dueño linaje gesto daga torre tarde lacayo embargo suelo 
96	0,00979	tienda socio luz establecimiento par marchante mostrador dependiente sastre letrero ciudad notario asiático camisa fondo agua cura plazuela género tranvía taller trabajo papel luna grupo portero zapatero estudiante polvo herrería escalera sombra salón acera tendero colega lengua aire viento pan precio rostro dependientes plaza gas lluvia hierro parroquia interior camisero 
97	0,02216	muchacho clérigo mozo mancebo ciudad canónigo chico señorito fiesta doctor ebanista escuela razón tío doncella mamá huérfano dama misa sol anciano alma primo gusto belleza camino casita lado valle corredor tienda blonda ayuda angelino patio tono ceguezuela hermosura lista asunto abuelo lluvia sitio compañero gloria regidor río maestro asiento par 
98	0,00781	rastro asesino cutter rastreador caballo pie tierra compañero oro indio suelo asesinato caleta costa vereda lobero paraje cuero mar golpe cuchillo punta bota canal ballena cara carga snap inglés rumbo hombres pisada duda seguridad caballos lobo región camino minero pedazo roque_ría asesinos campamento tapia sal cuadra sur cuenta acequia islote 
99	0,0094	mono capitán gorila doctor eslabón especie siglo razón naturaleza ciencia palabra hembra chimpancé espíritu edad tierra ser orang origen tribu ángulo gibón idea cerebro historia memoria pilotín hipótesis recuerdos modo león terreno antropoide salvaje forma inteligencia animal negro raza evolución cráneo guerra cola efecto generación fiera hotentote grado continente médico 
