68	0,12568	gobierno pueblo ministro guerra país revolución presidente partido poder política orden patria jefe autoridad libertad ley ejército nación arma gente fuerza tropa gobernador enemigo independencia plan provincia derecho palabra elemento diputado carta triunfo plaza secretario capital noticia mando papel paz año general estado campaña entusiasmo salón opinión patriota causa comisión 
69	0,28516	año sociedad idea país obra libro espíritu época estudio trabajo ley razón arte siglo tierra inteligencia naturaleza pueblo derecho carácter clase hecho virtud raza ciencia educación forma historia palabra ciudad talento edad libertad escuela fuerza humanidad juventud sentimiento luz principio especie costumbre ser cuadro progreso necesidad título porvenir vicio ejemplo 
70	0,25512	puerta calle ventana patio cabeza luz cuarto escalera lado voz ruido brazo pie pared balcón esquina pieza cama zaguán aire llave sala fondo habitación suelo vista sombrero cuerpo duda ciudad entrada sombra golpe corredor piso reja edificio barrio vuelta grito gente seña palabra derecha agua número rostro rato espalda madera 
71	0,0009	ciudad muchacha muchacho amo vaquero pa camino prima amol corral alas sitio par hermosura amor agua ai mariposa ocasión cara sangre ojos rostro ropa amos muchachos pelo gracia año mula nieta raza color aija ladrones rumbo belleza claridad palabra criatura red margen tamaño charco mar miedo tías acción campo bodega 
72	0,00066	ojos compadre examen sastre revolución años memoria cara miedo héroe cosas mirada regidor año levita época días escuela tordillito sombrero programa muchacha claustro suerte ciencia silencio frac calor lección muchachas cambio manera métodos grado tela sangre resignación víctima espacio número progreso espejo profesor misa pelo talento personaje disimulo urna niñas 
73	0,14097	cuerpo boca rostro sangre carne cerebro amor sol sombra frase brazo alma beso agua muerte espíritu organismo pensamiento bestia sueño pecho pupila fondo instante nervio piel dedo idea fuego seno deseo ala aire juventud ser luz garganta fiebre presa caricia labio sensación tarde movimiento ambiente odio risa párpado pasión pared 
74	0,40611	amor corazón alma felicidad palabra pasión carta amante lágrima sentimiento dolor cariño esperanza placer pensamiento ángel cielo año dicha ser virtud desgracia afecto idea ilusión esposo recuerdo muerte deseo existencia ternura embargo lado pena destino mirada labio deber bien emoción brazo amado pecho alegría pesar razón voluntad flor porvenir secreto 
75	0,00237	guerra armas soldados hombres ejército país españoles pueblo jefes indios camisa tropas pueblos caudillo ojos ejércitos paz fuerzas jefe imperio enemigos elementos plumas año filas valor silencio dioses tierra soldado montoneros provincias años batalla patria oro caudillos aguas noticias compañeros campaña sangre prisioneros sol cortés cuerpos veterano combate pies piedras 
76	0,03289	dinero patrón negocio manera calle trabajo escritorio hotel gente mes café cliente fortuna mozo confianza capital lado dependiente sueldo clientela relación dueño león vino cariño palabra pieza viaje idea ropa género carta sirviente comercio amor clase puesto ciudad casamiento botella diablo suma mañana situación porvenir cuenta compañero fonda crédito modo 
77	0,11046	cura iglesia sacerdote altar misa templo pueblo voz sacristán oración santo religión capilla gente procesión obispo campana fe lugar ciudad imagen fiesta convento alma fraile anciano maestro devoción ceremonia idea pecado puerta sacristía atrio coro parroquia luz cruz sermón culto plata obra nave conciencia libro fiel confesión gracia devoto rosario 
78	0,06717	cuerpo calle vera ocasión brazo sueño fuerza cara vivienda luz amor año muerte instante cariño chico existencia muchacho santo tranvía recuerdo beso estancia memoria caricia cama carne gendarme cambio sitio miedo respuesta par risa dicha individuo pensamiento llanto cigarrillo tarde sol chiquillo rincón rumor minuto labio jardín pena silencio ciudad 
79	0,00133	gaucho soldados capitán sargento hombres payador jefe silencio quebrada godo montonera voz grupo aparcero guitarra guitarrero cielo retaguardia sombrero bastonero mozas parejas rancho piernas monte partida cuero izquierda escucha cantor sable patria fiesta barraca sudor pierna mozo gauchito puesto campos acero presente frente paja ojos hombro flor guerra juego servicio 
80	0,01185	v_d país carta tenia vd teatro h_u negocio gusto manera amante semana criatura libertino calle bailarín sociedad aventura imaginación ciudad posición billete esposo sílfide visita necesidad marido vds personaje entrevista alemán astrólogo licorero gente par relación mañana fuerza mesa situación cuarto cartera carruaje traje educación moda orden número obra copa 
81	0,01468	maestro música artista piano voz corazón excelencia impresión duda poeta anciano italiano sitio ventana monsieur sentimiento arte efecto barquero campo concierto mirada canto rato acento armonía cara discípulo sonrisa poesía mesa instante instrumento aposento hacienda estudio habitación colina paseo época obra año lección emoción mancebo puerta palabra pintor perla herrero 
82	0,00463	filósofo avaro embargo viaje perro tierra año cabra ciudad caballo país ostra provincia fortuna chaleco cerrajero pasajeros huésped naturaleza partida pintor barón distancia agua máquina dolor descubrimiento comida llegada bondad idea artista hacendado años vanidad café arpa escalera mina viajero profesión boda hermana poeta trigo menudo cubierta caída pasajero tipo 
83	0,00091	hermana hermanas lía calle misia tía sala alcoba cabeza manos iglesia ama comedor muchacha chico ojos cara pelo niñas ventanas misa umbral acera patrón lengua cielo patio frac dedos dinero despacho santo espejo corazón cuaderno billete pared voz sofá testamento muerte marido seda dam señorita caballero convento rifa gota ropa 
84	0,01906	mayordomo calle puerta vista fistol sala viudo ama pensamiento poeta dinero recámara desgracia bandido gabinete sacerdote diablo mal oro bien boca mesa balcón tutor hipócrita luz criatura escalera criado vuelta venganza morena manera placer plazuela lado campana llave papel fisonomía pie efecto imaginación multitud crimen suelo vera falta frente cólera 
85	0,02797	doctor juventud ciencia conversación placer compañero agua estudio año alicio viaje sala profesión país ausencia merced causa amo edad maestro mal carácter cielo vino silencio mérito clérigo discípulo compadre acento patria tierra gesto propósito música capital muerte deseo existencia salud color nota idea enemigo destino mirada marido educación mensaje pelo 
86	0,00902	ojos veces flores sol años luz manos árboles días hombres brazos labios agua hojas aire horas lado casas cielo puertas paredes ciudad pasos ventanas palabras calles tarde cosas cabeza patio pies noches sombra nubes partes amor lágrimas tierra tía boca colores voces mesa frente alma color ramas recuerdos cuerpo cabellos 
87	0,06964	tren muchacho voz año fiesta viaje mamá aire ciudad cabeza carruaje estación vuelta mesa palabra grupo embargo criatura impresión expresión rato tono hotel instante brazo mes estancia campo chico cara marco papá existencia calle cambio caballo luz sueño avenida sentimiento carácter gesto teatro lucha hogar silencio máscara trabajo traje manifestación 
88	0,06888	mar buque costa agua puerto tierra bote playa ola marinero capitán viento muelle vista inglés vela barco embarcación marino orilla cubierta isla viaje canal gente lancha nave popa río proa bahía rumbo pirata vapor oro navío aire goleta canoa grupo castillo pasajero año remo fondo lado cabo brisa pescador palo 
89	0,01204	juego jugador carta mesa baraja calle sota caballo oro as albur jugada carruaje rey ciudad suerte partida barrio caballero tallador naipe banca banquero alfiler onza plaza baile clase voz feria lisa mozo tapete anciano monte policía año garito vicio fortuna amor limosna ganancia lado cartas puente tarde estudiante pasión cielo 
