68	0,02224	esclavo dios ciudad pieza instante sitio templo calle do sacerdote edificio gladiador lado tenia vista columna palabra oro estatua puerta amo pintura pórtico pueblo ceniza pared anfiteatro mármol virtud multitud rostro piedra vino tierra agua forma cabeza carro riqueza traje bronce altar entrada romano jardín placer belleza manera pretor número 
69	0,01197	estancia campo rancho peón caballo gaucho capataz patrón mate muchacho cocina vaca peones misia monte suelo tierra paja sol guitarra pieza cielo perros gato palenque techo corral voz pampa perro chino recuerdo lana viento campos año pajonal silencio vuelta boca ovejas barro asiento carne puerta alma pago desierto caña pañuelo 
70	0,11269	dinero fortuna negocio oro juego carta mesa cantidad capital bien jugador suerte cuenta abogado caballero suma caja peso mes papel gasto año precio deuda onza documento trabajo miseria asunto pleito acción crédito título caballo ganancia riqueza firma valor clase heredero número socio recurso pérdida bolsillo baraja partida sociedad objeto herencia 
71	0,11779	baile salón fiesta brazo sala compañero voz música caballero pie grupo pareja palabra traje mesa concurrencia copa danza señorito mirada gracia color amor lado flor reunión aire conversación gusto pieza atención cuerpo honor asiento gente orquesta risa manera convidado lujo marido efecto sonrisa alegría sociedad tono aplauso sitio placer vino 
72	0,01097	maestro examen estudiante año estudio escuela muchacho años libro discípulo esqueleto memoria cráneo puerta compañero madrina papel ciencia profesor villa provincia música mesa bolsa cara lección clase sorpresa cabeza huesos libros curso educación época salón orden pieza suerte doctor agua comida resto costilla grado hueso asiento mañana lecciones latín alumno 
73	0,03125	virrey oidor merced puerta señoría brujo calle inquisidor dama negocio corregidor bachiller escribano negro canónigo ciudad lacayo palacio aposento alcalde fraile secreto orden espada arzobispo mesa alguacil lugar marqués convento gente oro lado clérigo tarde sombrero cabeza año rostro conspiración licenciado sitial conversación noticia luz tormento tumulto justicia especie palabra 
74	0,00061	cara doctor frío calle hermana ojos manos luz abrigo gente sombrero dinero tía plaza cama caballero pelo puerta traje gusto cabeza frac espejo sitio lluvia color cristal chico beso camarín obra tiple sobretodo piano suerte almohada chimenea amigos lengua curiosidad muchacha cuadro manera boca chica cristales dedos punta fuego carne 
75	0,15215	mesa puerta color sala lado cabeza luz traje pared habitación oro brazo silla espejo seda sillón pie patio cristal cuadro pieza comedor mueble centro plata papel piano salón alfombra sofá cuello ventana fondo rostro mármol sombrero escalera alcoba flor reloj suelo bronce negro frente cabello madera lámpara entrada ruido gusto 
76	0,14914	muerte cadáver dolor cuerpo grito sangre brazo lágrima lado voz tierra muerto puerta lecho rostro suelo agua cabeza alma pecho corazón pie tumba fuego herida silencio cementerio esfuerzo llanto agonía instante fuerza desesperación infeliz ruido terror sepulcro esperanza frente golpe luz aire desgraciado llama cuadro habitación escena rodilla horror desgracia 
77	0,01359	indio cacique tribu país oro soldado jefe tierra indios pueblo sol guerra mar expedición veterano playa idioma lugar armas flecha conquista cristiano ojos palabra cabeza aventurero río arcabuz español obra valle capitán atención mestizo caudillo secreto gobernador duda sangre toldo intérprete combate vuelta imperio batalla año arena mirada cruz arma 
78	0,02401	estudiante emperador francés caballero diplomático guerrillero imperio negocio archiduque ministro palabra emperatriz nación aposento trono frente ejército existencia puerta dama monarquía porvenir luz situación honor salón silencio broma intervención cuestión corte novio fondo sombrero política oro edificio toque aliento diplomacia mariscal sueño sacristán tertulia republicano tumba señorito ciudad año austríaco 
79	0,06981	hacienda caballo pueblo compadre camino muchacho rancho amo cura gente dinero palabra cuidado año sombrero brazo cabeza silla mozo instante fuerza mulo corral administrador merced licenciado cara pie ranchero gusto toro rumbo animal cerro muías trabajo lugar indio campo prefecto arriero puerta orden plata lado negocio compañero pierna viaje ropa 
