68	0,04191	maestro música piano voz nota discípulo artista concierto canto anciano lección instrumento arte emoción poeta campo obra año canción papel ventana melodía impresión armonía pieza mirada ópera violín hacienda profesor cielo boca educación sentimiento cuerda asiento sonrisa instante vista afecto acento sonido alemán muchacho teclado naturaleza espacio lucha villa color 
69	0,06825	caballo camino pie jinete animal lado marcha campo árbol distancia galope legua dirección hacienda rienda mozo cabeza vista carrera suelo rastro lugar viajero duda amo pueblo partida orden gente rumbo perro viaje compañero noticia movimiento herida grupo tierra seguridad dueño vereda asesino cabalgadura monte ocasión terreno polvo silla peligro rato 
70	0,07564	médico enfermo enfermedad cama doctor muerte dolor lecho cuerpo estado hospital fiebre salud mal remedio cabeza medicina ciencia cabecera sangre herida cuarto paciente cuidado brazo alma esfuerzo corazón facultativo agua lado lágrima delirio visita pie respiración habitación desgracia curación sala sueño alcoba gravedad pulso calentura operación sufrimiento fe moribundo fuerza 
71	0,04933	ejército corazón insurgente capitán sangre caballero palabra revolución silencio frente muerte pueblo ciudad porvenir existencia soldado voz estudiante campo alma destino francés independencia sombra historia guerrillero patria negocio imperio emperador diplomático batalla rayo rey aposento tumba luz archiduque esposo honor espíritu nación situación multitud libertad aliento orden idea pensamiento héroe 
72	0,04091	unitario cabeza calle ciudad sangre orden rosa tirano salvaje espíritu puerta patria asesino pueblo bandido mirada corazón causa federación palabra servicio libertad sereno embargo río época comandante mazorca policía fisonomía partido puñal país víctima coronel campaña gobernador movimiento manera cama cuchillo revolución mate peligro patio año provincia gobierno tiranía crimen 
73	0,01113	ciudad nido juego amor dinero oro color amol campo puerta palabra sol razón naturaleza sitio pa muchacha finca embargo viuda mar bodega fiesta potro yerno brisa abuelo sociedad torre autor valle honor nieta comarca baile guajiro fortuna casucho veces flores canto silencio mula p_a gallos días lector rival suerte vista 
74	0,02404	posadero posada dinero habitación tenia capital honradez propósito historia manera hacienda desgracia lector talego virtud personaje continuo duda justicia litigio humanidad robo motivo posición cafetal sombrero dueño pleito abogado presencia mesa paternidad mancebo doncella hecho fortuna finca año residencia firma acción gente principio menester asunto suceso curso rostro pagaré cesto 
75	0,07	muchacho criado puerta calle dinero cuarto manera vecino año amo pollo coche ropa pieza lector recámara llave tarde gente cara trabajo ladrón historia criatura desgracia agua amor ama sombrero palabra lugar marido cama silencio portero vela ruido voz asunto alhaja conversación papel cocina pobre escalera merced efecto caballero costumbre luz 
76	0,05002	alma cuerpo corazón sangre lado luz cabeza silencio rato cielo calle tierra amor sol sombra voz dolor hogar cuarto espíritu brazo palabra alegría ciudad pecho médico pasión cama esplendor muerte rostro carne frío marcha cara miedo gloria ímpetu trabajador frente fuego libro grito pedazo aire hambre historia trabajo virtud agua 
77	0,04524	caballo camino muchacho amo instante rancho brazo hacienda pueblo toro silla cuidado dinero muías sombrero palabra gusto merced cara año arriero cerro interés razón lado sitio favor pie corazón plaza negocio fuerza charro empeño rato animal criado suerte lágrima valle jefe gente peso reata confianza cabeza punta vera pierna puerta 
78	0,11777	corazón alma lágrima esposo dolor brazo palabra amor muerte voz rostro cielo desgracia anciano instante puerta labio felicidad cabeza pecho esperanza año frente sentimiento lado fuerza silencio tierra mirada pie sangre acento suerte virtud víctima llanto desgraciado lecho existencia consuelo pensamiento recuerdo pena cariño crimen grito pesar perdón desesperación razón 
79	0,03054	sor convento monje superiora religioso abadesa claustro colegio novicio estudiante ciudad celda esqueleto coro comunidad capellán cráneo criatura voto voz fraile patio voluntad modo rincón lado piedra arzobispo regla bolsa portería hábito falta efecto viento profesión monasterio belleza tornero jardín hueso árbol cerebro perfume salón pie locutorio necesidad refectorio huesos 
80	0,09282	color cabeza traje puerta brazo salón oro sala mesa pie seda lado luz espejo rostro señorito cabello silla cristal flor sombrero cuello pared gusto plata cuadro cuerpo sillón caballero mirada forma habitación año alfombra patio pieza sonrisa centro mueble sofá gabinete lujo labio mármol boca aire piano gracia frente terciopelo 
81	0,03814	paisano gaucho caballo partida gente pulpería soldado daga alcalde manera puerta guitarra cabeza sargento rancho trabuco muerte corazón baile sable partido mazorca puñalada compadre prenda pico lado plata quinta justicia cintura teniente espíritu golpe mirada toldo ginebra bandido cuerpo vuelta policía voz cara expresión campaña pueblo par arma patrulla boca 
82	0,15113	palabra asunto razón modo idea motivo manera efecto ocasión conversación situación deseo amor noticia atención embargo duda camino circunstancia objeto lugar interés visita relación falta confianza causa carácter presencia lado intención caballero suerte conducta hecho corazón propósito muchacho desgracia voluntad plan fuerza secreto negocio principio orden ánimo tono condición costumbre 
83	0,03766	estancia campo rancho caballo peón mate capataz perro tierra patrón vaca fogón animal gaucho cuero paja aire viento agua sombra pampa arroyo suelo chino pie grito desierto cama sol carne potro montón ruido pieza pata oveja cuchillo vuelta lana cocina techo monte muchacho pasto cola correa cuarto pluma pedazo fuerza 
84	0,04487	fraile fray merced brujo convento inquisidor clérigo puerta celda hereje franciscano obispo año ciudad mesa mulato estudiante religión fe oro causa lego tormento aposento taberna orden secreto herejía papel paternidad hábito agua confesor negro alguacil guardián demonio embargo mirada mulo auto gitano bachiller religioso negocio hoguera diablo reverencia carta portugués 
85	0,02426	condesa conde primo marido baile caballero palabra corte barón baronesa alma mirada dama conversación condestable rey frente duda modo orgullo dueño corazón sillón voz prima vista talento infante palacio instante doncella juego partida juventud sala gabinete sobrino especie sentimiento placer viaje cielo alteza tanto terciopelo acento inquietud almirante galería tez 
86	0,04075	negro esclavo amo ingenio mulato finca mayoral campo ama blanco caña azúcar castigo esclavitud calesero raza trabajo cafetal menudo lector perro odio látigo color sangre negros corredor machete alma cuero criollo vivienda siervo ocasión batey matrimonio año trapiche cepo derecho café servicio esclavos enfermería falta compañero causa caballo bohío dinero 
87	0,03434	muchacho señorito mamá chico alma mozo ciudad fiesta clérigo primo mancebo anciano razón libro escuela huérfano cielo gusto ebanista tío casita sol rostro asunto doncella corredor viento misa periódico tono amor abuelo carácter prima dama canónigo tarde hacienda doctor lado alegría lluvia papá belleza sitio valle novela tienda criatura ayuda 
88	0,04843	rostro silencio cólera carne copa honor sierra palabra carabina teniente licenciado escándalo esposo tequila barba coñac coronel salón subteniente duelo cerveza sol champaña doctor sotol tomo_ch morenciano fonda vaso voz pie gesto trago orgía alcohol ambiente hambre espada sombrero miedo cráneo pensamiento frase ráfaga alfombra abanico orden anciano cristal brindis 
89	0,01548	jefe vd candidato compañero sociedad ciudad silencio ron juramento café tono voluntad fistol farol neófito oro voz manos puesto individuo asociación hoja presencia idea papel luz inglés carrera aspecto morada traje hermanos forma personaje oficio espíritu qu historia alegría diablo mesa frase sombrero et teatro conversación cartera dueño sala asociados 
90	0,01806	ojos cabeza manos voz luz años labios puerta hija sol brazos veces cielo rostro flores aire niña color lado hombres días palabras corazón alma mujeres frente amor pies boca mirada horas pecho cuerpo tierra pasos silencio miradas rayos fondo lágrimas calles muchacha pie cabellos jóvenes ruido puertas sombra noches suelo 
91	0,03352	marqués título bien nobleza pleito testamento herencia riqueza heredero raza dote conde virtud abogado voluntad criado acto fortuna escribano hacienda honra señorito orgullo estado efecto muerte preocupación bondad razón clase recámara cariño educación dinero grandeza favor sangre objeto satisfacción leche dificultad cuerpo caballero encargo dama convento castillo posesión santo caridad 
92	0,0359	amor alegría placer juventud aire obrero ciudad fiesta gracia flor mamá sangre marco boca criatura voz risa terraza muchacho prima mecha lluvia papá sueño alma instante avenida lago parque vuelo lucha sol espíritu sensación mariposa multitud hall salud oro padrino paisaje mal agua música muerte taller ala hermosura trabajo deseo 
93	0,04208	misia calle puerta chico papá cabeza doctor tío marido cara mesa despacho muchacho comedor voz mamá acera idea madama escalera visita patio señorito tienda esquina sala luz alcoba club ocasión estancia ordenistas zaguán duda tarde gracia brazo patrón pregunta sofá frase sombrero sillón pie ventana palabra espejo silencio coche camino 
94	0,0471	cura pueblo bandido hacienda muchacho población lugar autoridad vecino herrero prefecto dinero plateado curato compañero alcalde gente tierra ladrón tarde huerta gobierno plata rumbo camino fuerza miedo fiesta robo terror partida manera río párroco misa trabajo indio tío aspecto iglesia especie comandante carta comarca compañía payaso patrón oro época bandolero 
95	0,01381	rostro alma anciano doncella palabras esposo pueblo habitación lágrimas molino mirada instante vd esposa cabello casita frente aire dulzura do estatura imaginación fortuna afecto desprecio trabajo hermana dicha alegría crimen terror carácter flores amiga sentimientos modo presencia muerte entrada edad huerta cariño golpe mal estado campo seres bienestar multitud corral 
96	0,02188	mar costa cutter playa oro cara indio vista fondo ola lobo canal caleta cuero compañero tahona tierra parapeto puerto especie lado arrabal peñasco lobero agua marinero camino inglés ballena granito espuma patrón snap panadero pesca despacho arena litoral región calzada sol demonio pipa entrada rúa modo punta boca roque_ría resaca 
97	0,03755	juego jugador carta oro mesa baraja fortuna dinero caballo sota suerte onza rey albur partida carruaje as bolsillo jugada cantidad mozo capital naipe caballero vicio banca garito ganancia baile apuesta lado papá clase banquero tallador copa anciano sala coche alfiler esposo silencio negro feria reloj tapete palabra número carpeta lugar 
98	0,01578	barón viuda castillo doctor licenciado abogado ganadero instante velada país origen banquero voz vajilla embargo dama fuerza paje misa secretario gesto administración posesión oro gente villa menudo tono pueblo personaje muerte hermana señoría doncella capital presencia mozo sala luto lugar empleo pieza hogar movimiento luz cabeza danza tema derecho viudo 
99	0,08807	carta corazón amor papel año palabra criado mes lágrima noticia letra cuarto dolor mamá viaje cariño pensamiento retrato señorito mañana mesa recuerdo alma papá felicidad idea esperanza deseo calle lectura libro gracia beso pie memoria modo visita amante ama tío objeto embargo frase correo escritorio billete amistad pasión tarde duda 
