68	0,12127	flor amor sol jardín cielo rosa color hoja oro luz árbol alma agua planta alegría brazo mañana cabello ala labio tarde pájaro sombra rama beso pecho aire placer seda perfume gracia tierra cuello naturaleza primavera espíritu nido fruto aroma mariposa canto boca belleza deseo nube campo ave encanto mejilla música 
69	0,00901	posadero posada dinero año trabajo años amigos secretario oficina miseria abogado capital tenia habitación clase vecindad vista talego honradez humanidad talento mesa falta finca lodo cafetal meses escribiente juzgado pleito edad jóvenes luto sociedad agente ministerio cuarto efecto posición coche educación sueldo comida estudio dueño litigio subsistencia mar manera empleado 
70	0,01227	tienda pueblo iglesia sierra portal sol carabina puerta subteniente barrio fondo tahona parapeto voz arrabal teniente sotol tomo_ch distrito rostro tequila fonda plaza mostrador panadero calzada corro hambre polvo carne despacho espalda rúa harina extremo cara horno mar pensamiento calle valle admiración camino gente trago agua honor cólera aspecto rajo 
71	0,10829	dinero negocio fortuna trabajo mes capital calle manera gasto precio cuenta suma oro miseria comercio peso escritorio asunto situación relación crédito socio año gente modo cantidad dueño idea sueldo bolsillo interés patrón género lado pieza tienda sociedad palabra dependiente servicio necesidad posición recurso confianza clase ropa viaje comerciante suerte cliente 
72	0,05371	abogado bien título pleito herencia dinero heredero riqueza testamento oro caballero fortuna documento nobleza voluntad efecto dote justicia muerte cantidad acto esposo raza escribano matrimonio pliego orgullo criado secreto favor objeto razón estado trabajo orden dificultad época posesión propiedad escritura castillo caudal ley negocio conciencia honra bondad manera gente encargo 
73	0,09183	preso cárcel crimen prisión justicia juez muerte reo calabozo causa orden bandido delito sentencia declaración libertad asesino pena víctima ley palabra carcelero alcaide autoridad defensa cabeza verdugo manera asesinato soldado criminal prueba cómplice conciencia hecho ejecución castigo ladrón proceso amante acto testigo tormento defensor objeto guardia tribunal sangre derecho centinela 
74	0,01109	ciudad morisco mancebo sol hidalgo plaza rostro torre espada cuadra caballero iglesia aágora suelo gesto historia soldado estancia pie mozo escudero abuelo paz honra duda miedo ventana fiesta plata merced paje año sitio brujo patio muralla libro muro modo oro catedral talismán amol brasero diablo canónigo piso orgullo imagen linaje 
75	0,03953	caballo gaucho paisano partida gente rancho pulpería indio guitarra daga soldado campo alcalde sargento manera muerte peón lado voz cabeza puerta trabuco camino estancia golpe galope mate partido jinete baile rienda sable pueblo compadre puñalada animal pago prenda teniente arma alegría pampa quinta justicia cintura vista pico campaña mozo plata 
76	0,01694	muchacho señorito canónigo clérigo ciudad mancebo ebanista fiesta doctor tío mamá anciano razón casita mozo sol lisa doncella chico escuela misa dama tarde blonda prima gusto luz ceguezuela hacienda lluvia fastidio corredor periódico angelino cena comedor belleza capitalista taller cielo ayuda noticia patio abuelo dinero compañero ordinario hermosura música valle 
77	0,06148	calle sangre alma ciudad carne pueblo cuerpo obrero trabajo hambre hogar odio pan raza miseria marcha trabajador gloria fuerza dolor ropa religión rato muchedumbre tierra piso pedazo sombra olor revolución forma pared año vientre orgía nación sol enfermo dinero silencio siglo honor entraña cielo grito delito lodo gente paz pupila 
78	0,0158	mono especie palabra razón sabio ciencia gorila animal capitán región lobo cutter modo cuestión lucha objeto idioma teoría sesión mar idea sur cráneo individuo gloria voz carácter expresión viaje pueblo indio siglo colección forma embargo chimpancé viajero río agua tribu ballena orang hembra lector género lobero naturalista nota duda berlinés 
79	0,00383	niña cabeza ojos seda casas color cuerpo rostro sombrero sol balcón brazos oro mañana boca cuello manera vista calle flores mujeres luz hombros manos edad alas plata criatura par bahía traje sala puerta mulata años nariz través sueño labios duda cocina ruido lado cielo muchacha teatro hojas espejo aire sitio 
