0	0,04005	esclavo negro amo mulato ingenio finca mayoral posadero campo caña ama calesero color azúcar castigo merced blanco posada trabajo año látigo cabeza falta muchacho menudo cuarto motivo esclavitud cafetal pie gente raza perro principio trapiche cuero sangre ocasión dinero modo señorito país quitrín embargo cepo p_a vivienda enfermería matrimonio pesar 
1	0,04666	estudiante ejército corazón caballero sangre pueblo ciudad insurgente revolución silencio existencia porvenir muerte palabra destino frente francés capitán campo historia independencia sombra luz guerrillero negocio voz aposento diplomático emperador multitud rayo nación alma situación batalla archiduque tumba imperio espíritu rey esposo aliento patria bandera soldado roca año golpe cielo diablo 
2	0,01116	amo negro esclavo época lector raza blanco esclavos corredor negros dinero odio cura oficio calle esclavitud mulata ingenio alma ciudad ley limosna historia barrio carácter mayoral tipo africano menudo muerte cara mercado campo yerno mirada tabaco finca modo recuerdo gente naturaleza ocasión castigo voluntad isla justicia fecha puerta hambre loco 
3	0,02414	pollo mamá compadre baile marido manera coronel amor león papá calle curial razón sombrero mirada novio chocolate gente muchacho sastre niñas polla revolución idea visita criatura sazón licenciado lector cara alma negocio comadre grado pie tierra zócalo cosas agua chucho línea silencio jardín general dependiente personaje destino movimiento color curva 
4	0,00412	campanas barón ganadero mirada amigos lluvia comedor mesa libros chimenea campana viento ciudad libro casita muchachas ojos personas sol nervios nido hacienda reloj tía cosas embargo abuelo escuela oídos techo sereno aposento velada afecto gato tienda enfermedad ilusión política fiesta regidor niñas silencio ruido hermana leña peso beso fastidio cena 
5	0,09706	muchacho dinero criado puerta año mesa calle cuarto agua ropa cocina vecino comida amo gente trabajo vino vaso botella pieza voz plato hambre camisa manera cara pan llave lugar vela oro papel sombrero tienda ladrón cama tarde mes coche alhaja peso silla pobre merced cocinero recámara portero patio ama plata 
6	0,03818	periódico artículo calle periodista mesa diputado cuarto escritor redacción estudiante párrafo director diario cara pluma papel compañero talento personaje prensa ministro asunto número puesto cabeza agua palabra imaginación jefe lectura miedo alma frase puerta elogio atención redactor cama portero sombrero imprenta carta idea sueldo libro rato muchacho copa ciudad tomo 
7	0,01016	doctor ciudad placer canónigo juventud clérigo música agua ojos aire compañero alegría conversación sangre flor hotel sol patio dama cielo merced vino calor catedral flores criado escalera viajeros corredor mal multitud lucha frase voz compadre tren brazo tierra instante puerta salud cerveza sombra adolescencia viaje frescura desfile ademán curiosidad paz 
8	0,07384	doctor médico enfermo enfermedad cama fiebre cuerpo hospital lecho ciencia estado mal salud muerte cabeza dolor medicina paciente remedio facultativo sueño voz curación alma espíritu alcoba brazo visita cabecera delirio pulso dolencia sala vuelta peligro botica esfuerzo calentura cuarto causa juventud aire servicio respiración labio mañana color boca almohada síntoma 
9	0,05654	fuego plaza soldado enemigo cañón bala campo francés ataque tierra batería ciudad fuerza defensa sitio fusil grupo tiro combate arma línea artillería pieza parapeto pólvora fortaleza asalto herido sangre zuavo bandera columna pueblo baluarte cerro altura trinchera grito descarga cuerpo muro defensor cadáver jefe escombro batallón monte multitud orden brecha 
10	0,04033	condesa corazón carta palabra año esposo prima felicidad placer primo modo amor tío coronel marido amistad pasión partida cariño idea mes vuelta criatura amante carácter ángel billete dolor retrato cuarto alma rato bondad mirada duda afecto viaje amado conversación belleza fortuna objeto capitán caballero recuerdo barón cama muerte anciano compañero 
11	0,04517	tío sobrino primo carta lado cuarto modo destino cama libro embargo rostro muchacho habitación calle tía prima baúl escalera rato fortuna mesa informe gesto orden recomendación cuello café muelle camisa comedor culpa oro cabeza hospital tarde abrazo miseria carne plan derecho dinero gravedad sillón banco aspecto sombrero ropa cura letra 
12	0,08999	gobierno pueblo ministro país revolución guerra partido poder presidente política patria libertad autoridad orden ley nación gobernador palabra jefe provincia gente ejército arma fuerza plan derecho independencia capital diputado plaza acto tropa elemento campaña año noticia enemigo opinión paz situación mando triunfo mes manera ciudadano papel general estado cuestión medida 
13	0,00542	fisonomía jóvenes amigos cara mirada años calle vista copa piano gusto multitud amor compañero sitio razón abrigo lado mujeres juventud manos clase instante sombrero color gabinete compañera sociedad labios miseria rato habitación frente piso café salón sonrisa cabeza vd acento salida mozo estatura efecto guantes estudio vaso ponche nariz templo 
14	0,07513	corazón alma instante amor sentimiento palabra felicidad vista anciano placer sitio objeto virtud idea afecto pecho esperanza ser desgracia cariño alegría rostro lágrima flor mirada pena semblante pensamiento lado fortuna bien acento interés gratitud tristeza dicha duda deseo gracia labio ángel satisfacción dolor fisonomía temor atención miseria deber gusto cielo 
15	0,02477	sor convento monje superiora religioso abadesa claustro novicio colegio fray voz ciudad celda capellán coro voto hábito comunidad criatura jardín papá hacienda regla dormitorio arzobispo orden patio velo lugar portería año monasterio voluntad tornero asilado locutorio nana paz muro asilo necesidad reja agua capilla campana alumno objeto tumulto dinero portero 
16	0,0147	años ojos veces hija palabras días hombres amigos año manos personas cosas corazón padres niña hijos mujeres esposa carácter edad ciudad país meses idea trabajo horas vista amor jóvenes manera ideas embargo boca voz labios sentimientos aire brazos negocios cabeza momentos razón tierra lugar historia costumbre señorita época inteligencia lágrimas 
17	0,14314	año sociedad país obra libro ley idea pueblo tierra trabajo estudio historia derecho razón época virtud siglo clase libertad humanidad arte escuela inteligencia ciencia edad naturaleza maestro raza ciudad alma educación espíritu principio necesidad juventud costumbre vicio carácter talento patria cuadro hecho ejemplo campo acción honor sentimiento conciencia progreso forma 
18	0,03543	alcalde dama barón rey alguacil fraile amor marqués puerta palacio lugar muerte corte habitación calle razón espada palabra rostro alma cámara do orden instante ciudad reina maese escudero cielo criado taberna anciano modo virrey crimen caballero justicia mal extremo efecto venganza poder pie labio fe peligro linterna personaje vano obra 
19	0,0044	hermana ojos rostro caballero cabeza niña edad sol cabello merced color luz balcón seda nariz hombros expresión cuerpo hijas muchacha anciana modo sazón mujeres manera cielo ciudad alma ama calles frente molino cuello brazos bahía casas embargo duda atención hija mulata labios belleza mañana jóvenes mejillas espejo manos aire traje 
20	0,04017	secretario gobernador oficina escribiente despacho abogado papel jefe expediente pueblo mesa empleo año examen título pleito maestro pluma voz muchacho palabra distrito madrina plaza ocasión letra ministro escuela cargo trabajo empleado carta agua diputado comisión puesto legajo magistrado ministerio orden importancia discurso oficio discípulo gesto sillón dómine tribunal salón influencia 
21	0,03154	país teatro vd libertino personaje semana gusto alemán billete calle aventura tenia carruaje posición fortuna sílfide ciudad número moda par periódico héroe necesidad carta traje cartera orden criatura situación corazón atención copa educación imaginación rostro invierno dirección lector invitación honor alicio beldad policía especie sociedad já diversión vestido negocio tienda 
22	0,01692	deán conde prepósito jesuíta caballero socio provincia comisario gobernador obispo maestre judío embargo dominico cabildo orden colegial capitán presencia suceso esposo palacio asunto efecto objeto negocio especie ánimo colegio silencio puerta sitio bien mesa prelado regidor motivo finca carta usarced confesor pieza pie visita rey escena interlocutor lego conciencia espíritu 
23	0,04694	alma cuerpo cabeza corazón sangre lado rato silencio tierra médico luz cielo sombra calle dolor cama cuarto amor hogar voz sol espíritu brazo palabra alegría esplendor muerte pecho cara miedo rostro grito comedor obrero marcha pasión aire flor frente año trabajador mejilla frío patio ímpetu trabajo enfermo hambre violencia carne 
24	0,04189	mayordomo vista calle puerta sala viudo crimen ama recámara desgracia gabinete pensamiento corazón dinero enfermo bien boca bandido criado estado criatura frente objeto voz efecto papel oro poeta luz diablo mal modo imaginación escalera hipócrita carta humanidad circunstancia cuerpo sofá mesa rostro llave pie sociedad placer cama alma morena esquina 
25	0,03849	duelo padrino dinero pistola filósofo lance embargo avaro perro honor fortuna caballero desafío motivo adversario chaleco efecto levita historia barón valor cabeza criado arma cabra cara boda relación palo do autor mes papel comerciante dolor corazón cajero ostra puerta artista especie pintor casualidad concepto posada duro puesto hecho suerte sitio 
26	0,00379	doctor tía procurador guitarra do viuda rostro chucho planta plata playa secretario limosna viejita salón oro moneda muchacho portero manos tono niños mujeres virgen señores caballero extremo sangre criada coñac alamedero champaña aire pasión pana días felicidad vidrio carne covacha cosas vela acceso monedas noches españoles amor silencio hombres belleza 
27	0,03415	doncella rostro anciano mirada mulato embargo aire expresión afecto cielo alma voz objeto país tierra seno existencia fuego sonrisa instante extranjero sol monsieur esposo madrastra frente mancebo tarde acento clase presencia silencio orgullo ventana esperanza efecto artista memoria suerte edad corazón improviso año nacimiento colina fisonomía aposento aspecto luna infancia 
28	0,01694	idea pasión alma espíritu ser forma fuerza pensamiento cerebro amor belleza sentimiento mina trabajo frase celo mirada conciencia estudio voluntad deseo existencia inteligencia causa sensación naturaleza creación brillo atmósfera razón movimiento inspiración color piedra modo luz hermosura palabra recuerdo pupila sueño arte lucha ciencia sangre corazón estado mañana ideas vigor 
29	0,0312	misia doctor tienda pueblo club partido mostrador ministro política muchacho plaza calle candidato puerta ordenistas provincia juez voz capital despacho iglesia elección diputado cabeza esquina gobierno papá triunfo candidatura diario marido tendero italiano aldea mistress lucha ordenista salón paz ley chico prueba sobrino mate gallego gesto torre ñ_a escuela atrio 
30	0,02245	capitán ciudad caballero agua buque duda orden vista té aire marcha sombrero viento relación fragata muelle sociedad tanto nave copa historia mozo navío asunto talento fortuna pie época grano revolución atención valiente castillo marino recuerdo clérigo rey café misión convento pasajeros amor buques libertad carrera bandera iglesia número manera ocasión 
31	0,17356	voz palabra brazo cabeza mirada rostro puerta sangre grito muerte instante silencio pie fuerza cuerpo labio pecho dolor corazón golpe venganza movimiento lado frente acento terror arma luz víctima cólera crimen esfuerzo escena alma boca suelo miedo cadáver espanto lucha rodilla lágrima odio desesperación semblante duda oído vista ruido expresión 
32	0,08198	prisión preso cárcel crimen justicia muerte causa reo juez calabozo orden sentencia delito libertad declaración carcelero pena alcaide palabra ley defensa asesino víctima manera verdugo cabeza conciencia criminal defensor hecho soldado acto asesinato proceso cómplice prueba ejecución guardia amante castigo objeto testigo tormento abogado autoridad centinela acusación tribunal gobierno voz 
33	0,07428	coche carruaje cochero viaje calle ciudad camino puerta pasajero tren diligencia caballo viajero hotel portezuela inglés carta voz criado palabra paseo cuarto plaza brazo marcha asiento sueño luz pañuelo lado estación vehículo aire muchacho teatro caballero equipaje gente capital lluvia vuelta maleta lacayo pescante saludo sombrero escalera extranjero mesa cabeza 
34	0,08627	iglesia cura sacerdote misa altar fraile templo convento voz pueblo religión sacristán santo gente alma oración obispo puerta campana capilla camino procesión imagen ciudad hereje pecado clérigo fe calle ceremonia confesión sacristía cruz tierra devoción agua gracia mesa anciano libro multitud plaza celda fray fiesta coro lugar lado cielo sermón 
35	0,23613	palabra asunto razón efecto manera idea modo motivo carta duda amor noticia embargo situación ocasión desgracia deseo circunstancia atención causa interés objeto lugar conversación corazón visita secreto papel relación caballero camino confianza orden voluntad esperanza carácter conducta prueba lado plan fuerza intención principio falta costumbre favor historia criado resolución presencia 
36	0,03888	indio español palacio tierra capitán conquistador oro gobernador corte gente rey tesorero reino espada conquista ciudad lugar princesa tesoro caballero brazo riqueza cortés expedición voz orden soldado lado merced dama noticia marina raza arma testigo manera hidalgo emperador comitiva plata poder empresa castellano rodilla autoridad habitación cabeza cacique número mesa 
37	0,03261	esclavo dios ciudad templo sacerdote pieza do calle sitio edificio estatua gladiador oro columna lado instante tenia pared pórtico pintura pueblo ceniza amo mármol anfiteatro multitud puerta piedra vista palabra tierra bronce altar forma agua vino carro fondo riqueza traje romano año cristiano pavimento inscripción primo jardín entrada costumbre número 
38	0,11765	flor árbol sol bosque cielo campo jardín ciudad tierra hoja sombra rama color río agua montaña camino pueblo naturaleza luz tarde sitio aire ave planta canto mañana nube viento valle paisaje brisa mirada orilla fondo rayo alegría luna nido voz horizonte pie tronco vista rosa fruto piedra soledad aldea silencio 
39	0,00922	madama calle misia lía comedor chico lisa aldea patio pared tarde ciudad aire cabeza mesa abuela hermana muchacho marido ropa patrón tía luz idea trabajo barrio taller acera cara aserradero muchacha corbata obrador plancha alcoba dedos manos pam persiana catedrático casita carta vecino habitación menudo mes abuelo prima traje frac 
40	0,03237	cabeza unitario calle sangre asesino tirano ciudad puerta orden rosa salvaje espíritu patria puñal bandido revolución pueblo mirada mazorca servicio federación cuchillo policía fisonomía doctor coronel sereno libertad negro río época corazón comandante golpe plaza víctima año crimen grupo cuerpo embargo vino sótano gobernador patio palabra dictador capa divisa tiranía 
41	0,02548	espíritu alma luz imagen materia planeta cuerpo gato fuerza manera genio fenómeno médico espacio tierra mar naturaleza resplandor elemento habitante sueño razón centro torbellino acción aureola forma maestro espíritus carácter ser hemisferio sentidos átomo misterio superficie rayo ciencia disco palabra éter embargo ciudad resto vd emanación peso región sabio distancia 
42	0,0327	español sacerdote dios instante guerrero cabeza país pueblo anciano indio palabra cacique mirada extranjero patria ciudad choza algodón templo piedra soldado lugar sangre muchedumbre año batalla sacrificio corazón tierra embajador guerra campamento sonrisa caudillo número pecho flecha piel objeto jefe multitud labio arma madera lector valor altar semblante religión oro 
43	0,03145	juez policía comisario agente barón asesino sangre cadáver crimen aldeano herida instrucción embargo cabeza bosque pie médico magistrado compañero cuerpo manera rostro prueba declaración juzgado matador víctima pieza inocencia bolsillo mancha ley rodilla escribano asesinato lado dirección justicia carta puerta tierra papel huella expresión lugar voz portero ropa calle preso 
44	0,01886	indio sargento cacique guerra tribu pueblo valle país tierra cordillera gruta paz gobernador fuego bosque costa flecha suelo desierto sur falda forma río jefe norte territorio marido indios plan propósito mar toldo población soldado piedra cristiano pierna esposo colina agua cara calchaquí mestizo entrada lord boca instante salvaje región arcabuz 
45	0,03676	jefe bandido policía ladrón excelencia compañero bandolero silencio sociedad carta robo camarada ciudad coronel crimen voz cuadrilla agente justicia oro palacio puerta tono puñal aspecto candidato salteador caverna orden duda juramento modo café vista efecto dato alegría sitio ron gendarme diablo italiano acto tierra comandante dinero entrada historia venganza paraje 
46	0,02472	gallo guajiro machete pueblo café pelea finca río potrero juego palma cafetal fruto criollo canto valla amor color bohío sol pie plátano bosque mañana agua perro especie pañuelo tierra colgadizo yagua tabaco campo partido azúcar campana monte maíz árbol negro corazón yerba angelino plata gallina sombrero oro hoja guano trabajo 
47	0,03583	conde marqués general duque título condesa castillo gabinete marquesa nobleza señorito rey carta lector salón palacio jorobado dama corte puerta caballero honor orgullo pie dote honra coqueta esposo poeta guerra dignidad heredero pleito gloria idea favor virtud cariño mirada criado fortuna baronesa objeto raza portero personaje já posesión carretela calma 
48	0,04907	manera ejército soldado jefe enemigo fuerza tropa prisionero coronel marcha orden arma provincia combate batalla acto campamento muerte caudillo lado gobierno elemento guerra ciudad gente montonero campaña noticia fraile cuerpo palabra golpe infantería situación herida caballo persecución grupo peligro modo caballería género poder estado seguridad cariño pueblo puesto resultado población 
49	0,10225	caballo camino animal cabeza perro jinete pie lado árbol tierra lugar distancia marcha agua campo vista gente dirección ruido brazo voz carrera suelo amo legua compañero galope rienda viajero movimiento efecto terreno vuelta pueblo monte año fuerza orilla muchacho aire mañana arroyo luz orden río mulo fuego grito peligro sombrero 
50	0,00552	rancho gaucho campo voz payador tierra perros guitarra paja capataz techo suelo boca cocina aparcero pago mocetón pajonal puerta guitarrero pluma asiento mozo recuerdo gente monte canto vaca desierto pieza bastonero cantor río cielo mozas palenque aire alma humo cuerpo sol barraca barro juego chiripá color parejas mensajero vista leña 
51	0,03335	sabio palabra tren especie ciencia viaje razón lucha idioma cuestión teoría gloria sesión objeto individuo pregunta idea colección pueblo autor lobo ciudad modo animal manuscrito voz lector memoria atención partido expresión sur berlinés museo guerra embargo naturalista darwinista recuerdos relación mono malicia alemán caja vuelta siglo miembros fenómeno espíritu rabianistas 
52	0,11072	muerte dolor lágrima corazón cadáver enfermo alma lecho anciano desgracia esperanza consuelo cuerpo médico tierra enfermedad brazo cielo infeliz tumba llanto muerto lado criatura silencio sepulcro año pena recuerdo existencia instante noticia sacerdote carta estado miseria sufrimiento pobre sangre agonía hospital esposo habitación cementerio frente desgraciado suerte grito mal auxilio 
53	0,0263	estancia caballo campo rastro peón patrón capataz gaucho pie rancho mate suelo camino muchacho misia mesa viaje negro establecimiento chino campaña silencio cocina rastreador asesino corral pañuelo bota comedor vista vereda paisano viento ciudad oveja palabra cortito rumbo mirada galpón tranquera lado vaca dirección distancia cuadra conversación peones monte cuenta 
54	0,00407	niña condesa hermanas damas bobo matrimonio dama carrera pan título iglesia santo entrada cielo caballeros cartas trabajo marido jóvenes paseo educación memoria placer chico nobleza sala guerra grado mérito siglo colonia caída concurrencia salón secreto pregunta amistad lujo objeto calle cárcel piano cuna dedos señorita testamento tarde mulata padres bastón 
55	0,15539	boca cabeza cara muchacho pie chico diablo perro pierna dedo nariz mozo carne aire vuelta lengua gente calle pelo sol diente oreja cuerpo agua duda papel punta color gato falta barba sombrero risa cuenta vergüenza año pata gesto cuento gana estómago pan par hombro piedra rato idea plato santo camisa 
56	0,1096	agua luz sol nube cielo sombra viento fuego lluvia aire rumor voz cuerpo alma silencio fondo pie llama horizonte ala boca relámpago mar ruido piedra pecho humo sueño grito claridad rayo montaña tiniebla abismo trueno golpe suelo brazo sangre muerte labio carne pared piel color eco espacio movimiento oscuridad seno 
57	0,00662	sociedad espíritu alma puente fuerza vuelta mamá teatro pueblo lado honradez amor lujo formas carrera siglo suma época criatura patriotismo público puerta máscara hombres género miseria presencia escena especie marido carruaje fanatismo cuestión medalla educación labor placer aire elementos camino tarde fraile desorden diablo infancia tierra fondo calor río fortuna 
58	0,03837	caballo camino instante brazo muchacho toro muías amo cuidado rancho corazón palabra maestro dinero gusto cerro coronel hacienda arriero pie silla sitio lágrima sombrero lado valle cura fuerza pueblo cara plaza rato empeño charro suerte interés merced estado negocio punta peso favor villa criado reata presencia caballero confianza animal desgracia 
59	0,12044	mesa puerta color sala cabeza luz lado pie espejo oro sillón flor cristal seda traje silla habitación cuadro pared mueble frente papel patio sofá salón brazo piano alfombra reloj cabello pieza rostro comedor cuello ventana mirada mármol libro plata retrato labio cara beso bronce sombrero centro criado gusto gabinete lámpara 
60	0,02142	juego jugador carta mesa oro baraja sota fortuna albur as caballo jugada rey onza partida naipe caballero pico ventana suerte dinero tallador garito banquero alfiler tapete capital espada pueblo mozo cantidad lugar clase personaje vicio copa carpeta ganancia lado banca salón apuesta negro basto ciudad compañía reloj manera feria dama 
61	0,15516	amor corazón alma palabra pasión mirada lágrima felicidad cielo dolor pensamiento amante voz labio ángel sentimiento esperanza pecho cabeza brazo año frente sueño placer luz recuerdo carta flor sonrisa ser ilusión rostro existencia pie dicha sombra cariño ternura idea embargo emoción silencio tierra imaginación deseo espíritu beso instante destino fuego 
62	0,05024	hacienda cura pueblo compadre bandido licenciado administrador rancho caballo gente dinero mozo alcalde prefecto autoridad muchacho plata ladrón vecino población plateado indio ranchero herrero gobierno juez p_o presidente manera amo pie compañero p_a año cuidado fuerza negocio sombrero mulo pistola palabra campo robo rumbo patrón motivo terreno corral especie monte 
63	0,0106	ojos flores manos labios cabeza luz voz brazos veces alma años cielo aire niña sol lado puerta palabras árboles hombres corazón días lágrimas hija horas rayos hojas mirada pies rostro frente silencio sombra pecho ruido tierra amor pasos miradas sombras nubes boca mente cabellos suelo naturaleza fondo luna cuerpo patio 
64	0,02	v_d doctor esposo amante manera h_u sociedad negocio criado cuarto país asunto carta tenia cuaderno embargo talento baile objeto mesa do obra astrólogo criatura gente historia entrevista plan relación pistola gracia charlatán razón motivo enfermedad tarjeta visita mamá puerta agente lugar debilidad necesidad artista calma primo barba sacrificio bailarín habitación 
65	0,0498	príncipe emperador princesa rey palacio dios monarca imperio enemigo ejército ciudad extranjero pueblo trono español guerrero esposo palabra soberano gloria guerra sangre voz habitación plaza embargo aliado república capitán vasallo arma instante templo caudillo corona azteca noble tierra poder mejicano valor nación patria emperatriz lago tropa capital dominio jefe orden 
66	0,00499	examen memoria estudio año ciencia estudiante años resto color misa mesa catedrático ojos orden sombrero tranvía silencio claustro atrio doctor lado compañero capital aire calle aula vajilla comida época dueño cara prueba entrada clase pieza cabeza monitor filosofía sombra alumnos condiscípulos estudios manos cuadros licenciado piel profesor niñas mármol cambio 
67	0,01656	canoa canal mar indio costa oro cutter remero tierra cuero compañero agua región mesa playa ola lobo caleta inglés año carga gente punta lobero viaje capitán puerto ballena remo lado snap minero campamento fortuna muelle botella cara mes entrada muchacho embarcación barco capital plata roque_ría tiburón sal socio camino boca 
