0	0,00826	deán conde prepósito jesuíta caballero provincia socio comisario judío gobernador maestre embargo obispo dominico cabildo orden colegial presencia asunto palacio capitán negocio especie suceso esposo carta regidor efecto mesa ánimo objeto colegio bien confesor lego escena conducta sitio usarced conferencia comisionado prelado preso tribunal interlocutor historia espíritu puerta visita silencio 
1	0,115	soldado enemigo jefe fuego ejército tropa fuerza coronel arma plaza orden combate general sargento columna campo cañón guerra batalla capitán caballo cuerpo fusil ciudad cuartel francés teniente comandante ataque artillería caballería camino sangre grupo bala batallón marcha prisionero campamento línea bandera compañero tiro victoria lado pueblo espada cerro triunfo movimiento 
2	0,40758	corazón amor alma palabra felicidad lágrima dolor sentimiento pasión esperanza amante pensamiento placer cielo desgracia cariño idea mirada ser ángel muerte labio virtud instante esposo recuerdo pena existencia año pecho lado dicha afecto embargo ilusión rostro brazo deseo alegría objeto ternura voz consuelo destino emoción pesar porvenir bien frente razón 
3	0,08427	cuerpo calle vera ocasión muerte brazo amor sueño fuerza beso carne tranvía luz cariño chico caricia rumor sol chiquillo santo muchacho principio cara par pensamiento recuerdo vivienda instante año rincón risa llanto fondo gendarme mañana tarde miedo memoria sitio muro labio reja existencia sombra individuo estancia ropa cena ciudad dicha 
4	0,30082	puerta calle cabeza luz sala voz ventana lado mesa patio cuarto habitación brazo pie ruido pared escalera pieza cama balcón silla cuerpo vista color suelo corredor palabra duda rostro papel agua silencio aire frente sillón esquina entrada traje sombrero zaguán llave reloj criado cara mueble fondo cuadro madera labio golpe 
5	0,00175	ciudad estancia lluvia país ojos placer calles viento cochero sangre aire muchacho agua calle alegría carruaje tren cielo barro gente casas calor raza música avenida multitud piso carruajes gas misia tarde vino niebla barrio infancia miseria atmósfera lucha vuelta boca juventud frescura revolución campo instante cristal sueño muchedumbre establecimiento días 
6	0,04407	capitán coronel gobernador virrey teniente orden gobierno secretario corregidor excelencia voz regimiento papel carta confianza canónigo independencia cabeza despacho pliego mesa dinero revolución soldado mando año jefe palabra autoridad espada español camino guardia modo conspiración correo tío trabajo compañía escribano comandante rey tropa junta encargo madrina empresa servicio ejército oidor 
7	0,12829	gobierno pueblo ministro país guerra revolución partido patria poder presidente política libertad ley jefe nación orden ejército autoridad arma provincia capital palabra enemigo derecho gobernador opinión año gente fuerza triunfo noticia ciudad diputado elemento ciudadano plan acto tropa paz independencia república campaña secretario general sangre plaza principio situación bandera mando 
8	0,14774	crimen cárcel justicia prisión preso reo jefe calabozo muerte bandido juez delito asesino orden sentencia víctima causa libertad carta sangre sociedad compañero policía ley pena declaración carcelero papel alcaide silencio asesinato venganza voz puñal criminal desgraciado hecho castigo autoridad cómplice verdugo prueba ladrón noticia acto puerta tormento objeto ejecución ciudad 
9	0,02239	juez comisario policía barón agente cadáver asesino crimen sangre aldeano doctor cabeza manera defensa prueba herida magistrado bosque instrucción declaración causa defensor médico compañero rostro pie pieza embargo inocencia ley palabra bolsillo lado orden matador secretario tierra cuerpo testigo portero preso mancha asesinato rodilla deber convicción víctima respuesta razón dirección 
10	0,14507	esposo marido matrimonio novio año amor viudo casamiento boda felicidad cariño alma padrino hogar criado ceremonia lágrima fortuna enlace amante anciano brazo beso mes suegro unión dama dicha bendición deber virtud pariente rostro hacienda estancia falta campo dolor tío belleza trabajo vecino edad resto presencia infeliz escena abuelo cama habitación 
11	0,0387	instante duda puerta anciano palabra sonrisa embargo mirada doncella mañana villa aposento año acento presencia objeto silencio voz alegría caballero cabeza calle semblante choza provincia casita labio pensamiento extranjero vista carta esperanza lugar ventana brazo expresión mes país asombro mestizo caballo mancebo camino corazón maestro movimiento atención interlocutor impaciencia pueblo 
12	0,03576	estudiante capitán ejército corazón insurgente caballero palabra revolución ciudad silencio sangre pueblo existencia frente destino porvenir francés guerrillero muerte historia independencia coronel campo sombra diplomático aposento soldado imperio emperador alma negocio situación archiduque héroe compañero tumba luz voz patria rey horizonte aliento honor esposo batalla bandera rayo mar espíritu multitud 
13	0,00094	muerte calle años raza época ciudad sociedad puerta caballero hermanas hijos niña pleito educación limosna espíritu barrio hija hombres carácter camino padres iglesia razón gente pan plaza bondad damas historia título trabajo puente favor orgullo año ley viuda esclavos días tarde siglo caballeros calles veces poder semblante estado recursos pueblo 
14	0,02628	alma cuerpo corazón lado silencio cabeza rato sangre luz calle tierra médico cielo sombra sol hogar cama amor cuarto espíritu dolor palabra esplendor alegría pasión muerte miedo comedor carne frío cara voz marcha ímpetu trabajador frente año obrero historia gloria suburbio ciudad fuego trabajo pecho brazo rostro grito virtud seda 
15	0,04536	dama alcalde puerta virrey calle alguacil marqués espada palacio caballero merced rey señoría oidor brujo orden barón lugar bachiller ciudad inquisidor negro amor criado justicia negocio razón lacayo habitación rostro fraile aposento corte gente cámara año lado secreto palabra oro escribano escudero ronda efecto sombrero noticia especie sitial maese tormento 
16	0,02225	v_d doctor tenia manera país gusto sociedad vd criatura h_u fortuna esposo personaje amante negocio educación asunto cuaderno semana bailarín calle libertino posición aventura imaginación instante necesidad atención gente teatro entrevista palabra sílfide orden honor cuarto ciudad visita gracia obra traje do fuerza criado vds lugar objeto interés caballero artista 
17	0,19022	voz mirada idea cabeza espíritu palabra año movimiento frase instante cerebro gesto aire impresión tono luz muchacho alma recuerdo actitud deseo sonrisa expresión sueño pensamiento grupo figura existencia fondo sentimiento pasión cara rostro sombra ser hogar esfuerzo emoción realidad lado brazo estudiante lucha compañero rato labio acto alegría criatura detalle 
18	0,2395	flor luz amor cielo alma sol corazón sombra jardín tarde color voz mirada rosa nube luna oro rayo labio hoja árbol aire fondo sueño estrella ala perfume planta pecho mañana tierra canto frente cabeza brisa música agua pie sonrisa viento lágrima recuerdo rama mar rostro horizonte seno beso belleza ángel 
19	0,00222	sol león silencio licenciado viento montonera lana hombres voz aire cielo godo sombra cola pie ojos fondo cocina suelo grupo cumbre guerra patrón paja nariz fuego perros curva techo roca torre amor coca destino triunfo caballo pluma rato nube cuero fiera montaña boca leña abismo mate región canoa mortero campo 
20	0,14009	carta carruaje coche viaje ciudad mesa criado cochero año papel calle cuarto palabra caballo retrato hotel mañana mes puerta viajero camino noticia paseo letra tren libro billete lado pañuelo tarde dueño pasajero brazo rato compañero caja diligencia estación asiento capital caballero partida recuerdo visita portezuela pie línea reloj sueño teatro 
21	0,00124	rostro terrado mesa flores teatro ojos oro seda piano color sala alfombra plata espejo pie caoba sombrero cartas tomo concurrencia cabeza labios cajón hijas traje jinete playa sofá brazos champaña cinta bronce sillas alcoba asiático estancia cristal espuma hojas zaguán papel hombros coñac hombres risas negro señores mármol muro doctor 
22	0,04232	negro esclavo amo mulato ingenio finca mayoral campo ama blanco caña calesero merced perro menudo cafetal castigo esclavitud caballo color trabajo azúcar raza machete odio ocasión lector año tierra criollo cura látigo mulata falta vivienda cuero sangre tabaco esclavos bohío muchacho época negros quitrín corredor embargo compañero batey isla café 
23	0,00207	ciudad ojos agua hombres cielo tierra hijos silencio manos puerta rostro árboles muerte río población lugar fraile copa miedo país sol edad flores valle campos ruido castillo terror aspecto brisa horas patria ruinas historia forma soledad paz años cuadro centro caballos hija invierno estancia aguas enferma bandidos fuerzas desierto tesoro 
24	0,02931	caballo camino brazo instante amo muchacho toro rancho cuidado gusto palabra silla muías cerro maestro cabeza pie lado fuerza cara dinero arriero cura hacienda sitio plaza lágrima merced suerte favor pueblo año sombrero valle empeño interés orden negocio charro rato puerta animal vista confianza estado diablo criado modo villa pierna 
25	0,00195	posadero país años dinero embargo fortuna lado habitación muerte manera amistad negocios justicia viuda posada matrimonio humanidad amigos educación llegada año atención naturaleza riquezas cosas facilidad sociedad viaje tenia ley honradez curso presencia propósito tipo oro secreto orden mesa días efecto hombres riqueza hecho pliego dama historia bobo caballo ingenio 
26	0,02616	teatro público palco escena artista telón compañía actor pico voz función perro aplauso orquesta música director dama escenario comedia empresario obra papel ópera maestro puerta coro arte cómico representación asiento cara platea cuarto acto entrada bastidor gente drama ventana actriz foro autor silencio espectáculo triunfo mirada traje proscenio pieza apuntador 
27	0,00095	estudiante esqueleto cráneo campanas espíritu recuerdos bolsa recuerdo médico huesos ciudad labios manos hueso brazos sereno reloj sangre patio duda estudio silencio manuscrito doctor costilla loco obra viento mirada escucha campana rincón figura quebrada aposento estilo estado embargo puerta alas mariposa curiosidad cerebro tarjeta autor materia vuelta gracias procurador pregunta 
28	0,00469	mono capitán gorila doctor especie eslabón razón naturaleza siglo tierra efecto palabra negro chimpancé hembra ciencia orang edad ser tribu ángulo gibón salvaje viajero modo pilotín región brazo cerebro cráneo animal antropoide tipo guerra cola origen fiera terreno espíritu creación informe triunfo raza hotentote isla época viaje fruto forma inteligencia 
29	0,11991	doctor médico enfermo enfermedad muerte hospital cama dolor lecho estado mal salud cuerpo fiebre ciencia remedio medicina paciente esperanza cabecera facultativo año consuelo dolencia desgracia corazón alma suceso curación cuarto cuidado pulso embargo espíritu infeliz delirio sepulturero viaje existencia esfuerzo alcoba sufrimiento lágrima visita servicio causa amo gracia crisis lazarino 
30	0,00203	tienda socio capital gente doctor plaza coche establecimiento calle dependiente viento luz zócalo marchante género par acciones empresa interior papel cura letrero lluvia movimiento tranvías circo tranvía línea oro cochero aspecto ciudad mostrador muchacho plazuela cielo jardín gas gesto acera vista pan teléfono extranjeros polvo carros sastre lugar tendero plata 
31	0,00158	doctor as negro cortito sota gaucho examen memoria payador alfiler misia mesa mozo miedo techo aparcero juego orden río café año clase silencio cielo paño tapete barraca comedor talismán menudo escalera madera cartas montero tío campo banquero índice vela placer ciudad puerta gauchito bastos albur claustro lugar cara mirada rey 
32	0,01015	años ojos manos veces amigos calle luz hombres tierra cosas cabeza calles mujeres color año días voz puertas aire sombrero fondo ciudad labios palabras cuerpo casas mesa horas brazos boca partes muchacha gritos mozo tarde vista pies compañeros gente cara barba paredes nariz trabajo lugar momentos copa lado ventanas dientes 
33	0,00475	hombres guerra soldados ejército armas jefe gobierno pueblo campaña provincia amigos paz país jefes españoles pueblos causa indios tropas autoridad carácter elementos años línea órdenes camisa fuerzas recursos clase voluntad gobernador policía provincias manera ley ejércitos valor enemigos cuerpos poder filas medios ciudad noticias paisanos época conducta veces cura cama 
34	0,00203	doctor sabio ciencia idioma razón ciudad lucha animal tren pueblo palabra viaje objeto agua sesión especie cuestión música gloria país lobo miembros teoría carácter perro berlinés lector compañero darwinista manera viajero colección placer individuo sur guerra silencio estación rabianistas piano señores malicia relación fenómeno años humanidad alemán idea maestro partido 
35	0,52614	palabra razón asunto efecto modo manera motivo duda idea ocasión embargo situación noticia lugar circunstancia deseo cabeza conversación fuerza causa atención relación caballero confianza objeto interés orden ánimo camino lado peligro falta hecho puerta intención visita secreto principio plan conducta suerte tono desgracia amor corazón papel propósito prueba costumbre voluntad 
36	0,05227	ejército manera soldado jefe enemigo fuerza coronel tropa prisionero orden marcha arma provincia caballo batalla gente combate gobierno acto caudillo guerra elemento muerte campamento lado cuerpo campaña ciudad golpe montonero noticia fraile rastro herida grupo peligro caballería infantería pie asesino palabra situación persecución seguridad camino género campo paraje duda regimiento 
37	0,10745	convento cura iglesia sacerdote fraile monje misa altar fray templo religión obispo voz oración celda capilla claustro pueblo santo sacristán año campana procesión religioso imagen ciudad puerta coro clérigo hábito pecado alma hereje merced lugar gente abadesa confesión fe capellán comunidad confesor libro cruz sacristía acto voto ceremonia novicio orden 
38	0,04635	indio español dios sacerdote instante cacique guerrero palabra extranjero soldado pueblo país cabeza ciudad templo capitán patria mirada anciano tierra voz número arma piedra enemigo sangre lugar sacrificio año tribu flecha cristiano campamento labio muchedumbre duda embajador oro religión gobernador jefe algodón idioma batalla altar azteca semblante pecho esclavo caudillo 
39	0,36371	voz brazo muerte cabeza palabra sangre grito rostro puerta mirada pie cuerpo silencio instante cadáver pecho fuerza dolor labio luz corazón alma lágrima frente golpe suelo tierra lado movimiento esfuerzo terror boca lecho miedo venganza anciano fuego rodilla ruido escena víctima acento cielo arma espanto aire desesperación oído herida vista 
40	0,00107	viuda causa manos cosas calor galera cama pan abrigo camino techo fortuna lámpara costumbre atmósfera palabra sociedad golpe agua banco pensamiento hospital rumor sombra obra espalda qu compañera libro días salones nariz embargo zaguán et almacén cabo administración forma amo río efecto almohada café besos mal fuego misterio honor oficio 
41	0,00179	amo machete columna ciudad voz soldados naturaleza especie caña sol cadena hombres hombro palabra asistente tierra bosque muías trabajo sangre mambís yerba juego jefe retaguardia suelo frase muchacho población frente servicio ruido sombrero mañana bastonero marcha silencio parejas pierna soldado cerebro mozas dolor distancia coronel longitud baja campamento movimiento bosques 
42	0,03608	tío sobrino puerta calle despacho primo cabeza patrón muchacho sol ciudad chico cara destino aldea fortuna carta piedra trabajo madama miedo dinero oro tienda lado perro tesoro lía baúl arrabal escalera tahona abuela barrio grito espalda recomendación edad brazo gesto fuerza habitación país ropa abuelo aire vecino golpe cama persiana 
43	0,00098	cura escuela año años muchacho procurador pueblo cara plaza papel duda chucho mamá cosas chico mañana días miedo sacerdote padres alma misa presencia libros altar tienda libro hermanos limosna atención gracia muchachos sombrero historia hijas paternidad portal capital niños curato comerciante lector gente talismán familias barrio función fama sacristán difunto 
44	0,02675	misia doctor tienda muchacho calle club marido plaza pueblo partido cara madama provincia despacho política mostrador cabeza juez ordenistas chico candidato ministro escuela duda papel aldea tío esquina elección detalle voz candidatura iglesia orden puerta coche gracia triunfo diputado mistress diario sofá capital acera ordenista costumbre paz estancia patrón falta 
45	0,01234	ojos años hija corazón niña palabras amor veces mirada cabeza manos alma rostro voz días labios mujeres aire esposa edad brazos hombres lágrimas vista personas belleza fisonomía jóvenes padres boca señorita flores amigos frente oro carácter meses efecto sentimientos hermana miradas momentos hijos pies expresión luz lado cosas juventud ideas 
46	0,00443	sor superiora ciudad jardín colegio agua religioso criatura lluvia papá edificio hacienda secretario portero piano huérfano asilado dormitorio efecto vecindad voz agente nana oro notario maestro establecimiento orden dinero salón piso estudio año juzgado estudiante portera peso rumbo comida muerte olor cielo ponche taller cabellera modo viaje turno refectorio tumulto 
47	0,08995	caballo hacienda pueblo camino compadre cura muchacho gente bandido lugar jinete rancho mozo ladrón amo mulo pistola vecino administrador manera campo dinero compañero animal sombrero fuerza arma indio rumbo árbol plata cuidado población autoridad año cabeza pie trabajo jefe licenciado silla miedo monte orden marcha corral palabra terreno alcalde viaje 
48	0,18207	camino árbol agua caballo río bosque tierra sol campo lado pie montaña pueblo sitio distancia vista viento valle aire piedra animal lugar orilla monte cielo año arroyo ruido luz rama silencio marcha viajero tronco fuego nube roca sombra llanura naturaleza perro rumor terreno hoja lluvia compañero cabeza legua fondo horizonte 
49	0,02282	capitán pirata inglés buque mar navío puerto bote marino ciudad caballero gente plaza costa tierra vista marinero fortaleza bergantín rumbo castillo nave duda vela goleta hereje orden miliciano marcha enemigo suceso cámara orilla merced año guerra batería filibustero cañón queche embarcación población rey colonia altura baluarte gobernador semblante instante acero 
50	0,06928	príncipe rey palacio princesa emperador monarca ciudad imperio tierra corte español pueblo trono enemigo reino dios conquistador ejército gloria soberano guerra oro gente capitán esposo voz plaza corona arma poder palabra embargo orden tesorero muerte nación conquista brazo cortés noticia vasallo noble comitiva marina respeto esperanza súbdito personaje cámara tropa 
51	0,27836	año libro obra sociedad país idea estudio tierra espíritu época maestro arte historia ciudad trabajo razón edad siglo ley carácter inteligencia talento pueblo naturaleza ciencia forma derecho educación clase raza campo escuela cuadro poeta hecho título virtud especie necesidad embargo principio ejemplo autor juventud costumbre luz humanidad progreso modo porvenir 
52	0,00246	virrey tío muchacho rancho compadre p_a camino vaquero plata amo raza ojos verdá piloto oro cara morenciano vino pelo palabra p_o negocio luz cabeza hacienda sol chico ai corral cerro licenciado mozo sangre modo heredero marido tierras polizón peón camisa sirviente vereda cielo puerta canto espalda mañana fortuna uté campo 
53	0,10075	muchacho criado calle dinero puerta vecino pollo año coche manera cuarto gente marido agua recámara amo ropa cara vaso vela trabajo cocina sombrero lector hambre lugar merced pieza llave botella visita criatura mesa comida portero amor ama vivienda pobre pan tarde desgracia chocolate mes multitud camisa diablo cuidado fistol vecindad 
54	0,25556	boca cabeza pie perro agua cara gente muchacho carne nariz pierna diablo vino mesa pelo botella plato suelo mozo aire dedo vuelta diente lengua oreja animal sombrero palo punta gato chico dueño estómago piedra pata copa color sangre hombro pan espalda ropa comida cuento cocina cuerpo camisa risa barba cuello 
55	0,02411	esclavo dios ciudad instante sitio pieza sacerdote templo do edificio calle lado vista gladiador tenia palabra columna estatua puerta pueblo oro multitud mármol amo ceniza pintura piedra pared anfiteatro pórtico agua virtud forma vino altar entrada primo bronce cristiano esposo tierra romano rostro año carro plata número riqueza placer traje 
56	0,00572	ciudad rostro caballero merced mancebo espada oro morisco sol hidalgo plata cuadra mañana doncella modo soldado ventana estancia año aágora guerra instante escudero cielo canónigo sueño piedra honra plumas algodón capa orgullo mulata muralla bahía arco embargo galán seda semblante piel camisa mar linaje espejo frente costumbre fondo saya pluma 
57	0,04898	mar buque costa agua playa puerto tierra ola viento bote capitán muelle viaje barco marinero cubierta vela vapor isla vista oro embarcación compañero popa lancha proa bahía canal pasajero orilla lado remo canoa fondo arena pescador inglés gente espuma marino suerte palo barca horizonte marzo distancia brisa aire grupo embargo 
58	0,03652	conde marqués condesa barón general duque castillo marquesa pie gabinete título baronesa año honor lector dama duda señorito palacio salón coqueta jorobado calma honra personaje nobleza convento caballero poeta idea orgullo mirada corte guerra dignidad fortuna gloria primo risa heredero carta sillón triunfo virtud doncella já criado riqueza amo gesto 
59	0,00236	espíritu materia gato imagen alma fuerza planeta luz médico cuerpo genio tierra carácter espacio espíritus vd fenómeno sentidos ciencia estudio manera embargo mar hemisferio secreto libertad habitante torbellino hoja palabra superficie resplandor naturaleza disco misterio espíritu-imagen aureola peso átomo existencia éter general ceremonia centro ciudad búho forma resto aire maestro 
60	0,17066	dinero negocio fortuna trabajo oro capital juego mes calle manera cuenta cantidad suma gasto miseria abogado mesa peso escritorio año precio bolsillo carta comercio gente dueño clase situación jugador bien interés crédito recurso suerte sociedad relación idea sueldo posición caja servicio necesidad confianza patrón modo vino papel socio cliente asunto 
61	0,00379	gallo guajiro pueblo pelea valla juego perro machete río potrero amor sol gallos cuello embargo criollo tierra casas mañana campo caballo arroyo flores oro miedo gallero maíz dinero café fruto memoria oficio amol pañuelo mula campana potro canto comarca yagua plata trabajo flor gallina héroe aldea guano taburete palabra bodega 
62	0,02842	cabeza unitario calle orden ciudad tirano pueblo caballo sangre puerta rosa asesino espíritu salvaje plaza patria doctor mazorca puñal comandante coronel mirada servicio federación revolución bandido cuartel gente cuchillo negro sereno diablo embargo época río libertad patriota policía cuerpo edecán fisonomía efecto compañero miedo palabra golpe patio víctima mulato corazón 
63	0,10761	mamá muchacho papá mayordomo señorito tío año chico corazón mozo razón ciudad abuelo alma misa sala calle primo tarde anciano cariño criatura huérfano carácter gusto edad criado camino maestro frase pena manera prima amor mancebo alegría ama comedor tono gracia pensamiento flor palabra obra rato libro cielo canónigo tristeza corredor 
64	0,03786	caballo gaucho paisano partida rancho gente sargento campo estancia pulpería guitarra daga puerta alcalde soldado peón cabeza lado mate voz trabuco camino vuelta manera baile animal patrón perro capataz quinta sable golpe palabra dueño vista galope muerte partido pago justicia alegría pampa cintura teniente diablo jinete mirada rienda pico lucha 
65	0,00741	idea pasión espíritu alma ser forma fuerza cerebro pensamiento amor belleza sentimiento mina frase trabajo mirada celo voluntad conciencia estudio deseo existencia recuerdo naturaleza color inspiración sensación inteligencia creación sueño atmósfera corazón brillo luz causa lucha piedra pupila movimiento palabra mañana razón hermosura modo ciencia sentido ideas fiebre estado arte 
66	0,03925	periódico secretario licenciado artículo oficina mesa asunto jefe papel pluma periodista diputado despacho calle carta escribiente gobernador párrafo abogado palabra redacción escritor empleo talento muchacho cara puesto personaje director cuarto compañero estudiante ministro sueldo diario expediente trabajo prensa número interés idea mañana frase lectura título letra capital portero elogio línea 
67	0,18621	baile salón brazo fiesta sala traje palabra gusto señorito mirada caballero música conversación voz color mesa compañero gracia amor flor lado pie atención piano pareja sociedad dama sonrisa gente grupo lujo aire asiento oro reunión concurrencia danza placer año paseo copa manera vista carruaje belleza teatro cuerpo efecto pieza seda 
