68	0,26882	año sociedad obra libro país idea trabajo estudio pueblo tierra época espíritu arte historia siglo ley maestro inteligencia escuela ciencia raza edad talento clase educación naturaleza razón carácter derecho ciudad virtud forma hecho fuerza cuadro título porvenir costumbre progreso necesidad libertad principio humanidad luz patria campo especie ejemplo juventud vicio 
69	0,00138	baile mamá león licenciado curial coronel abrigo alfombra marido rostro coñac oro amor sala capitán niñas carne papá manera silencio dependiente cosas gentes piano negocio sombrero risas par champaña curva salón atmósfera novio rato polvo razón tenería compañera señores cabeza general sazón línea doctor raso nariz seda cuerpo miedo sillas 
70	0,2267	crimen muerte venganza sangre justicia alma víctima honor derecho odio conciencia palabra duelo razón mal infamia castigo arma ley sociedad miserable pistola perdón brazo desprecio amor golpe esposo desgraciado cólera valor delito vergüenza testigo escándalo rostro puñal marido desgracia ira fuerza virtud culpa honra infame asesino historia bien escena corazón 
71	0,00083	examen estudiante año misa atrio estudio compañero libro ciencia memoria resto doctor libros galera salón pieza años techo tierra escuela estudiantes licenciado comida templo cara compañeros grupo ojos entrada curiosidad número programa espacio claustro fortuna vajilla júbilo recinto grado clase puerta novia catedrático manos figura fisonomía espectáculo época estudios notario 
72	0,07958	preso cárcel prisión reo calabozo juez causa orden crimen declaración sentencia justicia muerte libertad delito alcaide carcelero defensa asesino pena cabeza palabra soldado manera verdugo ley defensor abogado secretario pueblo proceso guardia asesinato tribunal voz cómplice doctor centinela ejecución víctima grillo capitán prueba conciencia testigo criminal hecho tormento autoridad plaza 
73	0,12372	carta papel corazón año amor criado palabra letra mesa cuarto mes retrato cariño mañana esposo bolsillo noticia objeto duda visita deseo calle modo escritorio billete lectura libro tío señorito esperanza viaje ciudad lágrima pensamiento rato idea correo memoria vuelta embargo línea pie puerta recuerdo pluma frase cama caballero papá amistad 
74	0,01177	v_d país esposo negocio vd tenia carta h_u teatro amante semana libertino criatura aventura gusto necesidad bailarín marido posición manera billete sílfide dinero alemán calle cuarto astrólogo sociedad corazón honor caballero cartera visita licorero vds fortuna entrevista orden mañana recurso relación personaje gente matrimonio educación par situación beldad héroe número 
75	0,06988	caballo hacienda compadre camino rancho pueblo muchacho amo cura cuidado gente mozo palabra silla sombrero instante año licenciado dinero brazo mulo administrador cara ranchero fuerza corral animal merced cerro trabajo gusto pistola maestro cabeza campo pie toro arriero muías criado orden rumbo compañero manera favor corazón puerta confianza negocio lugar 
76	0,17287	color traje oro brazo seda cabeza salón flor pie cabello cuello caballero mirada rostro lado sombrero gracia señorito labio plata belleza rosa espejo sonrisa forma dama gusto cuerpo lujo frente manera terciopelo aire moda año encaje hombro dedo hermosura boca derecha cinta adorno perla elegancia vestido cintura raso palacio sillón 
77	0,01922	esclavo dios ciudad sitio pieza instante sacerdote templo do calle gladiador edificio vista tenia palabra lado columna estatua puerta oro multitud ceniza pintura amo pueblo pared virtud pórtico piedra anfiteatro tierra mármol carro agua romano bronce cristiano forma altar riqueza entrada primo número rostro traje pretor belleza placer año mosaico 
78	0,03893	capitán ejército estudiante insurgente corazón sangre revolución silencio caballero palabra pueblo ciudad existencia frente muerte porvenir voz destino emperador guerrillero coronel independencia francés historia sombra luz diplomático soldado campo aposento negocio alma rey cura imperio archiduque tumba multitud aliento orden batalla situación honor nación espíritu esposo héroe idea horizonte emperatriz 
79	0,35859	amor corazón alma felicidad palabra pasión sentimiento amante mirada pensamiento dolor placer ser lágrima esperanza cielo ángel cariño pecho labio dicha idea ilusión rostro virtud existencia recuerdo embargo afecto ternura cabeza deseo lado sonrisa imaginación fuerza emoción voz belleza frente naturaleza luz brazo imagen desgracia pesar vista instante sueño destino 
