0	0,35148	corazón amor alma felicidad palabra lágrima dolor sentimiento pasión cariño amante placer esperanza pensamiento desgracia virtud cielo pena afecto idea deseo ser año ángel dicha lado alegría muerte pecho tierra esposo objeto rostro bien ilusión tristeza razón existencia deber embargo labio instante recuerdo amistad voluntad ternura pesar bondad criatura destino 
1	0,11229	soldado capitán enemigo ejército coronel jefe fuego tropa plaza arma campo fuerza ciudad orden combate general columna francés teniente caballo guerra pueblo sangre cañón batalla bandera cuartel camino insurgente marcha muerte artillería fusil prisionero ataque victoria compañero comandante caballería bala patria héroe cuerpo batallón cadáver espada derrota sitio campamento línea 
2	0,03814	conde marqués condesa general corazón duque gabinete pie señorito salón marquesa idea lector puerta amor barón baronesa dama sonrisa conciencia coqueta castillo jorobado virtud honor marido sociedad risa orgullo cara mirada honra triunfo palacio guerra caballero poeta sillón calle felicidad impresión fisonomía historia gloria gesto título fortuna escalera carretela entusiasmo 
3	0,01003	muchacho señorito mamá canónigo ciudad primo clérigo mozo alma fiesta mancebo flor año chocolate misa chico periódico ebanista papá tío razón huérfano alegría gusto anciano asunto escuela corredor dinero casita pena doncella libro ramillete tren dama amor lado asiento rato ceguezuela capitalista blonda altar palabra criatura comedor piano tono tarde 
4	0,04476	tío sobrino muchacho primo tía oficina cuarto despacho trabajo oro informe voz destino habitación expediente rato guitarra gesto vela moneda mañana baúl extremo palabra sombrero camisa bolsillo sueño playa par aire fuerza recomendación lado jefe escribiente espalda empleo tarde ropa suelo misterio humor pedazo edad fortuna muelle partido escalera canción 
5	0,19477	puerta mesa luz sala cabeza lado calle patio brazo color pared habitación coche silla cristal espejo comedor pie sillón papel escalera cuadro mueble traje sombrero cuarto ventana pieza sofá ruido criado reloj oro centro fondo seda rostro flor cama corredor voz negro salón carruaje alfombra alcoba libro labio caja frente 
6	0,00332	mono capitán mamá león chucho gorila amor doctor coronel razón procurador eslabón especie idea compadre curial sastre marido niñas revolución licenciado chimpancé palabra fiera orang efecto cola época baile dependiente manera jefe hembra origen edad gibón destino general negro pilotín tribu viajero negocio rey papá terreno tierra limosna cara antropoide 
7	0,03242	teatro público palco voz escena compañía artista telón actor música función pico perro aplauso dama orquesta director papel concurrencia escenario arte empresario ópera cómico silencio comedia asiento maestro espectáculo representación acto drama ventana bastidor coro foro mirada platea actriz gente cuarto grupo entrada traje espectador manera tragedia patio cabeza triunfo 
8	0,14164	amor corazón mirada voz alma flor palabra cabeza frente labio ángel jardín poeta música luz pecho cielo rosa acento sonrisa balcón sueño felicidad ventana pasión piano rostro beso pie luna pensamiento ternura libro lado brazo gracia emoción tarde color boca sombra poesía año recuerdo perfume imagen habitación esperanza suspiro expresión 
9	0,11544	caballo camino hacienda pueblo muchacho compadre gente lugar rancho cura jinete campo viajero animal amo viaje árbol bandido año mozo compañero tierra diligencia marcha población pie mulo lado rumbo indio legua miedo monte orden manera pasajero coche jefe ladrón cabeza dinero pistola terreno administrador licenciado cuidado fuerza distancia trabajo perro 
10	0,00427	rostro silencio sierra licenciado amo carabina cólera sol voz palabra camino tequila subteniente sangre vaquero coñac pie copa p_a miedo carne puerta cara sotol tomo_ch morenciano muchacho pensamiento gesto escándalo doctor mozo cerveza champaña ráfaga valle honor pecho fonda alcohol cielo p_o ai espalda vaso orden trago hombres ojos raza 
11	0,06587	mar buque capitán agua costa tierra puerto bote playa marinero pirata ola viento muelle viaje vela barco cubierta orilla inglés embarcación río vista isla marino oro popa canal lancha pasajero gente año compañero bahía canoa proa rumbo goleta vapor nave indio brazo palo remo barca peligro remero tripulación duda distancia 
12	0,13066	dinero negocio fortuna oro bien papel cantidad efecto abogado capital cuenta pleito documento asunto precio título gasto razón justicia riqueza posadero año herencia suma miseria trabajo manera deuda recurso mina tesoro posada heredero historia habitación desgracia embargo esposo hacienda hecho firma caja favor voluntad noticia objeto derecho propiedad peso acción 
13	0,02246	estudiante periódico artículo diputado calle examen mesa periodista redacción cara cuarto compañero escritor puerta número ministro párrafo portero agua memoria pluma papel año muchacho talento prensa secretario bola salón jefe sueldo miedo gobernador sombrero personaje imprenta abogado puesto asunto sangre director cama elogio piel idea fondo libro semana redactor vergüenza 
14	0,00117	conde niña hija años barón rey raza título condesa marido castillo gente país año educación esperanza nobleza villa caballero ojos matrimonio objeto convento marqués dama sonrisa padres mancebo origen tanto poder heredero época condes indios damas plaza mesa vino condestable nacimiento cuna calma mulata personaje reyes esposa señorita instante colonia 
15	0,00069	pueblo plaza gente capital tierra sombrero cosas amigos coche empresa zócalo calle cuerpo niñas acciones tranvías negocio centro jardín cuartel lugar oro circo compadre peso modo distancia forma pie arroyo distrito calles portal teatro grupo extranjeros costumbre vista cabecera extremo camino lado negocios letra viento comandantes mayoría guardia entrada vecindario 
16	0,01801	juez comisario asesino policía barón agente rastro crimen sangre cadáver pie herida aldeano asesinato instrucción caballo bosque médico prueba cabeza magistrado compañero embargo manera dirección suelo matador pisada bolsillo examen duda lado tierra oficina rastreador puerta cuerpo rostro investigación pisadas inocencia camino portero rodilla fisonomía llave huella víctima escribano carruaje 
17	0,00281	años amigos ciudad historia dinero personas año hijos trabajo negocios días veces miseria fortuna recursos edad hombres tiempos educación relaciones cosas calle plaza poder puerta época viaje coche ministros muerte meses país madrina tenia carácter ocasión pan esposa camino viuda lugar oficio limosna justicia jóvenes medios curso presencia capital anciano 
18	0,22227	año libro maestro carácter obra estudio talento edad época gusto arte país educación fortuna embargo sociedad ocasión número especie poeta clase artista memoria autor historia título ciudad efecto trabajo modo conversación muchacho atención mes discípulo idea mérito escuela moda lectura papel letra imaginación lección viaje dama objeto circunstancia forma condición 
19	0,16981	muchacho chico calle misia cara mozo cabeza boca pie tienda papá lengua tío gana palabra diablo señorito duda corazón vergüenza paz nariz marido abuelo ocasión dedo santo doctor esquina cuenta pelo gusto plaza gracia falta gato sol risa perro escuela puerta voz cuento vuelta lástima frase costumbre chiquillo mamá gesto 
20	0,01588	ojos años veces manos hija palabras días niña hombres labios cabeza mujeres brazos cosas rostro voz luz alma amigos flores aire corazón horas color personas sol hijos edad lado padres lágrimas jóvenes boca vista mirada pies hermana momentos cuerpo ideas esposa silencio cielo oro frente noches meses ciudad tierra calles 
21	0,33849	voz corazón brazo palabra muerte mirada silencio rostro instante puerta cabeza alma grito dolor lágrima sangre pie labio frente luz fuerza pecho cuerpo acento anciano esposo cielo víctima cadáver esperanza crimen sombra desesperación terror venganza desgracia lecho golpe lado existencia recuerdo pensamiento rodilla escena desgraciado rayo movimiento vista sueño espanto 
22	0,00186	ciudad sor lluvia agua casas calles país calle viento cielo fraile sol luz veces paredes gente árboles voz cosas plaza copa ventanas relámpagos partes aguacero trueno barro puerta suelo sueño nubes puertas años miedo paraguas ojos voces torre noches enferma aposento caja criatura ropas ladrillos color pies días techos cuartos 
23	0,24955	agua pie cuerpo cabeza suelo boca perro animal grito tierra aire pierna carne fuego brazo voz lado piedra ruido fuerza pared sangre cara vuelta golpe sol gente humo diente hueso forma rostro pedazo punta espalda pecho sombra movimiento nariz fondo dedo hombro bestia mirada distancia frente montón especie color cueva 
24	0,07866	carta papel mesa juego capitán oro año corazón bolsillo letra fortuna criado billete jugador caballero escritorio carruaje coronel partida caballo papá objeto retrato duda amor viaje correo sota noticia lectura mes deseo baraja esposo tío capital palabra atención modo mañana as cuarto nodriza rey alférez idea memoria mozo caja paquete 
25	0,10338	dinero negocio calle trabajo fortuna mes manera capital gente escritorio hotel situación inglés patrón sociedad policía lado miseria porvenir ciudad comercio suma dueño palabra cuenta año sueldo relación diario interés posición socio idea viaje café pieza bolsillo vino modo confianza muchacho peso género ropa gasto cliente dependiente mozo suerte puerta 
26	0,00169	cura pueblo flores aldea muchacho trabajo árboles juego escuela mañana veces curato perro tierra presencia libro misa anciano libros iglesia huerta honradez memoria corral arroyo sol capitán edad molino vecinos montaña plateados casita sacristán lado cariño herrero sacerdote semblante cara sueño forastero toque fiesta campanario huerto lectura pie casas chico 
27	0,01888	alma cuerpo corazón silencio lado cabeza rato sangre luz cielo médico calle sol sombra dolor amor tierra cuarto hogar cama voz esplendor muerte palabra miedo pecho alegría espíritu marcha pasión cara rostro frente comedor brazo trabajador frío seda ímpetu suburbio grito flor patio plegaria mejilla penumbra poema año historia dormitorio 
28	0,49316	palabra asunto modo razón efecto manera motivo idea duda situación embargo noticia lugar lado circunstancia camino fuerza ocasión orden causa confianza interés conversación objeto tono ánimo deseo atención voz relación visita conducta movimiento presencia falta propósito cabeza hecho plan suerte carta silencio papel pregunta mirada intención sorpresa voluntad secreto estado 
29	0,11122	voz amor instante alegría flor aire año espíritu actitud juventud cabeza muchacho criatura frase tren brazo boca ciudad impresión grupo tono cerebro calle tarde lucha emoción alma sangre sueño expresión movimiento hogar gesto placer mirada planta sensación luz lluvia organismo viejo figura estudiante risa cariño pensamiento pecho sombra mamá tristeza 
30	0,07374	español indio príncipe dios princesa palacio rey emperador sacerdote extranjero guerrero palabra pueblo capitán ciudad voz tierra enemigo instante cabeza soldado cacique monarca imperio arma corte sangre templo ejército país oro conquistador mirada guerra cortés brazo patria número trono piedra semblante embajador soberano plaza noticia lugar jefe orden reino valor 
31	0,005	ciudad rostro mancebo espada oro morisco capa hidalgo cuadra soldado aágora merced ventana honra estancia sol canónigo plata guerra doncella modo escudero semblante muro paje muralla sangre vd caballero grandeza piel menester oficio nobleza rumor torre pausa linaje anciano discurso hoja libro fondo uso puerta caserón ordinario año hierro daga 
32	0,01049	deán conde prepósito jesuíta caballero gobernador provincia socio comisario judío maestre obispo embargo cabildo dominico orden colegial palacio capitán villa presencia especie puerta suceso asunto esposo efecto colegio historia negocio ánimo objeto sitio rey regidor año tribunal confesor bien carta escena mesa usarced interlocutor prelado poder finca comisionado motivo dama 
33	0,06293	coronel ejército soldado jefe manera enemigo tropa fuerza prisionero orden arma marcha batalla provincia gobierno combate ciudad campamento lado acto guerra caballo campaña gente caudillo cuerpo caballería elemento infantería muerte noticia fraile montonero grupo campo herida peligro golpe palabra camino triunfo situación persecución fuego carga regimiento línea cura población seguridad 
34	0,04111	caballo paisano gaucho cabeza unitario partida gente puerta pulpería soldado manera indio golpe daga bandido calle muerte mazorca alcalde salvaje asesino orden mirada lado sargento puñal miedo compadre espíritu rancho cuchillo cuerpo puñalada sable sereno policía arma trabuco guitarra camino mate capitán palabra cara teniente valor sangre voz diablo partido 
35	0,10956	convento iglesia cura sacerdote fraile misa altar fray monje templo santo capilla oración año religión sacristán claustro celda obispo campana hábito coro religioso imagen alma voz procesión merced clérigo maestro pecado hereje cruz capellán abadesa ceremonia gente franciscano libro sacristía comunidad confesor voto tierra gracia confesión devoción rosario cristiano novicio 
36	0,00432	hombres guerra soldados ejército armas jefe gobernador país paz gobierno jefes provincia indios pueblo tropas españoles pueblos amigos autoridad fuerzas años carácter campaña camisa elementos órdenes filas ejércitos caudillo línea voluntad manera causa provincias mando valor servicio teniente ciudad enemigos época cuerpo veces fortuna interior odio policía clase cama cuartel 
37	0,03558	doctor hospital mal lazarino amo salud ciencia capellán mamá sepulturero espíritu vista existencia alma merced causa esperanza placer médico embargo muerte sociedad juventud viaje tierra historia amor dolencia atención estudio ausencia carne boticario necesidad amistad país consuelo remedio compañero administrador libro humanidad acento afecto secreto conversación suceso patria botica fisonomía 
38	0,22064	sol flor cielo árbol luz agua tierra sombra nube bosque alma tarde campo rama aire viento ciudad montaña color hoja camino horizonte rayo río fondo naturaleza sitio ala pie mar mañana estrella oro luna ave lluvia planta brisa jardín soledad canto espacio piedra sueño valle orilla rumor pájaro rosa paisaje 
39	0,00336	madama estudiante aldea esqueleto calle bolsa cráneo patio año mesa estudio trabajo puerta cabeza misia viaje escritorio cuarto abuela novela muchacho tierra huesos caoba papel obrador aljibe pieza aserradero pino costilla huerta tomo hueso hijas rincón carta pie pam monsieur mes barrio noticia torre marido catedrático persiana comida cerebro edad 
40	0,0035	calle misia aire través carrera corbata copa cabeza oficio vous embargo fiesta calles oro atmósfera camino est menudo abrazo hombro tarde manos cambio amigos mercado río esquina tamaño pieza frase servicio café vanidad boca camisa forma seno compañeros sociedad causa teatro cara pena porvenir mérito obra des mozo alcohol moda 
41	0,17088	pueblo país sociedad ley libertad tierra idea año patria espíritu derecho ciudad raza siglo época obra humanidad nación historia gobierno porvenir trabajo progreso religión virtud razón gloria civilización hecho inteligencia vicio justicia honor sangre principio luz palabra error clase triunfo generación poder conciencia mal guerra alma naturaleza crimen ejemplo escuela 
42	0,04873	virrey dama puerta alcalde calle rey marqués alguacil oidor palacio señoría brujo caballero inquisidor orden lugar barón espada negocio ciudad lado bachiller corregidor capitán amor negro razón criado habitación gente merced aposento rostro luz justicia cámara lacayo secreto corte escribano fraile palabra mesa arzobispo golpe do canónigo fe escudero corredor 
43	0,00209	tienda mostrador campanas socio dependiente cura establecimiento luz género doctor misa iglesia sereno puerta marchante calle par gesto campana pieza polvo gente tranvía esquina cabeza plazuela plaza línea tendero letrero aire lluvia licenciado movimiento ciudad escalera reloj aspecto viento fondo grupo dependientes acera rueda casas negro calor luna precio capital 
44	0,08198	alma idea espíritu ser pasión cerebro fuerza amor pensamiento forma luz sentimiento belleza existencia corazón conciencia mirada deseo naturaleza voluntad imaginación frase sueño ciencia movimiento estudio causa recuerdo lucha celo inteligencia razón ley sentido cuerpo misterio acto palabra expresión sensación atmósfera cielo fondo acción vista brillo imagen inspiración estado color 
45	0,00902	sargento valle quebrada cerro indio cordillera gruta silencio jefe falda godo soldado partida patria guerra instante montonera soldados lado cabo caballo norte sur patriota grupo sable bosque voz fondo cumbre río lego fuego caverna suelo montaña matorral calchaquí hombres rey escucha cóndor jinete cueva camino lord caudillo izquierda boca territorio 
46	0,00787	sabio palabra pueblo ciencia viaje ciudad país tren razón lucha especie fenómeno animal manera idioma carácter gloria teoría modo planeta cuestión objeto relación habitante individuo elemento opinión partido sur sesión mono región colección voz resplandor lobo agua nota guerra viajero miembro lector mar caballero humanidad materia espíritu berlinés miembros principio 
47	0,03772	negro amo esclavo mulato ingenio finca mayoral campo caña ama calesero blanco azúcar menudo color raza cafetal perro esclavitud castigo odio trabajo caballo negros cura machete año carácter cabeza país criollo látigo lector cuero vivienda causa falta muchacho tabaco ocasión café esclavos merced corredor señorito época batey gente trapiche embargo 
48	0,06301	sor calle cuerpo vera amor luz ocasión sueño jardín beso muerte fuerza brazo cariño vivienda santo carne cama memoria coche sitio cara tranvía llanto año fondo existencia gendarme muchacho caricia par instante muro pensamiento principio rumor sol chico dormitorio colegio rincón rumbo tarde risa estancia hombro silencio charla reja balcón 
49	0,0019	virrey jefe ciudad silencio compañero juego cholo sociedad voz mesa candidato carta tono calle café prima suelo piloto oro habitación juramento luz modo ron hermanos vino verdá ojos dinero muchacho reloj justicia idea puñal gusto plaza neófito caballo plata rey amigos flota platero monte boticario chico inglés calles sello veces 
50	0,00999	gallo guajiro machete pelea río bosque pueblo potrero valla café caballo especie perro naturaleza pie tierra amor camino sitio loma criollo sombrero agua árbol gallos palabra hombro ciudad cabeza isla fruto ingeniero yagua cuero traje hamaca cuello gallero potro cocina yerba palma canto casas mambís plátano techo camisa bohío peso 
51	0,11716	cárcel preso prisión crimen juez justicia muerte causa reo orden calabozo asesino delito sentencia declaración libertad víctima carcelero palabra ley pena alcaide cabeza defensa asesinato soldado manera verdugo prueba conciencia tormento voz autoridad criminal castigo acto guardia cómplice proceso hecho sangre ejecución testigo defensor tribunal amante papel pueblo desgraciado inocencia 
52	0,01682	estancia caballo campo rancho peón gaucho capataz mate patrón misia muchacho cocina silencio sol vaca año perro viaje establecimiento palenque peones desierto puerta conversación pampa ciudad lado viento vuelta pieza pañuelo chino guitarra techo voz galope campaña comedor cortito pluma vista tranquera monte carácter asiento corral galpón potro distancia negro 
53	0,03228	caballo muchacho brazo camino coronel amo instante cuidado rancho gusto toro merced maestro palabra hacienda fuerza cara dinero silla muías sombrero cerro cura lado pie sitio arriero negocio interés empeño pueblo lágrima razón plaza cabeza charro rato suerte diablo valle punta criado presencia animal año cólera villa corazón confianza pierna 
54	0,13976	enfermo médico muerte enfermedad dolor cama lecho doctor cuerpo estado cadáver fiebre salud hospital año corazón cuarto brazo lágrima remedio medicina desgracia cuidado cabeza lado mal cabecera sueño herida mañana tarde consuelo paciente muerto habitación alma labio facultativo cementerio ciencia mes infeliz noticia almohada pie respiración rato agua frente esfuerzo 
55	0,00483	mar terrado navío costa fondo muro sol playa parapeto vista tarde puerta baluarte tahona ciudad aire agua litoral jinete arrabal calzada calle arena patrón cara pie granito puertas olas puerto espuma viento asiático muralla afecto panadero rumor presencia color línea sala piedra barrio tanto despacho claridad cielo corazón rúa buques 
56	0,02293	esclavo dios sitio ciudad instante pieza sacerdote do templo calle edificio lado vista puerta tenia gladiador columna oro palabra estatua multitud amo pueblo pórtico ceniza pared mármol pintura agua piedra anfiteatro tierra forma altar entrada placer virtud traje número manera riqueza rostro vino romano carro bronce cristiano cabeza baño año 
57	0,1571	muchacho mesa año vino criado vecino cocina dinero pollo gente puerta comida botella calle agua ropa plato copa vaso sombrero pan mamá hambre cuarto cara chico café tarde pie papel plata mes camisa cocinero semana pobre clase trabajo manera color silla cabeza compadre boca fruto vela alma lugar costumbre visita 
58	0,16203	puerta calle cabeza instante ventana voz brazo palabra duda cuarto merced luz patio pie caballero vista sala cama ruido mañana embargo semblante silla silencio llave labio rostro lado esquina balcón aposento cuerpo pecho escalera grito barrio seña lugar atención pared ciudad aire año reja modo edad cabello movimiento oído fuerza 
59	0,154	baile salón fiesta señorito sala caballero brazo compañero traje palabra voz gusto conversación música grupo pareja mirada carruaje lado pie gracia gente aire color atención concurrencia dama asiento reunión sociedad danza paseo mesa efecto cuerpo flor vista mamá lujo pieza tono copa manera honor muchacho cara sonrisa movimiento amor marido 
60	0,0688	pistola espada arma duelo sangre bandido brazo cabeza caballero caballo golpe palabra padrino lance adversario acero voz bala combate tiro herida honor cuerpo contrario pecho sitio coronel tierra capitán camarada diablo excelencia silencio pie compañero efecto valor puñal cuchillo bandolero distancia punta dama muerte fuerza capa testigo asesino policía desafío 
61	0,0009	viuda mulata doctor recuerdos hermanas bienes abogado mozo historia años herencia secreto sociedad leche edad espíritu ideas salón médico esposa bahía memoria momentos testamento menudo banquero raza existencia ama comercio recuerdo embargo inteligencia fuerza salones sazón dolor pena muerte cabeza luto provincia suerte motivos foro castigo pregunta manuscrito letras trabajo 
62	0,00352	ojos corazón mirada flores fuego cielo aire cabeza alma embargo vd silencio árboles hijos voz extranjero lado doncella viajero rostro rayos sol anciano frente castillo alegría pecho luna fisonomía agua país hombres ciudad pensamiento manos colegio placer tierra brisa sonrisa objeto nubes pasiones expresión amor facciones forma viento existencia muerte 
63	0,00071	voz tía muchacho gaucho muchacha capitán viejita plaza payador guitarra jefe cielo gente guitarrero aparcero do escuela tarde nariz tierra conversación dedos cantor botella dueño recuerdo fiesta bastonero canto sentimiento mostrador baile ciudad sombrero mozas muchachas cajón mozo fondo mujeres suerte gato parejas partida calma suelo vista barraca expresión muchachos 
64	0,11769	gobierno ministro pueblo gobernador revolución partido orden país presidente jefe guerra secretario política poder patria ejército autoridad provincia independencia libertad ley papel año capital palabra fuerza plan arma gente nación general tropa diputado ciudad mando noticia coronel despacho elemento triunfo opinión comisión enemigo campaña negocio comandante patriota cabeza junta entusiasmo 
65	0,00101	ojos cuerpo cara puerta cama frío manos abrigo hermana seda señorita agua fuego boca mesa sueño traje piano gente cutis obra compañera mujeres entrada puertas escalera sitio aire diva cabeza pieza flores polvo mamá noches brazos partes alfombra cuarto alfiler coro voces lecho pasajeros escaleras niños artistas dedos ganas espectáculo 
66	0,12815	esposo marido matrimonio amor novio boda casamiento alma amante viudo cariño felicidad hogar rostro criado enlace ceremonia dama año padrino beso sociedad unión bendición pasión celo mamá suegro frente abuelo flor querido lágrima caballero habitación corazón deber dinero lector dicha ternura mes consorte extremo manera estancia luz seno razón lujo 
67	0,05466	mayordomo capitán puerta calle muchacho coche dinero criado llave voz sala vista ama manera escalera diablo negocio recámara ladrón fistol criatura boca luz oro cuarto pieza fisonomía cochero efecto desgracia alhaja palabra balcón amo portero tutor bandido pensamiento lector vela anciano gabinete bien carruaje mesa multitud zaguán mal crimen cabeza 
68	0,00114	espíritu imagen trabajo luz médico materia tierra mina fuerza alma mañana planeta palabra sentidos gato quebrador sombra naturaleza ojos genio superficie sueño espíritus ideas cadena piedra hambre cerebro sol hemisferio galera mar cuerpo cielos disco almuerzo hospital sangre embargo ensueño espíritu-imagen muías forma espacio peso faja rayos distancia memoria centro 
