68	0,04113	teatro público palco escena voz artista compañía actor telón música aplauso función maestro director escenario orquesta arte comedia asiento gente dama papel ópera puerta coro pico cómico empresario obra espectáculo acto concurrencia representación bastidor entrada platea drama foro actriz silencio autor poeta tragedia pieza proscenio tabla talento traje localidad concierto 
69	0,0047	ciudad calle calles casas gente viento luz veces puertas cosas cielo agua paredes sol barro lluvia años país partes cochero hombres color atmósfera días suelo coche gobierno pared hijas hijos noches oro escuela cuartos paraguas coches plaza madera gritos ojos reloj torre fondo ropas papeles balcones plata acciones movimiento papel 
70	0,08867	mamá muchacho papá señorito carta año corazón amor alma tío chico tarde cariño mozo calle razón primo libro criado tristeza gusto novio misa maestro flor ciudad balcón prima voz gracia pena alegría mes rato cielo comedor manera pensamiento rostro anciano rosa tono palabra carácter huérfano lado mancebo visita mañana criatura 
71	0,05839	mar buque agua costa puerto tierra bote playa ola marinero capitán viaje viento vista vela barco orilla pirata muelle embarcación cubierta gente marino isla inglés lancha río fuerza vapor lado ciudad popa marzo fondo bahía distancia brisa proa pasajero aire rumbo cámara nave goleta bergantín movimiento arena horizonte pie tripulación 
72	0,00947	tienda socio ciudad par establecimiento fondo mostrador cara aire polvo marchante mar tahona sol vista arrabal grupo asiático calzada parapeto panadero gesto granito plazuela sastre puerta taller puertas dependiente acera rostro gente muchacho lengua letrero género despacho claridad trabajo calle rúa casas tranvía horno lado herrería clase viento muro dependientes 
73	0,01196	mono capitán doctor cráneo gorila estudiante esqueleto especie eslabón razón bolsa hueso modo palabra naturaleza viajero ciencia siglo efecto negro tierra chimpancé hembra cerebro edad huesos orang tribu salvaje costilla tipo gibón origen ángulo novela ser pilotín región época animal viento grito obra grado antropoide voluntad viaje guerra inteligencia fiera 
74	0,0036	embargo muchacha palabra cura dinero ciudad hijas amor mesa doctor amol sociedad niñas caballero pa banquero perro niñez comarca caballo edad fortuna potro propiedad sitio apodo calavera tipo color alma ropa agua naturaleza nieta amigos hambre casamiento amos muchachas campos ejército riqueza techo trato vicario mula enferma providencia lector patio 
75	0,14288	puerta calle voz ventana cabeza luz brazo cuarto patio sala palabra ruido pie escalera cama lado silencio pared duda habitación vista pieza instante golpe balcón llave silla esquina caballero mañana aire movimiento cuerpo sombra rato zaguán suelo sombrero vuelta barrio miedo corredor cara sueño fondo reja aposento grito mesa mirada 
76	0,03036	virrey oidor señoría puerta calle dama inquisidor brujo corregidor negocio escribano bachiller canónigo lacayo negro ciudad marqués arzobispo palacio convento orden lado luz alcalde espada cabeza aposento año sombrero gente secreto rostro primo mesa tarde lugar especie sitial conspiración alguacil secretario licenciado capa tormento justicia oro tumulto tío estancia grito 
77	0,10486	dinero negocio fortuna trabajo capital mes calle manera cuenta suma cantidad escritorio gasto miseria oro gente peso año precio relación comercio mesa abogado crédito dueño viaje modo sueldo situación socio patrón lado recurso confianza idea pieza interés carta género cliente dependiente servicio asunto posición clase valor necesidad sociedad vino tienda 
78	0,00512	hombres ejército armas gobierno jefe soldados guerra pueblo amigos gobernador tropas jefes policía fuerzas gente cuartel autoridad causa provincia línea ejércitos camisa filas paz cuerpo mando provincias cuerpos elementos cosas órdenes interior comandante voluntad manos campaña paisanos enemigos fuerza rosas servicio manera ciudad odio falta año plaza carácter miedo poblaciones 
79	0,12736	año idea espíritu carácter mirada palabra movimiento muchacho voz impresión frase aire forma instante tono propósito situación deseo tarde expresión ocasión conversación luz fuerza presencia fondo detalle cerebro acto ánimo circunstancia figura actitud recuerdo esfuerzo fortuna vista realidad grupo existencia aspecto belleza lado emoción afecto gente cambio pasión mes suerte 
80	0,11049	baile salón fiesta brazo sala compañero caballero voz música palabra traje señorito gusto pie mirada conversación flor pareja color gracia grupo atención mesa lado sonrisa dama aire copa danza concurrencia efecto reunión sociedad placer piano gente belleza honor vista asiento tono lujo cuerpo año pieza convidado amor silencio oro vino 
81	0,01254	sargento columna soldado soldados cerro silencio teniente campamento sierra valle carabina quebrada tropa retaguardia godo hombres lado fusil sol rostro pie enemigo fondo cañón fuego frente grupo jefe montonera sable espalda sección subteniente instante bosque camino terreno flanco patria hombro marcha cielo falda sotol monte especie tomo_ch combate capitán bayoneta 
82	0,02442	merced rostro ciudad mancebo espada año oro caballero morisco hidalgo estancia ventana soldado cuadra honra instante doncella libro aágora plata anciano paje muro orgullo moro torre sol canónigo rey embargo pie gesto escudero tarde criado capa modo sombra muralla piedra arrabal linaje daga sangre galán costumbre brasero patio reino abuelo 
83	0,07236	cuerpo calle vera amor ocasión brazo fuerza beso sueño carne luz muerte pensamiento vivienda cama sitio caricia estancia santo tarde gendarme instante llanto par memoria tranvía cuadro cara risa cariño hombro recuerdo año principio respuesta jardín labio fondo dicha rostro chiquillo minuto rumbo cambio artista muro sombra chico individuo sol 
84	0,00398	ojos amo luz palabra cara sol embargo trabajo muías galera marido pelo cadena manos orden techo obra cerebro mañana mujeres cuarto vino carne camisa rancho voluntad frase sueño pan qu tiple comida idea fuego et enaguas enferma camarín crimen corsé libro mar silencio des botella il mulas días dinero caña 
85	0,14322	esposo marido amor matrimonio alma corazón novio felicidad lágrima cariño brazo hogar razón deber dolor sociedad virtud amante boda casamiento desgracia conciencia suerte dicha criado pasión año falta víctima fortuna bien sentimiento lado beso derecho celo trabajo viudo cielo muerte culpa sacrificio rostro enlace porvenir caricia habitación ceremonia unión presencia 
86	0,00402	muchacho pueblo cura cara tío escuela camino chico mañana memoria tierra miedo edad ojos sueño muchacha iglesia amo compadre vaquero plaza años plateados cabeza arroyo lugar año muchachos veces deseo cosas sangre nariz herrero piloto plata raza cuello vecinos lectura duda sol haciendas camisa vacas bandidos producto corral verdá ai 
87	0,08985	coronel soldado jefe ejército enemigo capitán tropa fuerza orden general arma teniente caballo comandante combate guerra batalla caballería camino marcha cuartel cuerpo compañero prisionero ciudad sargento columna campo triunfo movimiento plaza héroe campaña mando espada victoria noticia gente fuego derrota artillería fila peligro ayudante campamento batallón regimiento lado lugar plan 
88	0,03075	paisano caballo gaucho partida gente pulpería soldado daga alcalde guitarra sargento manera rancho trabuco cabeza puerta golpe compadre puñalada sable muerte justicia voz baile prenda bandido partido pico teniente mirada cintura vuelta quinta cuerpo mazorca plaza copa arma lado espíritu pago policía ginebra alegría expresión miedo rebenque maula diablo pueblo 
89	0,03496	carta instante fray papel provincia sonrisa año pirata duda puerta gobernador caballero villa convento mirada aposento presencia maestro escritorio capitán asesino semblante palabra asombro nodriza frase voz anciano ciudad bolsillo letra objeto memoria embargo crimen campo oro mañana acento lectura noticia acero labio alférez silla esperanza conductor alegría corazón sangre 
