68	0,00569	idea alma pasión espíritu ser fuerza forma pensamiento cerebro amor belleza mina sentimiento trabajo voluntad estudio mirada conciencia celo deseo naturaleza existencia inteligencia frase piedra luz brillo causa sensación modo inspiración color hermosura ideas creación lucha atmósfera razón palabra ciencia recuerdo mañana corazón imaginación movimiento arte sueño pupila riqueza crimen 
69	0,19243	agua luz voz fuego tierra grito nube cielo silencio viento cuerpo pie ruido sombra piedra sol rayo aire cabeza montaña llama fondo lluvia relámpago tempestad suelo mar horizonte humo muerte trueno tiniebla movimiento abismo grupo rumor oscuridad cadáver miedo roca terror tormenta escena torrente eco claridad brazo espacio incendio fuerza 
70	0,10694	mesa copa vino botella vaso café plato comida compañero voz silencio palabra comedor agua cocina trago conversación rostro mozo cena brindis pie cocinero convidado banquete estómago mantel licor coñac salud apetito honor cerveza alegría carcajada fiesta cigarro silla lado sombrero orden fonda servicio huésped taza dinero carne almuerzo tono sopa 
71	0,04152	abogado secretario oficina escribiente licenciado despacho empleo expediente jefe pleito papel empleado gobernador diputado sueldo juzgado año negocio juez título pluma muchacho trabajo agente letra periódico mesa ocasión ministerio dinero colegio capital magistrado informe ciencia sillón carta asunto letrado legajo escrito estudiante lectura talento palabra cliente portero memoria dómine administración 
72	0,11649	carta papel crimen bandido jefe justicia policía puerta asesino ciudad objeto secreto ladrón sociedad noticia duda víctima venganza documento letra asunto puñal calle sospecha robo prueba sangre historia agente oro hecho efecto idea cómplice orden palacio malvado plan asesinato misterio escritorio acto vista bolsillo bandolero lugar forma infame imaginación autor 
73	0,00082	mesa espíritu autoridad sillón chimenea sociedad secreto modo carácter caja carne comedor voluntad vd biblioteca asunto gato idea papel amigos bigote libro armas hospital voz mañana tarde sala dueño fondo apostura cielo tomo vela escuela cosas frecuencia café rincón pregunta duda antesala pausa vuelta observaciones territorio muchacho reloj materia gracias 
74	0,0036	espíritu sabio palabra imagen materia planeta alma fenómeno fuerza ciencia pueblo cuerpo ciudad manera razón gato médico luz modo viaje cuestión teoría lucha idioma gloria sesión carácter genio habitante mar especie centro resplandor forma embargo relación objeto individuo tren lobo espacio tierra colección espíritus sur mono idea elemento voz hemisferio 
75	0,15016	salón año carácter dama gusto capital personaje atención fortuna asunto sociedad periódico gente aspecto ciudad diario propósito lado forma libro detalle ocasión moda conversación negocio número vista modo belleza objeto importancia muchacho palabra posición tarde título tipo público obra frase presencia edad viudo movimiento condición circunstancia mirada grupo trato fondo 
76	0,01254	años ojos hija veces amigos palabras manos niña días hombres año padres personas cosas edad hijos esposa mujeres carácter meses boca manera tierra embargo labios momentos negocios educación cabeza brazos país jóvenes señorita aire horas historia ideas lágrimas lugar ciudad sentimientos costumbre modo trabajo cara campo vista mañana amor hermana 
77	0,00173	canónigo ciudad doctor puerta clérigo ojos tren aire patio escuela misa licenciado regidor muchachas alegría menudo corredor dama hotel vajilla niñas calor teatro compadre compañero calle música días secretario pueblo gesto calles amigos flores placer par peso lluvia mañana métodos río tranvía ayuda barrio máquina capital gloria multitud alarde frescura 
78	0,48124	palabra razón asunto modo manera efecto motivo embargo idea duda ocasión situación noticia causa interés circunstancia conversación deseo objeto visita falta relación orden lugar conducta confianza camino peligro atención caballero intención amor desgracia lado ánimo costumbre presencia favor principio consejo suerte carácter voluntad plan esperanza propósito fuerza prueba estado secreto 
79	0,00089	calle caballero luz tarde mozo amigos calles lisa labios color anciana años razón juego estudiante compañeros abrigo nariz silencio lado barba juventud muías suerte hija cansancio sota muchacha muchacho cara mulas cadena idea estudio emoción jugadores jóvenes paredes palabras estudiantes trabajo pieza tía edad sombrero sitio taller plata rayos manos 
